PAA Title,Parent,Text,URL,URL Title
Was blockiert die Liebe?,Was macht die Liebe kaputt?,"Die Angst vor Nähe     Gespiegelt wird sie dir durch Partner, die dich auf Distanz halten und dich durch ihre Unverbindlichkeit schier in den Wahnsinn treiben – auf tieferer Ebene ist ihre Unverbindlichkeit nichts anderes als ein Spiegel unserer eigenen Unsicherheit. Wir alle tragen diese Angst vor Nähe in uns! 26 Jun 2017","https://imgegenteil.de/blog/zeit-fuer-heilung-die-top-5-der-liebes-blocker/#:~:text=Die%20Angst%20vor%20N%C3%A4he&text=Gespiegelt%20wird%20sie%20dir%20durch,Angst%20vor%20N%C3%A4he%20in%20uns!",Zeit für Heilung: Die Top 5 der Liebes-Blocker - Im Gegenteil
Wann sollte man sich nicht trennen?,Wie merkt man dass man sich entliebt hat?,"Wenn er ständig Dinge tut, die dich kränken und verletzen. Wenn du dich mehr freust, Zeit ohne den Partner zu verbringen als mit ihm. Wenn ihr überhaupt nicht mehr zusammen lacht. Wenn ihr jenseits von Alltagskram keine gemeinsamen Gesprächsthemen findet. 10 Jun 2022","https://www.womenshealth.de/love/partnerschaft/trennen-ja-oder-nein/#:~:text=Wenn%20er%20st%C3%A4ndig%20Dinge%20tut,Alltagskram%20keine%20gemeinsamen%20Gespr%C3%A4chsthemen%20findet.",Soll ich mich trennen? Entscheidungshilfe! - Women's Health
Wie verhält sich ein Mann der nicht mehr liebt?,Wie merkt man dass man sich entliebt hat?,"Anzeichen wie mangelndes Interesse, häufige Kritik oder wenig körperliche Nähe deuten für viele Frauen darauf hin, dass ihr Mann sie nicht mehr liebt. Am wichtigsten ist in diesem Fall ein offenes Gespräch. 29 May 2020","https://www.elitepartner.de/magazin/meistern/er-liebt-mich-nicht-mehr/#:~:text=Anzeichen%20wie%20mangelndes%20Interesse%2C%20h%C3%A4ufige,diesem%20Fall%20ein%20offenes%20Gespr%C3%A4ch.",„Er liebt mich nicht mehr“: So erkennst du die Veränderung - ElitePartner
Wie merkt man das man sich trennen sollte?,Wie merkt man dass man sich entliebt hat?,"   7 Anzeichen, dass du dich trennen solltest Du fühlst dich nicht wertgeschätzt. Der Gedanke an die Zukunft macht dir Angst. Du fühlst dich alleine. Du bist ständig gereizt. Ihr streitet destruktiv. Du fühlst dich zu anderen Menschen hingezogen. Du willst dich trennen. 26 Feb 2022",https://chrisbloom.de/blog/soll-ich-mich-trennen/,"Soll ich mich trennen? 7 Anzeichen, die für ""Ja"" sprechen - Chris Bloom"
Wie verhält sich ein Mann vor der Trennung?,Wann ist es endgültig vorbei?,"Er hört nicht mehr richtig zu. Bei Streits winkt er ab oder, schlimmer noch, äfft Aussagen nach. Auch alarmierend: Er macht sich vor Anderen über (vermeintliche) Schwächen seiner Partnerin lustig. Er schert sich nicht mehr sonderlich um sein Äußeres. 4 May 2015","https://www.brigitte.de/liebe/beziehung/liebeskrise--10-zeichen-dafuer--dass-die-trennung-kurz-bevorsteht-10195068.html#:~:text=Er%20h%C3%B6rt%20nicht%20mehr%20richtig,mehr%20sonderlich%20um%20sein%20%C3%84u%C3%9Feres.","Liebeskrise: 10 Zeichen dafür, dass die Trennung kurz bevorsteht - Brigitte"
Kann eine Pause eine Beziehung retten?,Wann ist es endgültig vorbei?,"Nach Fremdgehen können Beziehungspausen sinnvoll sein    Bei Affären zum Beispiel sei die Distanz einer Pause durchaus hilfreich – der Betrogene könne sich darüber klar werden, ob er bereit sei, dem Partner zu verzeihen und wieder zu vertrauen. 12 Nov 2019","https://www.stern.de/neon/herz/liebe-sex/beziehungspause--wann-sie-sinnvoll-ist-und-wann-sie-das-ende-nur-hinauszoegert-8998754.html#:~:text=Nach%20Fremdgehen%20k%C3%B6nnen%20Beziehungspausen%20sinnvoll%20sein&text=Bei%20Aff%C3%A4ren%20zum%20Beispiel%20sei,verzeihen%20und%20wieder%20zu%20vertrauen.",Beziehungspause: Wann sie sinnvoll ist und wann sie das Ende nur ...
Wie viele Paare trennen sich und kommen wieder zusammen?,Wann ist es endgültig vorbei?,"Denn viele Paare, die ihre Beziehung beenden, finden am Ende doch wieder zueinander. Demnach ergab eine Studie aus dem Jahr 2013, dass mehr als ein Drittel der Paare, die zusammenleben, und ein Fünftel der verheirateten Paare nach einer Trennung wieder zusammengekommen sind. 30 Apr 2022","https://www.businessinsider.de/leben/beziehung/ihr-seid-nach-einer-trennung-wieder-zusammen-dieser-leitfaden-zeigt-euch-wie-ihr-den-erneuten-weg-in-die-beziehung-in-acht-schritten-meistert-b/#:~:text=Denn%20viele%20Paare%2C%20die%20ihre,einer%20Trennung%20wieder%20zusammengekommen%20sind.",Wieder mit dem Ex zusammen: So klappt eine zweite Beziehung
Wann ist die schwierigste Zeit in einer Beziehung?,Wie schnell vergeht die Liebe?,"Und jetzt haltet euch fest: Das gefährlichste und kritischste Jahr in der Partnerschaft ist demnach das erste! 60 Prozent der Beziehungen, die Rosenfeld auf dem Zettel hatte, zerbrachen noch vor dem ersten Jahrestag – trotz Verliebtheit, Schmetterlinge im Bauch und rosaroter Brille. 16 Nov 2021","https://www.brigitte.de/liebe/beziehung/laut-statistik--die-meisten-paare-trennen-sich-in-diesem-beziehungsjahr-11544588.html#:~:text=Und%20jetzt%20haltet%20euch%20fest,im%20Bauch%20und%20rosaroter%20Brille.",In diesem Beziehungsjahr trennen sich die meisten Paare - Brigitte
In welchem Jahr gehen die meisten Beziehungen kaputt?,Wie schnell vergeht die Liebe?,"Dabei stellte sich heraus: Das gefährlichste und kritischste Jahr in der Partnerschaft ist tatsächlich das erste. 60 Prozent der Beziehungen, die Rosenfeld in seiner Stichprobe beobachtete, zerbrachen noch vor dem ersten Jahrestag – trotz Verliebtheit, Schmetterlingen im Bauch und rosaroter Brille. 27 Aug 2021","https://www.gala.de/lifestyle/liebe/partnerschaft--in-diesem-jahr-scheitern-laut-statistik-die-meisten-beziehungen-22497448.html#:~:text=Dabei%20stellte%20sich%20heraus%3A%20Das,im%20Bauch%20und%20rosaroter%20Brille.",In diesem Jahr scheitern laut Statistik die meisten Beziehungen - GALA.de
Wie Entliebt sich ein Mann?,Wie schnell vergeht die Liebe?,"Typische Anzeichen dafür, dass du dich bereits unbewusst entliebt hast: Du befindest dich in einer langen Partnerschaft und spüren immer stärker, dass ihr nicht mehr zueinander passt. Du hast dich auf eine Affäre eingelassen. Nach den ersten verliebten Monaten kannst du dir keine Zukunft mit deinem Partner vorstellen. 12 Aug 2020","https://www.elitepartner.de/magazin/meistern/entlieben/#:~:text=Typische%20Anzeichen%20daf%C3%BCr%2C%20dass%20du,Zukunft%20mit%20deinem%20Partner%20vorstellen","Entlieben: Wie es dir gelingt, die Gefühle loszulassen - ElitePartner"
Wann ist es zu spät um eine Beziehung zu retten?,Ist Abstand gut für eine Beziehung?,"Wenn es keinen Teil mehr in uns gibt, der unseren Partner liebt, ihm nah sein möchte und zusammen mit ihm alt werden will, ist es zu spät für diese Liebe. Nach wenigen weiteren Jahren geht es für den Partner, der um Paartherapie gebeten hat, nicht mehr weiter.","https://www.eft-paartherapie-hannover.de/wann-ist-es-zu-spaet/#:~:text=Wenn%20es%20keinen%20Teil%20mehr,gebeten%20hat%2C%20nicht%20mehr%20weiter.",Wann ist es zu spät? - EFT Paartherapie Hannover
Wann sollte man um eine Beziehung kämpfen?,Ist Abstand gut für eine Beziehung?,"Gerade durch eine räumliche Distanz merkst du vielleicht erst, wie wichtig dir dein (Ex)-Partner eigentlich noch ist und dass es sich lohnt, für die Liebe zu kämpfen. Wichtigste Voraussetzung dafür ist allerdings, dass beide Partner gleichermaßen daran interessiert sind, die Beziehung zu retten. 22 Feb 2019","https://www.elitepartner.de/magazin/meistern/beziehung-retten/#:~:text=Gerade%20durch%20eine%20r%C3%A4umliche%20Distanz,sind%2C%20die%20Beziehung%20zu%20retten.","Beziehung retten: 11 Tipps, wann es sich lohnt zu kämpfen - ElitePartner"
Welche Signale drücken Ablehnung aus?,Welche Körpersprache signalisiert eher Unsicherheit?,Zusammengepresste Lippen und nach unten gezogene Mundwinkel drücken Ablehnung und Misstrauen aus. Ein Lächeln ist in allen Kulturen ein positives Signal. 23 Oct 2017,"https://www.bei-training.com/koerpersprache-die-signale-verstehen/#:~:text=Zusammengepresste%20Lippen%20und%20nach%20unten,allen%20Kulturen%20ein%20positives%20Signal.",Körpersprache: Die Signale verstehen - BEITRAINING
Was bedeutet es wenn jemand keinen Augenkontakt halten kann?,Welche Körpersprache signalisiert eher Unsicherheit?,"Wenn du in einem Gespräch den Blickkontakt vermeidest, wirkst du, als ob du etwas zu verbergen hättest. Dem Gegenüber nicht in die Augen zu schauen, weist auf mangelndes Selbstbewusstsein oder Desinteresse hin. Vermeide, an deinem Gesprächspartner vorbei oder beim Nachdenken nach oben zu schauen.","https://sevdesk.de/blog/koerpersprache/#:~:text=Wenn%20du%20in%20einem%20Gespr%C3%A4ch,Nachdenken%20nach%20oben%20zu%20schauen.","Körpersprache - 7 Gesten, die Sie unbedingt vermeiden sollten"
Welche Körpersprache signalisiert eher Unsicherheit?,Warum kein Augenkontakt?,"Ein stetig oder häufig zu Boden gesenkter Blick, hin und her flirrende, suchende Augen, zusammen- beziehungsweise hochgezogene Augenbrauen oder demonstratives Wegsehen sind Zeichen für Unsicherheit, Ignoranz oder sogar Provokation.","https://www.berufsstrategie.de/bewerbung-karriere-soft-skills/gestik-mimik.php#:~:text=Ein%20stetig%20oder%20h%C3%A4ufig%20zu,Unsicherheit%2C%20Ignoranz%20oder%20sogar%20Provokation.","Gestik und Mimik - Körpersprache von Auge, Mund und Hände"
Warum schaut er mir immer so tief in die Augen?,Warum kein Augenkontakt?,"Er schaut Ihnen in die Augen    Wenn er sich zu Ihnen hingezogen fühlt, kann ein intensiver Blickkontakt ein Indiz dafür sein, dass er Interesse an Ihnen hat. Er signalisiert, dass er seine komplette Aufmerksamkeit Ihnen schenken möchte. 7 Feb 2021","https://www.freundin.de/liebe-koerpersignale-verliebt-oder-nicht#:~:text=Er%20schaut%20Ihnen%20in%20die%20Augen&text=Wenn%20er%20sich%20zu%20Ihnen,komplette%20Aufmerksamkeit%20Ihnen%20schenken%20m%C3%B6chte.","5 Körpersignale, dass er verliebt ist - und 5, dass er es nicht ist - Freundin"
Was sollte man in der Kommunikation vermeiden?,Welche Körpersprache fördert die Kommunikation?,"   Vermeiden kann man dies, wenn man einige einfache Regeln beachtet: Nicht verallgemeinern. Bestimmte Aussagen sind Gift für eine erfolgreiche Kommunikation. ...  Ich-Aussagen. Viele sprechen gar nicht konkret von dem, was sie persönlich wollen. ...  Die Signale beobachten. ...  Fragen stellen. ...  Richtig zuhören. 12 Jan 2017",https://www.faktumblog.de/2017/01/missverstaendnisse-in-der-kommunikation-vermeiden/,Missverständnisse in der Kommunikation vermeiden
Was stört die Kommunikation?,Welche Körpersprache fördert die Kommunikation?,"Mögliche Störungen    Störungen bei der Signalübertragung vom Sender zum Empfänger durch eine laute Geräuschkulisse, Ablenkungen, Sichtbehinderungen (bei nonverbaler Kommunikation), Signalunterbrechungen. fehlerhaftes Empfangen der Nachricht durch Beeinträchtigungen des Hörens oder falsche Interpretation der Nachricht. 28 Oct 2019","https://www.channelpartner.de/a/kennen-sie-die-wichtigen-grundprinzipien-in-der-kommunikation,241502,2#:~:text=M%C3%B6gliche%20St%C3%B6rungen&text=St%C3%B6rungen%20bei%20der%20Signal%C3%BCbertragung%20vom,oder%20falsche%20Interpretation%20der%20Nachricht.",Die wichtigsten Grundprinzipien in der Kommunikation - ChannelPartner
Welche Körpersprache fördert die Kommunikation?,Welche Signale drücken Ablehnung aus?,"Mimik, Gestik, Haltung und Bewegung, die räumliche Beziehung, Berührungen und die Kleidung sind wichtige Mittel der nonverbalen Kommunikation – eine uralte Form der zwischenmenschlichen Verständigung. 20 Jan 2021","https://www.planet-wissen.de/gesellschaft/kommunikation/koerpersprache/index.html#:~:text=Mimik%2C%20Gestik%2C%20Haltung%20und%20Bewegung,uralte%20Form%20der%20zwischenmenschlichen%20Verst%C3%A4ndigung.",Körpersprache - Kommunikation - Gesellschaft - Planet Wissen
Wie kann man ohne Worte kommunizieren?,Welche Signale drücken Ablehnung aus?,"Die nonverbale Kommunikation ist der Anteil einer Unterhaltung, der nicht aktive Sprache ist. Sie funktioniert über bestimmte Kanäle, wie etwa Mimik, Gestik, Körperhaltung und Stimme. Sie kann absichtlich oder unabsichtlich erfolgen und bewusst oder unbewusst wahrgenommen werden. 26 Nov 2019","https://blog.hubspot.de/sales/nonverbale-kommunikation#:~:text=Die%20nonverbale%20Kommunikation%20ist%20der,bewusst%20oder%20unbewusst%20wahrgenommen%20werden.",Nonverbale Kommunikation: Wie wir uns ohne Worte verständigen
Wie sieht man Liebe in den Augen?,Was passiert wenn man sich sehr lange in die Augen schaut?,"Ein verliebtes Pärchen erkennt man daran, dass die Augen ganz auf den anderen gerichtet sind. Die Pupillen werden deutlich größer. „Das Hirn sagt: Ich bemühe mich, mehr Daten reinzulassen“, erläutert Stefan Verra, Experte für Körpersprache. Pupillen weiten sich etwa bei Freude oder sexueller Erregung. 7 Feb 2020","https://www.edel-optics.de/b/love-is-in-the-eye/#:~:text=Ein%20verliebtes%20P%C3%A4rchen%20erkennt%20man,bei%20Freude%20oder%20sexueller%20Erregung.",Love is in the eye - Was uns (Augen)paare verraten
Wie sehen verliebte Augen aus?,Was passiert wenn man sich sehr lange in die Augen schaut?,"Augen: Erweiterte Pupillen weisen auf Verlangen hin. Zusätzlich schaut er Sie immer wieder an, auch wenn Sie gerade nicht sprechen. Hände: Achten Sie auf die Bewegung seiner Hände. 27 Dec 2022","https://praxistipps.chip.de/koerpersprache-wenn-man-sich-verliebt-das-sind-die-signale_118985#:~:text=Augen%3A%20Erweiterte%20Pupillen%20weisen%20auf,auf%20die%20Bewegung%20seiner%20H%C3%A4nde.","Körpersprache, wenn man sich verliebt: Das sind die Signale - CHIP"
Kann man Gefühle in den Augen sehen?,Was passiert wenn man sich sehr lange in die Augen schaut?,"Selbst wenn wir unsere Gefühle manchmal angestrengt verstecken wollen, unsere Augen verraten uns fast immer. Sind wir beispielsweise überrascht oder freuen uns über etwas, kann unser Gegenüber das an unseren Pupillen ablesen. So lässt sich auch erkennen, ob die Emotionen aufrichtig sind. 24 Feb 2017","https://www.businessinsider.de/wissenschaft/ihr-koennt-die-gefuehle-der-anderen-menschen-tatsaechlich-an-ihren-augen-ablesen-2017-2/#:~:text=Selbst%20wenn%20wir%20unsere%20Gef%C3%BChle,ob%20die%20Emotionen%20aufrichtig%20sind.",Ihr könnt die Gefühle der anderen Menschen tatsächlich an ihren ...
Was bedeutet es wenn man beim Reden nach oben schaut?,Was bedeutet es wenn jemand beim Sprechen die Augen schließt?,"NLP zufolge lügt ein Mensch, der nach rechts oben blickt, während eine Person mit Blick nach links oben die Wahrheit spricht. In einem ersten Experiment testeten die Forscher nun 32 Rechtshänder. Bei ihnen sollten diesen Annahmen zufolge die Lüge und der Blick nach rechts eng verknüpft sein. 12 Jul 2012","https://www.spiegel.de/wissenschaft/mensch/luegner-lassen-sich-nicht-am-blick-erkennen-a-844025.html#:~:text=NLP%20zufolge%20l%C3%BCgt%20ein%20Mensch,nach%20rechts%20eng%20verkn%C3%BCpft%20sein.",Lügner lassen sich nicht am Blick erkennen - DER SPIEGEL
Warum fällt es mir schwer Augenkontakt zu halten?,Was bedeutet es wenn jemand beim Sprechen die Augen schließt?,"Warum fällt manchen Augenkontakt schwer? Es gibt viele Menschen, denen (anhaltender) Augenkontakt schwerfällt. Schüchternheit, Unsicherheit und Nervosität sind die häufigsten Gründe dafür. Manchmal symbolisiert der abschweifende Blick aber auch schlicht Langeweile. 25 Nov 2021","https://karrierebibel.de/blickkontakt/#:~:text=Warum%20f%C3%A4llt%20manchen%20Augenkontakt%20schwer,Blick%20aber%20auch%20schlicht%20Langeweile.",Blickkontakt Psychologie: Bedeutung + optimale Dauer - Karrierebibel
Was bedeutet es wenn jemand die Augenbrauen hoch zieht?,Was bedeutet es wenn jemand beim Sprechen die Augen schließt?,"Augenbrauen hochziehen    Beim Sprechen wird das Hochziehen der Augenbrauen häufig benutzt, um etwas zu betonen. Tritt die Expression beim Zuhören auf, kann sie Ungläubigkeit, Skepsis oder Zweifel signalisieren oder auch Erstaunen (dann meist begleitet durch eine leichte Nach-vorne-Bewegung des Kopfes).","https://www.wiwo.de/erfolg/management/mimik-sieben-signale/10887002-2.html#:~:text=Augenbrauen%20hochziehen,vorne%2DBewegung%20des%20Kopfes).",Mimik: Sieben Signale - WirtschaftsWoche
Was sind typische Kommunikationsfehler?,Was sollte man in der Kommunikation vermeiden?,"   Kommunikationsfehler: nicht ausreden lassen/nicht zuhören     Nummer eins bei den Kommunikationsstörungen ist hier, wenn der andere oder die andere uns nicht ausreden lässt und man so den Eindruck bekommt, der Gesprächspartner oder die Gesprächspartnerin hört uns nicht richtig zu.","https://wirksam-kommunizieren.de/5-haeufige-kommunikationsfehler/#:~:text=Kommunikationsfehler%3A%20nicht%20ausreden%20lassen%2Fnicht%20zuh%C3%B6ren,-Im%20Rahmen%20meiner&text=Nummer%20eins%20bei%20den%20Kommunikationsst%C3%B6rungen,h%C3%B6rt%20uns%20nicht%20richtig%20zu.",5 häufige Kommunikationsfehler kennen und vermeiden
Wie erkennt man Kommunikationsprobleme?,Was sollte man in der Kommunikation vermeiden?,"Zu den häufigsten Kommunikationsproblemen gehören Missverständnisse, unklare Aussagen und Fehlinterpretationen. Meist geschieht dies durch unaufmerksames Zuhören von Gesprächspartnern oder ungleicher Qualifikation des Sprachniveaus und des Sprachverständnisses beider Personen eines Dialoges.","https://blog.neuronation.com/de/kommunikationsprobleme/#:~:text=Zu%20den%20h%C3%A4ufigsten%20Kommunikationsproblemen%20geh%C3%B6ren,Sprachverst%C3%A4ndnisses%20beider%20Personen%20eines%20Dialoges.",Kommunikationsprobleme im Alltag vermeiden - NeuroNation
Was ist das Wichtigste bei Kommunikation?,Was sollte man in der Kommunikation vermeiden?,"Wichtige Bestandteile sind das Zuhören, eine offene, respektvolle Haltung, bewusstes Innehalten bei Irritationen sowie klare, authentische Aussagen. Wenn Sie Ihre Botschaft genau vermitteln können, Ihr Ziel erreichen und Ihrem Gesprächspartner dabei ein gutes Gefühl geben können, kommunizieren Sie gut. 20 Jan 2023","https://blog.hubspot.de/service/gute-kommunikation#:~:text=Wichtige%20Bestandteile%20sind%20das%20Zuh%C3%B6ren,geben%20k%C3%B6nnen%2C%20kommunizieren%20Sie%20gut.",Gute Kommunikation: Sieben Tipps für erfolgreiche Gespräche
Was verbessert die Kommunikation?,Was stört die Kommunikation?,II. Tipps für verbesserte Kommunikation Nehmen Sie sich Zeit! ...  Lassen Sie sich nicht ablenken! ...  „Ich empfinde...“ ...  Hören Sie bewusst zu! ...  Wiederholen Sie zuerst und setzen dann erst den Gedanken des Gesprächspartners fort! ...  Arbeiten Sie zusammen! ...  Gehen Sie es Stück für Stück an! ...  Drücken Sie sich klar aus! More items...,https://www.studierendenberatung.at/persoenlichkeitsentwicklung/kommunikation-verbessern/tipps-fuer-verbesserte-kommunikation/,Tipps für verbesserte Kommunikation - Psychologische Studentenberatung
Wann geht Kommunikation schief?,Was stört die Kommunikation?,"Fehlkommunikation entsteht oft durch eine falsche Ausrichtung von expliziter und impliziter Bedeutung zwischen Sender und Empfänger. Manche Menschen kommunizieren direkt, andere erwarten von Ihnen, dass Sie zwischen den Zeilen lesen. Wenn Sie Ihre Nachrichten explizit formulieren, vermeiden Sie Missverständnisse. 22 Dec 2017","https://www.userlike.com/de/blog/missverstaendnisse-in-der-kommunikation#:~:text=Fehlkommunikation%20entsteht%20oft%20durch%20eine,explizit%20formulieren%2C%20vermeiden%20Sie%20Missverst%C3%A4ndnisse.",Missverständnisse in der Kommunikation – 8 Ursachen und ...
Was sind die größten Fehler in der Kommunikation?,Was stört die Kommunikation?,"Fehler 1: Erwartungen sind nicht geklärt     Menschen müssen ganz genau wissen, was von ihnen erwartet wird. Wenn ein Verkäufer nicht weiß, dass er A, B und C erledigen soll, dann wird er es wahrscheinlich nicht mit vollem Elan erledigen. Darum brauchen Verkäufer klare Ziele. 9 May 2017","https://www.marconomy.de/die-10-haeufigsten-fehler-in-der-kommunikation-a-606219/#:~:text=Fehler%201%3A%20Erwartungen%20sind%20nicht,Darum%20brauchen%20Verk%C3%A4ufer%20klare%20Ziele.",Die 10 häufigsten Fehler in der Kommunikation - Marconomy
Was sind die 3 Grundregeln der Kommunikation?,Was verbessert die Kommunikation?,Gesprächsführung – Grundlegende Kommunikationsregeln / 3 Regeln für das Mitarbeitergespräch 3.1 Jeder soll gewinnen. ...  3.2 Wertschätzung gegenüber dem Gesprächspartner. ...  3.3 Glaubwürdigkeit. ...  3.4 Kein Zeitdruck. ,https://www.haufe.de/personal/haufe-personal-office-platin/gespraechsfuehrung-grundlegende-kommunikationsregeln-3-regeln-fuer-das-mitarbeitergespraech_idesk_PI42323_HI583053.html,Gesprächsführung – Grundlegende Kommunikationsregeln / 3 Regeln ...
Wie zeigt sich gute Kommunikationsfähigkeit?,Was verbessert die Kommunikation?,"Dazu gehört gutes Zuhören sowie Signale wie Mimik, Gestik und Körperhaltung zu entschlüsseln und entsprechend darauf zu reagieren. Als kommunikationsfähig erweist sich derjenige, ""der mit anderen gut kann"". Kommunikationsfähigkeit bedeutet aber auch, Informationen rechtzeitig an den richtigen Ort zu bringen.","https://www.monster.at/karriereberatung/artikel/kommunikationsfaehigkeit-028991kjat#:~:text=Dazu%20geh%C3%B6rt%20gutes%20Zuh%C3%B6ren%20sowie,den%20richtigen%20Ort%20zu%20bringen.",Soft Skills: Kommunikationsfähigkeit - Monster.at
Wie kann ich positiv kommunizieren?,Was verbessert die Kommunikation?,Positive Kommunikation Lächeln Sie! ...  Sprechen Sie täglich einem Mitmenschen ein Lob aus. ...  Zeigen Sie Verständnis für Ihre Mitmenschen und motivieren sie. ...  Verabschieden Sie sich von Verallgemeinerungen. ...  Streichen Sie das Wort „nicht“ aus Ihrem Wortschatz. ,https://www.wortreich-badhersfeld.de/das-wortreich/positive-kommunikation/,Positive Kommunikation – ein Muss! - wortreich in Bad Hersfeld
Welche 4 Elemente gehören zur Kommunikation?,Was sind die 3 Grundregeln der Kommunikation?,"4 Arten der Kommunikation Nonverbale Kommunikation. Es ist interessant festzustellen, dass die nonverbale Kommunikation sowohl absichtlich als auch unabsichtlich eingesetzt wird. ...  Verbale Kommunikation. ...  Schriftliche Kommunikation. ...  Visuelle Kommunikation. 19 Jan 2021",https://www.valamis.com/de/hub/kommunikationsformen,"4 Arten der Kommunikation: Verbal, Nonverbal, Schriftlich, Visuell"
Was sind die 4 Ebenen der Kommunikation?,Was sind die 3 Grundregeln der Kommunikation?,"   Nach dem Kommunikationsmodell hat jede Nachricht vier Seiten: Sachebene, Selbstoffenbarung, Beziehung und Appell. 30 Jul 2020","https://www.bachelorprint.de/methodik/4-ohren-modell/#:~:text=Nach%20dem%20Kommunikationsmodell%20hat%20jede,%2C%20Selbstoffenbarung%2C%20Beziehung%20und%20Appell.",Das Vier-Ohren-Modell - Klassisches Kommunikationsmodell
Wie wollen wir miteinander kommunizieren?,Was sind die 3 Grundregeln der Kommunikation?,"Die fünf grundlegenden Kommunikationsarten sind die verbale, nonverbale, paraverbale, schriftliche und visuelle Kommunikation.","https://www.personio.de/hr-lexikon/kommunikationsarten/#:~:text=Die%20f%C3%BCnf%20grundlegenden%20Kommunikationsarten%20sind,paraverbale%2C%20schriftliche%20und%20visuelle%20Kommunikation.","Kommunikationsarten: Definition, Übersicht und Beispiele - Personio"
Was bedeutet es wenn sich jemand am Ohr zupft?,Wie kommuniziert man ohne zu reden?,"Es ist spannend zu beobachten, wie eine Person sich am Ohr zupft, während sie etwas berichtet, ihre Augen den Kontakt zum Gegenüber nicht halten können oder sie durch ihre Körperhaltung eine Barriere aufbaut.","https://www.redenwelt.de/rede-tipps/koerpersprache-bedeutung/#:~:text=Es%20ist%20spannend%20zu%20beobachten,ihre%20K%C3%B6rperhaltung%20eine%20Barriere%20aufbaut.",Körpersprache: Das verrät die nonverbale Kommunikation über uns
Wohin schauen beim Reden?,Wie kommuniziert man ohne zu reden?,"Die schnellen, wechselnden Augenbewegungen wirken jedoch hektisch und unsicher. Daher ist es ratsam, auf ein Auge zu schauen. Eine andere Möglichkeit besteht darin, den Blick auf den Nasenrücken des Anderen zu fokussieren. Zudem solltest du darauf achten, deinen Gesprächspartnern nicht zu tief in die Augen zu schauen.","https://www.absolventa.de/karriereguide/koerpersprache/blickkontakt#:~:text=Die%20schnellen%2C%20wechselnden%20Augenbewegungen%20wirken,in%20die%20Augen%20zu%20schauen.",Blickkontakt richtig einsetzen und deuten. - Absolventa
Was bedeutet Hand vor dem Mund?,Wie kommuniziert man ohne zu reden?,"Die Hand vor dem Mund des Sprechenden signalisiert, dass die Worte nicht den Mund verlassen sollten. Die „Hand-vor-dem-Mund-Geste“ wird oftmals auch versucht, durch ein künstliches Husten unbemerkbar zu machen. 25 Jun 2008","https://www.deubner-recht.de/news/sonstige-themen/details/artikel/koerpersprache-was-dein-gegenueber-ungewollt-ausdrueckt.html#:~:text=Die%20Hand%20vor%20dem%20Mund,k%C3%BCnstliches%20Husten%20unbemerkbar%20zu%20machen.",Körpersprache – Was Dein Gegenüber ungewollt ausdrückt
Was macht Kommunikation so schwierig?,Was sind Kommunikationsregeln?,"Weshalb ist es oft so schwierig, miteinander zu reden? Wir mögen die gleiche Sprache sprechen und einander, oberflächlich betrachtet, verstehen. Da wir uns aber immer, mehr oder minder bewusst, auf vier Ebenen begegnen, lauern da unentwegt Missverständnisse.","https://www.geo.de/magazine/geo-wissen/16298-rtkl-konflikte-wie-das-miteinander-reden-besser-gelingt-schulz-von-thun#:~:text=Weshalb%20ist%20es%20oft%20so,begegnen%2C%20lauern%20da%20unentwegt%20Missverst%C3%A4ndnisse.",Schulz von Thun: Wie Kommunikation besser gelingt - GEO
