PAA Title,Parent,Text,URL,URL Title
Wann liebt eine Frau einen Mann?,Wie erkennt man die wahre Liebe?,"Wenn sie Umwege macht, um Sie zu sehen, etwas für Sie erledigt, ohne dass Sie darum gebeten haben oder etwas tut, nur um Ihnen eine Freude zu machen, stehen alle Zeichen auf Liebe!","https://lemonswan.de/ratgeber/partnersuche/liebt-sie-mich#:~:text=Wenn%20sie%20Umwege%20macht%2C%20um,stehen%20alle%20Zeichen%20auf%20Liebe!","Liebt sie mich? 8 Anzeichen, die dafür sprechen und ein Selbsttest"
Wann ist es zu spät für eine Paartherapie?,Wie viele Paare trennen sich nach einer Paartherapie?,"An welchem Zeitpunkt einer Krise oder Beziehung sollte man einen Paartherapeuten aufsuchen? Aus Sicht der Experten gehen viele Paare zu spät zu einem Therapeuten - nämlich dann, wenn die Beziehung schon so marode ist, dass sie nicht mehr zu retten ist, wie Bernd Boettger sagt. 29 Jul 2016","https://www.sueddeutsche.de/leben/familie-alles-ueber-paartherapie-anfang-vom-ende-oder-letzte-rettung-dpa.urn-newsml-dpa-com-20090101-160721-99-768263#:~:text=An%20welchem%20Zeitpunkt%20einer%20Krise,ist%2C%20wie%20Bernd%20Boettger%20sagt.",Familie - Alles über Paartherapie: Anfang vom Ende oder letzte Rettung
Wann ist die Ehe nicht mehr zu retten?,Wie viele Paare trennen sich nach einer Paartherapie?,"   Wann kann man eine Ehe nicht mehr retten? Wenn beide Partner aufgegeben haben, kann man eine ehe nicht mehr retten. Oder wenn beide nicht bereit sind an ihrem eigenen Verhalten zu arbeiten, sondern sich nicht davon abbringen lassen, auf Änderungen vom Partner zu warten.","https://lovomi.de/ehe-retten/#:~:text=Wann%20kann%20man%20eine%20Ehe,%C3%84nderungen%20vom%20Partner%20zu%20warten.",Ehe Retten: Die 5 entscheidenden Bausteine + Selbsttest - Lovomi
In welcher Phase trennen sich die meisten Paare?,Wie viele Paare trennen sich nach einer Paartherapie?,"Immer häufiger trennen sich Paare in den ersten drei Beziehungsphasen, weil es ihnen an Verständnis und Akzeptanz fehlt. In dieser Phase hat die Beziehung bereits alle Höhen und Tiefen durchlebt. Es sind viele Dinge passiert, die einen zusammengeschweißt haben.","https://www.forschung-und-wissen.de/magazin/die-5-phasen-der-liebe-in-einer-beziehung-13372118#:~:text=Immer%20h%C3%A4ufiger%20trennen%20sich%20Paare,passiert%2C%20die%20einen%20zusammengeschwei%C3%9Ft%20haben.",Die 5 Phasen der Liebe in einer Beziehung - Forschung und Wissen
Was sind typische Eheprobleme?,Wann ist die Ehe nicht mehr zu retten?,"Neben Eifersucht, unterschiedlichen Einstellungen zu Geldfragen, verschiedenen Auffassungen zu Nähe, Problemen mit Kindern oder mit den Eltern oder Schwiegereltern kann auch die nach Jahren eintretende Routine zu Problemen führen.","https://www.ehe.de/eheprobleme.html#:~:text=Neben%20Eifersucht%2C%20unterschiedlichen%20Einstellungen%20zu,eintretende%20Routine%20zu%20Problemen%20f%C3%BChren.",EHEPROBLEME: Was sind Ursachen? - EHE.de
Kann eine schlechte Ehe krank machen?,Wann ist die Ehe nicht mehr zu retten?,"Eine unglückliche Ehe belastet nicht nur psychisch, sondern löst auch Herzerkrankungen aus. Besonders bei älteren Menschen und Frauen wird das Herz geschwächt, wenn die Partnerschaft bekümmert. Vergangene Studie beschäftigten sich mit der Gesundheit von Singles und verglichen diese mit verheirateten Paaren. 17 Feb 2015","https://www.gesund.at/beziehung/herz-krank-ehe-schlecht/#:~:text=Eine%20ungl%C3%BCckliche%20Ehe%20belastet%20nicht,verglichen%20diese%20mit%20verheirateten%20Paaren.",Schlechte Ehe macht krank » Herz leidet unter Liebeskummer
Wann lohnt es sich nicht mehr zu kämpfen?,Wann ist die Ehe nicht mehr zu retten?,"«Wenn etwas immer wieder hochkommt, dass sich nicht mehr reparieren lässt», meint Kuhn. Oder aber wenn es in einer Beziehung viel Verachtung und Respektlosigkeit gibt, ist das ein Zeichen dafür, dass man eine Trennung in Erwägung ziehen sollte.","https://www.blick.ch/life/liebe/aufgeben-oder-weitermachen-wie-lange-sollte-man-um-eine-beziehung-kaempfen-id15767338.html#:~:text=%C2%ABWenn%20etwas%20immer%20wieder%20hochkommt,Trennung%20in%20Erw%C3%A4gung%20ziehen%20sollte.","Das sind die Anzeichen, dass Sie Beziehung Ihre beenden sollen - Blick"
Wie viele Paare trennen sich nach Paartherapie?,Für wen ist eine Paartherapie sinnvoll?,"Auch eine konstruktive Trennung kann hilfreich sein und wird in der modernen Ergebnisforschung entsprechend bewertet. Vereinfacht gesagt, sind etwa zwei Drittel der Paartherapien erfolgreich, das heißt etwa 66 von 100 Paaren erleben irgendeine Verbesserung. 17 May 2010","https://www.sueddeutsche.de/wissen/paartherapie-66-prozent-erleben-irgendeine-besserung-1.456782#:~:text=Auch%20eine%20konstruktive%20Trennung%20kann,100%20Paaren%20erleben%20irgendeine%20Verbesserung.",Paartherapie - ""66 Prozent erleben irgendeine Besserung"" - Wissen
Wie viel kostet eine Stunde Paartherapie?,Für wen ist eine Paartherapie sinnvoll?,"Bei einem seriösen und zertifizierten Therapeuten liegen die Kosten bei 80 bis 200€ pro Therapiestunde, je nach Dauer und Form der Paartherapie. Beachten Sie, ob die Abrechnung für 60 oder 90 Minuten Beratungszeit gilt. 5 May 2022","https://www.commerzbank.de/ratgeber/familie/was-kostet-eine-paartherapie/#:~:text=Bei%20einem%20seri%C3%B6sen%20und%20zertifizierten,oder%2090%20Minuten%20Beratungszeit%20gilt.",Kosten einer Paartherapie in der Übersicht - Commerzbank
Wann lohnt sich noch eine Paartherapie?,Für wen ist eine Paartherapie sinnvoll?,"   Bei folgenden Problemen ist eine Paartherapie sinnvoll    Konflikte und Krisen, in denen der Streit so weit eskaliert ist, dass beide keinen Weg mehr sehen, wie es weitergehen könnte und nicht mehr in der Lage sind, gemeinsam konstruktiv nach Lösungen zu suchen.","https://www.therapie.de/psyche/info/therapie/paartherapie/merkmale-vorteile-erfolgsaussichten/#:~:text=Bei%20folgenden%20Problemen%20ist%20eine%20Paartherapie%20sinnvoll&text=Konflikte%20und%20Krisen%2C%20in%20denen,konstruktiv%20nach%20L%C3%B6sungen%20zu%20suchen","Paartherapie: Merkmale, Vorteile, Erfolgsaussichten - Therapie.de"
Kann eine Eheberatung wirklich helfen?,Wann hat eine Paartherapie keinen Sinn?,"Eine Paartherapie ist eine psychotherapeutische Methode zur Klärung partnerschaftlicher Konflikte. Wenn die Probleme sich festgefahren haben, die Fronten verhärtet sind und das gegenseitige Verständnis der Partner füreinander abhanden gekommen ist, kann die Paartherapie helfen, den Knoten zu lösen. 23 Aug 2021","https://www.netdoktor.de/therapien/psychotherapie/paartherapie/#:~:text=Eine%20Paartherapie%20ist%20eine%20psychotherapeutische,helfen%2C%20den%20Knoten%20zu%20l%C3%B6sen.","Paartherapie: Methode, Anwendung, Wirkung - NetDoktor.de"
Welche Fragen stellt der paartherapeut?,Wann hat eine Paartherapie keinen Sinn?,   Beginnen wir mit einigen möglichen Fragen für die erste Sitzung: 1 – Wie lange sind Sie schon ein Paar? ...  3 – Waren Sie schon einmal in einer Paartherapie? ...  5 – Was erwarten Sie sich von dieser Paartherapie? ...  7 – Was ist für Sie derzeit das größte Problem in der Beziehung? More items... • 10 Feb 2021,https://clevermemo.com/blog/paartherapie-fragen-paarberatung-systemische-paartherapie/,57 Paartherapie Fragen – Für die Paarberatung und systemische ...
Kann man Liebe wieder aufbauen?,Wann hat eine Paartherapie keinen Sinn?,"Denn auch wenn die Liebe gelitten hat, kann sie wiederaufleben. Wenn die Chemie oder die Basis stimmt, ist es nämlich durchaus möglich, sich mit jemandem neu einzulassen. Der Liebe noch eine Chance geben und neu füreinander entdecken, ja, das kann funktionieren. Herzaubern kann die Flamme aber niemand. 16 May 2018","https://www.cosmopolitan.de/trennen-oder-bleiben-kann-man-lernen-jemanden-wieder-zu-lieben-83070.html#:~:text=Denn%20auch%20wenn%20die%20Liebe,kann%20die%20Flamme%20aber%20niemand.","Trennen oder bleiben: Kann man lernen, jemanden wieder zu lieben?"
Wie viele Sitzungen Paartherapie?,Wann ist es zu spät für eine Paartherapie?,Eine Paartherapie ist eine auf kurze Zeit ausgerichtete Therapiemaßnahme. Viele Paare berichten über eine deutliche Besserung ihrer Beziehung nach 2-3 Sitzungen und beenden die Paartherapie meist nach 5-6 Sitzungen.,"https://www.einxzwei-paartherapie.de/ihr-termin/ablauf-einer-paartherapie/#:~:text=Dauer%20der%20Paartherapie-,Eine%20Paartherapie%20ist%20eine%20auf%20kurze%20Zeit%20ausgerichtete%20Therapiema%C3%9Fnahme.,meist%20nach%205%2D6%20Sitzungen.","Ablauf, Dauer und Inhalt der Paartherapie"
Was passiert in der Eheberatung?,Wann ist es zu spät für eine Paartherapie?,"in der Paartherapie erkennen, was genau Ihre eigenen Bedürfnisse und die des Partners bzw. der Partnerin sind; wie Sie besser darüber sprechen und wie Sie mit gegensätzlichen Bedürfnissen besser umgehen können.","https://www.drweyers.de/paartherapie-eheberatung/wichtigste-fragen-paartherapie-eheberatung#:~:text=in%20der%20Paartherapie%20erkennen%2C%20was,gegens%C3%A4tzlichen%20Bed%C3%BCrfnissen%20besser%20umgehen%20k%C3%B6nnen.",Die 11 wichtigsten Fragen zu Paartherapie & Eheberatung
Kann man alleine zur Eheberatung?,Wann ist es zu spät für eine Paartherapie?,"Eine Paartherapie alleine bietet dir einen sicheren Rahmen, um deine Bedürfnisse zu platzieren und kann auch bei möglichen Entscheidungsprozessen helfen - und ist manchmal sogar ein Akt der Selbstliebe. 2. Du kannst selbst ins Tun kommen und fühlst dich nicht mehr hilflos und alleine. 24 Jul 2020","https://lovemoves.de/paartherapie-blog/paartherapie-ueberreden-allein#:~:text=Eine%20Paartherapie%20alleine%20bietet%20dir,nicht%20mehr%20hilflos%20und%20alleine.",Soll ich meine bessere Hälfte zur Paartherapie überreden oder lieber ...
Warum will mein Mann nicht zur Paartherapie?,Kann man alleine zur Paartherapie gehen?,"Der Weg zur Paartherapie impliziert für manche Männer, dass sie nicht selbst mit ihrer Partnerschaft und auftretende Unsicherheiten klarkommen. Sie sehen eine Beratung daher nicht als positiven Ansatz, um die Beziehung zu retten, sondern eher als Niederlage. 10 May 2021","https://www.lebensidealisten.de/blog/warum-wollen-maenner-keine-paartherapie/#:~:text=Der%20Weg%20zur%20Paartherapie%20impliziert,retten%2C%20sondern%20eher%20als%20Niederlage.",Warum wollen Männer keine Paartherapie? - Lebensidealisten
Wie oft muss man zur Paartherapie?,Kann man alleine zur Paartherapie gehen?,"Behandlungsdauer von Paarberatung im Durchschnitt    10 % der Paare profitieren bei 1–2 Paarterminen. 50 % der Paare nutzen etwa sechs Sitzungen, um sich als Paar näherzukommen und die Veränderungen in der Beziehung weiterzuführen.","https://www.paarberatung-in-berlin.de/faqs/dauer-paartherapie-eheberatung#:~:text=Behandlungsdauer%20von%20Paarberatung%20im%20Durchschnitt,Ver%C3%A4nderungen%20in%20der%20Beziehung%20weiterzuf%C3%BChren.",Wie lang dauert eine Paartherapie? - Paarberatung in Berlin
Wer trägt die Kosten für eine Paartherapie?,Kann man alleine zur Paartherapie gehen?,Paartherapie-Kosten müssen in der Regel von den betroffenen Paaren selbst getragen werden. Jeder Paartherapeut / jede Paartherapeutin kann die eigenen Preise frei festlegen.,"https://www.paarbalance.de/beziehungstipps/paartherapie-kosten/#:~:text=Paartherapie%2DKosten%20m%C3%BCssen%20in%20der,die%20eigenen%20Preise%20frei%20festlegen.",Komplette Übersicht aller Kosten einer Paartherapie - PaarBalance
Wie merkt man dass die Ehe am Ende ist?,Was kann ich tun um meine Ehe zu retten?,"7 Anzeichen, dass Ihre Ehe am Ende ist Sie haben sich nichts mehr zu sagen. ...  Sie kämpfen nicht mehr um Ihre Beziehung. ...  Sarkasmus und Wut statt konstruktiver Problemlösung. ...  Sie stellen sich ein Leben ohne Ihren Partner vor. ...  Sex und Zärtlichkeiten gibt es schon lange nicht mehr. More items...",https://www.kanzlei-landucci.de/ratgeber/scheidung/7-anzeichen-ehe-ende/,"7 Anzeichen, dass Ihre Ehe am Ende ist - Kanzlei Landucci"
Was macht die Ehe kaputt?,Was kann ich tun um meine Ehe zu retten?,"Mangelndes Selbstwertgefühl und Selbstbewusstsein können ebenso für Unwohlsein in der Ehe und Beziehung sorgen. Probleme, die wir auf Partner:innen projizieren, liegen manchmal bei uns. So geben wir anderen die Schuld für unsere Unzufriedenheit und weisen sie von uns ab. Dieses Handeln führt aber zu keiner Lösung. 7 Jan 2022","https://www.brigitte.de/liebe/beziehung/ungluecklich-in-der-ehe--10-anzeichen-13137790.html#:~:text=Mangelndes%20Selbstwertgef%C3%BChl%20und%20Selbstbewusstsein%20k%C3%B6nnen,f%C3%BChrt%20aber%20zu%20keiner%20L%C3%B6sung.",Unglücklich in der Ehe: 10 Anzeichen | BRIGITTE.de
Was tun wenn die Liebe in der Ehe weg ist?,Was kann ich tun um meine Ehe zu retten?,"Das kannst du tun, wenn die Gefühle weg sind! Die fünf Sprachen der Liebe. Lerne deine Partner*in richtig zu verstehen. Bessere Entscheidungen. Treffe Entscheidungen und erreiche deine Ziele. Deine Tut Mir Gut Liste. Erlebe Zufriedenheit und Energie im Alltag. Richtig Feedback geben. ...  Entschuldigen mit Wirkung. 22 Apr 2021",https://www.lebensidealisten.de/blog/paartherapie-bei-trennungsabsicht-hilft-eine-paarberatung-wenn-die-gefuehle-weg-sind/,"Paartherapie bei Trennungsabsicht: Gefühle weg, was tun?"
Was ist der Unterschied zwischen Paarberatung und Paartherapie?,Welche Arten von Paartherapie gibt es?,"   Beides sind Formen der Begleitung von Paaren. Beide Begriffe haben ihre Berechtigung, werden aber häufig synonym verwendet. Die beiden Bezeichnungen dienen eher der Unterscheidung, welche Berufsgruppe die Begleitung vornimmt (Paartherapie = Dipl. -Psychologen, Paarberatung = übrige Berufsgruppen). 28 Dec 2017","https://paarberatung-koelnbonn.de/was-verbirgt-sich-hinter-paartherapie/#:~:text=Beides%20sind%20Formen%20der%20Begleitung,%2C%20Paarberatung%20%3D%20%C3%BCbrige%20Berufsgruppen).",Unterschiede zu anderen Therapieformen
Wie bereitet man sich auf eine Paartherapie vor?,Welche Arten von Paartherapie gibt es?,"Wie bereite ich mich auf eine Paartherapie vor? Das Thema sollte für beide Partner klar sein. Also das, worum es geht? Beide Partner sollten sich Gedanken darüber machen, welche Zielsetzung sie für den Termin haben? ...  Und es wäre hilfreich für den Prozess, wenn beide Partner noch in der Partnerschaft sind! 10 Jun 2022",https://www.heppundhepp.de/paartherapie/wie-bereite-ich-mich-auf-eine-paartherapie-vor,Wie bereite ich mich auf eine Paartherapie vor?
Was erwarte ich von einer Paartherapie?,Welche Arten von Paartherapie gibt es?,"   Besonders zu Beginn nimmt der Paartherapeut, die Paartherapeutin eine primär zuhörende Rolle ein. Er bzw. sie muss das Paar und seine individuelle Geschichte kennenlernen und die zugrundeliegende Paardynamik verstehen. Oft sind es sehr eingefahrene Kommunikationsmuster, welche die Atmosphäre in der Beziehung belasten. 3 Jun 2021","https://www.paartherapie-odendahl-koeln.de/was-erwartet-mich-in-einer-paartherapie/#:~:text=Besonders%20zu%20Beginn%20nimmt%20der,Atmosph%C3%A4re%20in%20der%20Beziehung%20belasten.",Was erwartet uns in einer Paartherapie?
Wann brauche ich eine Eheberatung?,Was macht man in einer Eheberatung?,In diesen Fällen ist eine Paartherapie sinnvoll Es ist kein Vertrauen mehr vorhanden. Es gibt kaum noch gemeinsame Interessen. Ein oder beide Partner fühlen sich unverstanden oder nicht unterstützt. Ein Partner geht fremd. Pläne oder Ziele für die gemeinsame Zukunft gehen weit auseinander. More items...,https://www.partnerschaft-lernen.de/wissenswert/wann-ist-eine-paartherapie-sinnvoll/,Wann ist eine Paartherapie sinnvoll? - partnerschaft-lernen
Wird eine Eheberatung von der Krankenkasse bezahlt?,Was macht man in einer Eheberatung?,"Da Paar- und Familientherapie nicht zur Psychotherapie zählen, werden die Kosten auch nicht von den gesetzlichen oder privaten Krankenkassen übernommen.","https://www.therapie.de/psyche/info/fragen/wichtigste-fragen/paartherapie-familientherapie/#:~:text=Da%20Paar%2D%20und%20Familientherapie%20nicht,gesetzlichen%20oder%20privaten%20Krankenkassen%20%C3%BCbernommen.",Kostenübernahme bei Paartherapie / Familientherapie - Therapie.de
Wie lange dauert eine Ehekrise?,Wie oft muss man zur Paartherapie?,"Es ist zwar möglich, dass Sie derzeit nur eine Phase durchlaufen, bei der Sie sich auf eigene Bedürfnisse konzentrieren, wenn diese jedoch schon länger als ein halbes Jahr andauert, sollten Sie in sich gehen und überlegen, ob Sie in einer Ehekrise stecken.","https://www.scheidung.de/ehekrise.html#:~:text=Es%20ist%20zwar%20m%C3%B6glich%2C%20dass,Sie%20in%20einer%20Ehekrise%20stecken.",Anzeichen erkennen und Ehekrise bewältigen - SCHEIDUNG.de
Wie erfolgreich ist eine Paartherapie?,Wie oft muss man zur Paartherapie?,"Eine Paartherapie hat in den meisten Fällen Erfolg, so dass das gemeinsame Ziel des Paares erreicht werden kann Eine Paarberatung kann jedoch auch Grenzen haben. 1 Mar 2021","https://www.lebensidealisten.de/blog/paartherapie-erfolgschancen-tipps-und-grenzen/#:~:text=Eine%20Paartherapie%20hat%20in%20den,kann%20jedoch%20auch%20Grenzen%20haben.","Paartherapie: Erfolgschancen, Tipps und Grenzen - Lebensidealisten"
Wie verhält sich ein Mann Wenn er sich trennen will?,Was kann man tun wenn der Partner einen nicht mehr liebt?,"Er hört Ihnen nicht zu     Sie haben jeden seiner Termine im Kopf, aber kaum geht es um Ihre, haben Sie das Gefühl, diese ständig wiederholen zu müssen? Dann scheint sein Interesse in Ihr Leben wohl weniger groß zu sein. Dabei sollte es in einer funktionierenden Beziehung doch immer um die Belange beider Partner gehen. 16 Jun 2022","https://www.freundin.de/trennung-vorhersehen-zeichen-dass-er-sich-trennt#:~:text=Er%20h%C3%B6rt%20Ihnen%20nicht%20zu,die%20Belange%20beider%20Partner%20gehen.","5 Zeichen dafür, dass er sich vermutlich trennen wird | freundin.de"
Wann ist es besser sich zu trennen?,Was kann man tun wenn der Partner einen nicht mehr liebt?,"   Wer gar keine positiven Gefühle mehr für den Partner übrig hat, der sollte sich trennen. Denn ohne Liebe macht eine Beziehung keinen Sinn und ohne positive Gefühle füreinander ist es schwer, die Liebe wieder aufleben zu lassen.","https://www.trennung.de/trennungsgruende.html#:~:text=Wer%20gar%20keine%20positiven%20Gef%C3%BChle,Liebe%20wieder%20aufleben%20zu%20lassen.",TRENNUNGSGRÜNDE – Soll ich mich trennen? - TRENNUNG.de
Wann ist es keine Liebe mehr?,Was kann man tun wenn der Partner einen nicht mehr liebt?,"Wenn du dich in seiner / ihrer Nähe nicht mehr wohlfühlst, eure Zweisamkeit nicht mehr genießen kannst und dich stattdessen ein schlechtes Gewissen plagt, weil du dir immer häufiger Zeit für dich allein oder die Gesellschaft von anderen Personen wünschst, ist das ein eindeutiges Zeichen dafür, dass sich deine Gefühle ... 17 Dec 2021","https://www.cosmopolitan.de/keine-gefuehle-mehr-115276.html#:~:text=Wenn%20du%20dich%20in%20seiner,daf%C3%BCr%2C%20dass%20sich%20deine%20Gef%C3%BChle",Keine Gefühle mehr: Diese 5 Anzeichen sprechen dafür
Kann Abstand die Beziehung retten?,Wie Beziehung retten wenn Partner nicht mehr will?,"Abstand kann helfen, einander wieder mehr wertzuschätzen und die kleinen Reibereien des Alltags zu vermeiden. Schon zwei Tage getrennt voneinander können helfen, einmal tief durchzuatmen und sich noch einmal bewusst zu machen, was man an der eigenen Beziehung schätzt. 29 Jul 2021","https://www.emotion.de/psychologie-partnerschaft/partnerschaft/beziehung-retten#:~:text=Abstand%20kann%20helfen%2C%20einander%20wieder,an%20der%20eigenen%20Beziehung%20sch%C3%A4tzt.",Beziehung retten: So gebt ihr der Liebe noch eine Chance
Wann sollte ich mich nicht trennen?,Wie Beziehung retten wenn Partner nicht mehr will?,"Wenn er ständig Dinge tut, die dich kränken und verletzen. Wenn du dich mehr freust, Zeit ohne den Partner zu verbringen als mit ihm. Wenn ihr überhaupt nicht mehr zusammen lacht. Wenn ihr jenseits von Alltagskram keine gemeinsamen Gesprächsthemen findet. 10 Jun 2022","https://www.womenshealth.de/love/partnerschaft/trennen-ja-oder-nein/#:~:text=Wenn%20er%20st%C3%A4ndig%20Dinge%20tut,Alltagskram%20keine%20gemeinsamen%20Gespr%C3%A4chsthemen%20findet.",Soll ich mich trennen? Entscheidungshilfe! - Women's Health
Wie kann man wieder Nähe aufbauen?,Wie Beziehung retten wenn Partner nicht mehr will?,"Auch gemeinsame Interessen und Hobbies stärken die Verbindung zwischen zwei Menschen. Denn eine gemeinsame Passion für Musik, Theater, Sport oder Politik sorgt dafür, dass Sie wichtige Bereiche Ihres Lebens miteinander teilen. Gemeinsame Werte stärken ebenfalls das Gefühl von emotionaler Verbundenheit. 10 Dec 2021","https://ratgeber.bunte.de/emotionale-bindung-aufbauen-so-koennen-paare-ihre-emotionale-naehe-staerken_139788#:~:text=Auch%20gemeinsame%20Interessen%20und%20Hobbies,das%20Gef%C3%BChl%20von%20emotionaler%20Verbundenheit.",So können Paare ihre emotionale Nähe stärken - BUNTE Ratgeber
Was zerstört die Beziehung?,Was ist Gift für eine Beziehung?,"Lügen entpuppen sich als Beziehungskiller. steckt, wird kaum mehr Vertrauen aufbauen können. Wenn dein Partner dich beispielsweise über seine Abendgestaltung belügt, liegt etwas im Argen und dem anderen muss klar sein, dass er damit die Beziehung gefährdet. Tipp: Du solltest dir Lügen nicht gefallen lassen. 13 Mar 2019","https://www.parship.de/ratgeber/loslassen/beziehungskiller/#:~:text=L%C3%BCgen%20entpuppen%20sich%20als%20Beziehungskiller,-Es%20gibt%20sie&text=steckt%2C%20wird%20kaum%20mehr%20Vertrauen,dir%20L%C3%BCgen%20nicht%20gefallen%20lassen.","15 Beziehungskiller, die deine Beziehung zerstören können"
Wie verhält sich ein toxischer Mann?,Was ist Gift für eine Beziehung?,"Wie verhalten sich toxische Männer? Toxische Männer schlucken ihre Emotionen einfach herunter, denn sie glauben, alles andere wäre ein Zeichen von Schwäche. Sie geben alles, um immer der dominante Part zu sein und haben kein Problem damit, andere Personen herabzuwürdigen – vor allem Frauen.","https://greator.com/toxische-maenner/#:~:text=%C3%BCberholten%20Verst%C3%A4ndnis%20geht.-,Wie%20verhalten%20sich%20toxische%20M%C3%A4nner%3F,Personen%20herabzuw%C3%BCrdigen%20%E2%80%93%20vor%20allem%20Frauen.",8 Anzeichen für toxische Männer in einer Beziehung - Greator
Wie verhält sich ein toxischer Mann in einer Beziehung?,Was ist Gift für eine Beziehung?,"""Toxische Beziehungen erkennt man daran, dass sie überhaupt nicht gut tun, sondern sogar sehr wehtun und seelisch und auch körperlich krank machen können"", erklärt Susanne Kraft. Ein toxischer Partner reagiere laut der Beziehungsexpertin auffällig häufig mit Kritik, Schuldzuweisungen und Herabwürdigungen. 22 Nov 2021","https://www.swr.de/swr1/rp/toxische-beziehungen-100.html#:~:text=%22Toxische%20Beziehungen%20erkennt%20man%20daran,mit%20Kritik%2C%20Schuldzuweisungen%20und%20Herabw%C3%BCrdigungen.",Schmerzhafte Liebe: Wie erkennt man eine toxische Beziehung? - SWR.de
Wann ist eine Ehe toxisch?,Wie merkt man dass die Ehe am Ende ist?,"Toxische Beziehung - Definition aus psychologischer Sicht    Toxische Beziehungen sind Partnerschaften, in denen es mindestens einem, sehr häufig auch beiden Partnern fast durchgehend schlecht geht. Anders als eine „gesunde“ Partnerschaft raubt eine toxische Beziehung mehr Energie, als sie gibt.","https://www.paar-ehe-beratung.de/themen/toxische-beziehung.html#:~:text=Toxische%20Beziehung%20%2D%20Definition%20aus%20psychologischer,mehr%20Energie%2C%20als%20sie%20gibt.",Was ist eine toxische Beziehung? - Tipps aus der Paarberatung
Kann man eine unglückliche Ehe retten?,Wie merkt man dass die Ehe am Ende ist?,"Ist das Vertrauen in den Partner erst einmal futsch, ist es nur schwer wieder herzustellen. Aber es ist nicht unmöglich. Wer sich in seiner Beziehung aber immer noch sicher und geborgen fühlt (sich aber an anderen Dingen reibt), hat damit gute Gründe und Voraussetzungen seine Ehe zu retten. 26 Mar 2022","https://www.familie.de/familienleben/ehe-retten-tipps-fuer-eltern-in-der-krise/#:~:text=Ist%20das%20Vertrauen%20in%20den,Voraussetzungen%20seine%20Ehe%20zu%20retten.",Ehe retten: 11 Tipps und 5 Gründe eure Beziehung zu retten - Familie.de
Kann eine kaputte Liebe wieder heilen?,Was macht die Liebe kaputt?,"   Rette deine kaputte Beziehung, indem du lernst, deine Bedürfnisse klarer zu kommunizieren. Unter einigen Voraussetzungen lassen sich sowohl kaputte Beziehungen als auch bereits beendete Partnerschaften retten. Es ist nur sinnvoll, eine Beziehung zu retten, wenn ihr eine gemeinsame Vision formulieren könnt. 2 Feb 2021","https://chrisbloom.de/blog/beziehung-retten/#:~:text=Rette%20deine%20kaputte%20Beziehung%2C%20indem,eine%20gemeinsame%20Vision%20formulieren%20k%C3%B6nnt.","Beziehung retten: 9 Tipps, um die Liebe zu reparieren - Chris Bloom"
Was ist ein no go in einer Beziehung?,Was macht die Liebe kaputt?,"Das „Ur-No Go“ einer jeden Beziehung schlechthin ist der Betrug. Fremdgeher fügen der Partnerschaft erheblichen Schaden zu. Selbst, wenn der betrogene Partner noch eine Chance einräumt, der Knick im Vertrauen bleibt. Für die meisten Paare mündet dieses No Go tatsächlich auch in der Trennung.","https://www.datingcafe.de/cafeteria/beratung/klares-no-go-das-beschaedigt-jede-beziehung/#:~:text=Das%20%E2%80%9EUr%2DNo%20Go%E2%80%9C,tats%C3%A4chlich%20auch%20in%20der%20Trennung.",Klares No Go: Das beschädigt jede Beziehung - Dating Cafe
Was ist Gift für eine Beziehung?,Was macht die Liebe kaputt?,"Auf Dauer sind Kritik, Nörgelei und Vorwürfe Gift für deine Beziehungen. Gemeint ist hier besonders die Art von Kritik, die ungefragt geäußert wird, die anklagt und die vom anderen verlangt, dass er/sie etwas oder sich ändern soll.","https://www.alexandramarko.com/7-fragen-um-deine-kritik-loszulassen/#:~:text=Auf%20Dauer%20sind%20Kritik%2C%20N%C3%B6rgelei,etwas%20oder%20sich%20%C3%A4ndern%20soll.",Kritik ist Gift für deine Beziehungen! 7 Fragen um deine Kritik loszulassen.
