PAA Title,Parent,Text,URL,URL Title
Wie merke ich dass die Beziehung kaputt ist?,Wann ist es keine Liebe mehr?,"Ihr schweigt euch eher an als miteinander zu sprechen? Dann ist das ein klares Zeichen, dass das Interesse am anderen nicht mehr vorhanden ist. Das Aus an Kommunikation bedeutet über kurz oder lang auch das Aus der Beziehung. Versucht euch und euren Partner zu beobachten, wenn ihr diskutiert oder streitet. 1 Jun 2022","https://www.prosieben.de/serien/taff/news/signale-dass-eure-beziehung-am-ende-ist-57195#:~:text=Ihr%20schweigt%20euch%20eher%20an,auch%20das%20Aus%20der%20Beziehung.&text=Versucht%20euch%20und%20euren%20Partner,wenn%20ihr%20diskutiert%20oder%20streitet.","Signale, dass eure Beziehung am Ende ist - ProSieben"
Wie verhält sich ein Mann der nicht mehr liebt?,Wann ist es keine Liebe mehr?,"Anzeichen wie mangelndes Interesse, häufige Kritik oder wenig körperliche Nähe deuten für viele Frauen darauf hin, dass ihr Mann sie nicht mehr liebt. Am wichtigsten ist in diesem Fall ein offenes Gespräch. 29 May 2020","https://www.elitepartner.de/magazin/meistern/er-liebt-mich-nicht-mehr/#:~:text=Anzeichen%20wie%20mangelndes%20Interesse%2C%20h%C3%A4ufige,diesem%20Fall%20ein%20offenes%20Gespr%C3%A4ch.",„Er liebt mich nicht mehr“: So erkennst du die Veränderung - ElitePartner
Was macht die Liebe kaputt?,Wann ist es keine Liebe mehr?,"Sorgen und Ängste machen sich in dir breit und lassen dich nicht zur Ruhe kommen. Auch Eifersucht kann geschürt werden, wenn mal keine Antwort vom liebsten kommt. Auf Dauer kann das „ständige voneinander Hören“ für eine Beziehung belastend sein.","https://www.liebesmeer.de/ratgeber/partnerschaft-beziehung/beziehung-kaputt/#:~:text=Sorgen%20und%20%C3%84ngste%20machen%20sich,f%C3%BCr%20eine%20Beziehung%20belastend%20sein.",Beziehung kaputt: 13+1 Signale & was du tun kannst - LiebesMeer
Was ärgert toxische Menschen?,Welche Beziehungen sind toxisch?,"Sie verwickeln Sie in ihre Manipulationen. Mit Gaslighting, emotionaler Erpressung und anderen Manipulationstechniken sind toxische Menschen vertraut. Solche Personen manipulieren, um andere Menschen zu kontrollieren. Um sich Vorteile zu verschaffen, untergraben, verwirren und verletzen sie andere Menschen. 17 May 2018","https://www.karstennoack.de/toxische-menschen-tipps/#:~:text=Sie%20verwickeln%20Sie%20in%20ihre%20Manipulationen,und%20verletzen%20sie%20andere%20Menschen.","Toxische Menschen: 11 Tipps, was sie tun und wie mit ihnen ..."
Wie verhält sich ein Narzisst in einer Beziehung?,Welche Beziehungen sind toxisch?,"Durch den starken Egoismus des Narzissten ist der Partner gezwungen, mehr auf den narzisstischen Partner zu achten als auf sich selbst. Der Narzisst steht im Mittelpunkt – durch permanente Stimmungsschwankungen und Empfindlichkeit ist es dem Partner beinahe unmöglich eigene Ansprüche zu äußern.","https://www.oberbergkliniken.de/artikel/narzissmus-und-partnerschaft#:~:text=Durch%20den%20starken%20Egoismus%20des,unm%C3%B6glich%20eigene%20Anspr%C3%BCche%20zu%20%C3%A4u%C3%9Fern.",Narzissmus und Partnerschaft - Oberberg Kliniken
Was ist ein Narzisst in der Beziehung?,Welche Beziehungen sind toxisch?,"In einer narzisstischen Partnerschaft geht es einer narzisstischen Partnerin bzw. einem narzisstischen Partner immer nur um sich selbst. All ihre/seine Handlungen sind zu ihrem/seinem Vorteil. Sie/er wird beginnen, dich zu vereinnahmen, zu kontrollieren und dich zu erniedrigen.","https://instahelp.me/de/magazin/beziehung/narzissmus-in-beziehungen-anzeichen-und-tipps-im-umgang/#:~:text=In%20einer%20narzisstischen%20Partnerschaft%20geht,kontrollieren%20und%20dich%20zu%20erniedrigen.",Anzeichen und Tipps im Umgang mit Narzisst:innen - Instahelp
Was ist Gift für eine Beziehung?,Was Macht die Liebe kaputt?,"Auf Dauer sind Kritik, Nörgelei und Vorwürfe Gift für deine Beziehungen. Gemeint ist hier besonders die Art von Kritik, die ungefragt geäußert wird, die anklagt und die vom anderen verlangt, dass er/sie etwas oder sich ändern soll.","https://www.alexandramarko.com/7-fragen-um-deine-kritik-loszulassen/#:~:text=Auf%20Dauer%20sind%20Kritik%2C%20N%C3%B6rgelei,etwas%20oder%20sich%20%C3%A4ndern%20soll.",Kritik ist Gift für deine Beziehungen! 7 Fragen um deine Kritik loszulassen.
Was ist ein no go in einer Beziehung?,Was Macht die Liebe kaputt?,"Das „Ur-No Go“ einer jeden Beziehung schlechthin ist der Betrug. Fremdgeher fügen der Partnerschaft erheblichen Schaden zu. Selbst, wenn der betrogene Partner noch eine Chance einräumt, der Knick im Vertrauen bleibt. Für die meisten Paare mündet dieses No Go tatsächlich auch in der Trennung.","https://www.datingcafe.de/cafeteria/beratung/klares-no-go-das-beschaedigt-jede-beziehung/#:~:text=Das%20%E2%80%9EUr%2DNo%20Go%E2%80%9C,tats%C3%A4chlich%20auch%20in%20der%20Trennung.",Klares No Go: Das beschädigt jede Beziehung - Dating Cafe
Wie Männer Beziehungen zerstören?,Was Macht die Liebe kaputt?,"Beziehungskiller: Die 15 häufigsten Dinge, die Sie als Paar belasten Das Handy ist der ständige Begleiter. Beziehung gefährdet durch die Arbeit. Das Kind steht zwischen euch. Enge: Es ist zu viel. Egoismus macht Partnerschaft kaputt. Kritik nimmt Überhand, Lob gibt es kaum. Manipulation ist gefährlich. More items... • 13 Mar 2019",https://www.parship.de/ratgeber/loslassen/beziehungskiller/,"15 Beziehungskiller, die deine Beziehung zerstören können"
Was wenn der Partner kein sexuelles Interesse mehr zeigt?,Wie verhält sich ein Mann Wenn er sich trennen will?,"Gehen Sie zum Beispiel zusammen wandern oder machen Sie ein romantisches Picknick. Auch ein Urlaub sorgt für neue Impulse. Das kann die Leidenschaft im Bett wieder aufflammen lassen. Sollten Sie im Bett etwas Neues ausprobieren wollen, können z.B. auch aufregende Sex Rollenspiele oder Sex-Spielzeuge helfen. 27 Dec 2018","https://www.freundin.de/sex-was-tun-wenn-partner-keinen-sex-mehr-moechte#:~:text=Gehen%20Sie%20zum%20Beispiel%20zusammen,Rollenspiele%20oder%20Sex%2DSpielzeuge%20helfen.","Das sollten Sie tun, wenn Ihr Partner keinen Sex mehr möchte | freundin.de"
Wann hat ein Mann abgeschlossen?,Wie verhält sich ein Mann Wenn er sich trennen will?,"Theoretisch kommt nach der Trauer um die beendete Beziehung und die gemeinsame Zeit schließlich der Punkt, an dem abgeschlossen wird. Mit den Träumen, die gemeinsam geteilt, aber nicht erfüllt wurden, mit der gemeinsamen Zeit – einfach mit allem. Praktisch kann ein Abschluss ganz schön lange dauern. 16 Nov 2020","https://www.parship.at/ratgeber/loslassen/hat-mein-ex-wirklich-abgeschlossen/#:~:text=Theoretisch%20kommt%20nach%20der%20Trauer,Abschluss%20ganz%20sch%C3%B6n%20lange%20dauern.",Hat mein Ex wirklich abgeschlossen? - Diese Signale deuten darauf hin
Bin ich ihm egal?,Wie verhält sich ein Mann Wenn er sich trennen will?,"Wenn er Gesprächen, die dir extrem wichtig sind, immer wieder aus dem Weg geht oder sie aus fadenscheinigen Gründen auf einen späteren Zeitpunkt verschiebt, dann weißt du, dass es ihm egal ist, wie es dir geht. Wärst du ihm wichtig, würde er dir zuhören. 28 Sept 2017","https://www.elle.de/du-bist-ihm-egal#:~:text=Wenn%20er%20Gespr%C3%A4chen%2C%20die%20dir,wichtig%2C%20w%C3%BCrde%20er%20dir%20zuh%C3%B6ren.","6 Anzeichen dafür, dass du ihm egal bist - ELLE"
Was löst sexuelles Verlangen aus?,Was wenn der Partner kein sexuelles Interesse mehr zeigt?,Aus den Eierstöcken und Nebennieren gelangen Sexualhormone wie Östrogen und Testosteron über das Blut ins Gehirn. Sie überschwemmen die primitiven Hirnareale nahe dem Hirnstamm und regen die Produktion von Botenstoffen an. Diese Neurotransmitter sind die eigentliche Essenz des Verlangens. 13 Jan 2014,"https://www.focus.de/gesundheit/ratgeber/sexualitaet/erforscht-die-lust-seite-3-die-biochemie-steuert-sexuelles-verlangen_id_3543966.html#:~:text=Aus%20den%20Eierst%C3%B6cken%20und%20Nebennieren,die%20eigentliche%20Essenz%20des%20Verlangens.",Die Biochemie steuert sexuelles Verlangen - FOCUS online
Was hemmt den Sexualtrieb bei Männern?,Was wenn der Partner kein sexuelles Interesse mehr zeigt?,"Unter einer Minderung der Libido versteht man die Abnahme des Sexualtriebs. Mögliche Ursachen sind u. a. psychische Faktoren (wie Depressionen, Angstzustände oder Beziehungsprobleme), Medikamente und ein niedriger Testosteronspiegel.","https://www.msdmanuals.com/de-de/heim/gesundheitsprobleme-von-m%C3%A4nnern/sexuelle-funktionsst%C3%B6rungen-bei-m%C3%A4nnern/verringerte-libido-bei-m%C3%A4nnern#:~:text=Unter%20einer%20Minderung%20der%20Libido,und%20ein%20niedriger%20Testosteronspiegel.",Verringerte Libido bei Männern - MSD Manuals
Woher kommt sexuelle Unlust bei Männern?,Was wenn der Partner kein sexuelles Interesse mehr zeigt?,"Oft verlieren wir das Interesse am Sex, wenn wir gestresst oder müde sind oder Beziehungsprobleme haben. Manchmal kann sexuelle Unlust aber auch gesundheitliche Ursachen haben, zum Beispiel Probleme mit der Schilddrüse. Die sexuelle Lust ist bei jedem Menschen anders, und es gibt keine „normale“ Libido. 26 May 2021","https://www.kry.de/magazin/sexuelle-unlust-gruende-fuer-libidoverlust/#:~:text=Oft%20verlieren%20wir%20das%20Interesse,gibt%20keine%20%E2%80%9Enormale%E2%80%9C%20Libido.",Keine Lust auf Sex? 8 mögliche Ursachen - Kry.de
Wann soll man aufhören zu kämpfen?,Wie verhält sich ein Mann vor der Trennung?,"«Wenn etwas immer wieder hochkommt, dass sich nicht mehr reparieren lässt», meint Kuhn. Oder aber wenn es in einer Beziehung viel Verachtung und Respektlosigkeit gibt, ist das ein Zeichen dafür, dass man eine Trennung in Erwägung ziehen sollte.","https://www.blick.ch/life/liebe/aufgeben-oder-weitermachen-wie-lange-sollte-man-um-eine-beziehung-kaempfen-id15767338.html#:~:text=%C2%ABWenn%20etwas%20immer%20wieder%20hochkommt,Trennung%20in%20Erw%C3%A4gung%20ziehen%20sollte.","Das sind die Anzeichen, dass Sie Beziehung Ihre beenden sollen - Blick"
In welchem Alter trennen sich die meisten Paare?,Wie verhält sich ein Mann vor der Trennung?,Dabei fand Rosenfeld heraus: Viele Partnerschaften schaffen es gar nicht erst bis zum gefürchteten siebten Beziehungsjahr. Der Studie zufolge war nämlich bereits das erste Beziehungsjahr das wahrscheinlichste für eine Trennung. Ganze 60 Prozent der beobachteten Paare trennten sich schon nach weniger als zwölf Monaten. 9 Dec 2022,"https://www.morgenpost.de/vermischtes/article236734661/wann-trennen-sich-paare-beziehung-am-ende-partnerschaft-ehe.html#:~:text=Dabei%20fand%20Rosenfeld%20heraus%3A%20Viele,nach%20weniger%20als%20zw%C3%B6lf%20Monaten.",In diesem Beziehungsjahr trennen sich die meisten Paare
Wie äußert sich die Midlife Crisis bei Männern?,Wie verhält sich ein Mann vor der Trennung?,"Bei Männern sind in der Midlife-Crisis die Selbstsicht und Gefühle betroffen. Vielleicht empfindet Ihr Partner Sinnlosigkeit, Leere, Einsamkeit, Verzweiflung, Enttäuschung, Reue oder Angst. Wie es konkret in ihm aussieht, können Sie selbst nicht immer erkennen, wenn er es Ihnen nicht erzählt. 28 Apr 2022","https://www.aok.de/pk/magazin/familie/beziehung/midlife-crisis-mann-so-unterstuetzen-sie-ihren-partner/#:~:text=Bei%20M%C3%A4nnern%20sind%20in%20der,er%20es%20Ihnen%20nicht%20erz%C3%A4hlt.",Midlife-Crisis beim Mann: So unterstützen Sie Ihren Partner - AOK
Welches Mittel macht Frauen scharf?,Was löst sexuelles Verlangen aus?,"Wie wirkt Flibanserin? Während Viagra direkt eine Erektion auslöst, wenn der Mann Lust auf Sex hat, ist Flibanserin ein Psychopharmakon und soll der Lust von Frauen überhaupt erst auf die Sprünge helfen. Der Wirkstoff erhöht die Aktivität der Botenstoffe Dopamin und Noradrenalin und senkt die des Serotonins. 21 Aug 2015","https://www.frauenaerzte-im-netz.de/aktuelles/meldung/luststeigerndes-medikament-fuer-frauen-flibanserin/#:~:text=Wie%20wirkt%20Flibanserin%3F,und%20senkt%20die%20des%20Serotonins.",Luststeigerndes Medikament für Frauen: Flibanserin
Wie kann ich mein sexuelles Verlangen steigern?,Was hemmt den Sexualtrieb bei Männern?,"Hausmittel wie Ginseng, Ginkgo, Maca, Knoblauch, Fenchel, Ingwer, Salbei, Bockshornklee, Spargel und Wasserkresse sind besonders bei Frauen beliebt, um die Libido anzuregen. 2 Mar 2021","https://www.mylife.de/sexualitaet/libido/#:~:text=Hausmittel%20wie%20Ginseng%2C%20Ginkgo%2C%20Maca,beliebt%2C%20um%20die%20Libido%20anzuregen.",Libido steigern - mylife.de
Was bewirkt Enthaltsamkeit beim Mann?,Was hemmt den Sexualtrieb bei Männern?,Sexuelle Abstinenz: So wirkt sie sich auf den Körper aus!    höhere Stressanfälligkeit. sinkende Libido. Risiko für Übergewicht und Herz-Kreislauf-Erkrankungen steigt. stagnierender Muskelaufbau. 22 Apr 2022,"https://www.mylife.de/sexualitaet/abstinenz/#:~:text=Sexuelle%20Abstinenz%3A%20So%20wirkt%20sie%20sich%20auf%20den%20K%C3%B6rper%20aus!,-Der%20Verzicht%20auf&text=h%C3%B6here%20Stressanf%C3%A4lligkeit,stagnierender%20Muskelaufbau",Sexuelle Abstinenz: Das sind die Auswirkungen! - mylife.de
Wann lässt der Sexualtrieb bei Männern nach?,Woher kommt sexuelle Unlust bei Männern?,"Bei Männern und Frauen bleiben Sexualtrieb und sexuelles Verlangen bis ins hohe Alter erhalten, auch wenn sie insbesondere nach dem 50. Lebensjahr abfallen, und dies vor allem bei Alleinstehenden. 4 Jun 2020","https://www.apotheken.de/gesundheit/gesund-leben/aging-und-antiaging/10296-sexuelle-funktionen-im-alter#:~:text=Bei%20M%C3%A4nnern%20und%20Frauen%20bleiben,dies%20vor%20allem%20bei%20Alleinstehenden.",Sexuelle Funktionen im Alter - Apotheken.de
Was regt den Sexualtrieb an?,Woher kommt sexuelle Unlust bei Männern?,"6 Wege, um Ihre Libido auf natürliche Weise zu steigern Kulinarische Lustmacher. ...  Stressabbau und gesunder Schlaf. ...  Sport und Bewegung. ...  Die Macht des Verbotenen. ...  Ehrlichkeit in der Partnerschaft. ...  Liebe deinen Körper: Selbstvertrauen und Körperakzeptanz. 12 Jan 2022",https://www.donna-magazin.de/leben-liebe/partnerschaft/sex/lust-steigern/,Ganz natürlich: Diese 6 Tipps steigern die weibliche Libido - DONNA
Welche Beziehungen sind toxisch?,Was sind die häufigsten Trennungsgründe?,"""Toxische Beziehungen erkennt man daran, dass sie überhaupt nicht gut tun, sondern sogar sehr wehtun und seelisch und auch körperlich krank machen können"", erklärt Susanne Kraft. Ein toxischer Partner reagiere laut der Beziehungsexpertin auffällig häufig mit Kritik, Schuldzuweisungen und Herabwürdigungen. 22 Nov 2021","https://www.swr.de/swr1/rp/toxische-beziehungen-100.html#:~:text=%22Toxische%20Beziehungen%20erkennt%20man%20daran,mit%20Kritik%2C%20Schuldzuweisungen%20und%20Herabw%C3%BCrdigungen.",Schmerzhafte Liebe: Wie erkennt man eine toxische Beziehung? - SWR.de
Wer beendet häufiger eine Beziehung?,Was sind die häufigsten Trennungsgründe?,"Wer macht öfter Schluss - Frauen oder Männer? Laut ElitePartner-Studie sind es eindeutig erstere: 44 Prozent der Frauen geben an, bei ihrer letzten Beziehung selbst aktiv Schluss gemacht zu haben. Unter den Männern sind es nur 28 Prozent. 27 Jul 2021","https://www.presseportal.de/pm/55165/4978884#:~:text=Wer%20macht%20%C3%B6fter%20Schluss%20%2D%20Frauen,sind%20es%20nur%2028%20Prozent.","Liebeskummer dauert im Schnitt 12,4 Monate - wer verlassen wird, leidet ..."
Für wen ist die Trennung schlimmer?,Was sind die häufigsten Trennungsgründe?,"Etwa die Persönlichkeit des Verlassenen: Wer ein eher geringes Selbstwertgefühl hat, den erschüttert eine Trennung stärker als andere. Wer darüber hinaus die Person, die er verloren hat, für besonders wichtig hielt, sich in der Beziehung an sie geklammert hat – für den wird die Trennung ebenfalls schwieriger.","https://www.geo.de/magazine/geo-wissen/15146-rtkl-liebeskummer-der-schmerz-nach-der-trennung#:~:text=Etwa%20die%20Pers%C3%B6nlichkeit%20des%20Verlassenen,wird%20die%20Trennung%20ebenfalls%20schwieriger.",Trennungsschmerz: Was Liebeskummer mit uns macht - GEO
Wann ist die schwierigste Zeit in einer Beziehung?,In welchem Alter trennen sich die meisten Paare?,"Und jetzt haltet euch fest: Das gefährlichste und kritischste Jahr in der Partnerschaft ist demnach das erste! 60 Prozent der Beziehungen, die Rosenfeld auf dem Zettel hatte, zerbrachen noch vor dem ersten Jahrestag – trotz Verliebtheit, Schmetterlinge im Bauch und rosaroter Brille. 16 Nov 2021","https://www.brigitte.de/liebe/beziehung/laut-statistik--die-meisten-paare-trennen-sich-in-diesem-beziehungsjahr-11544588.html#:~:text=Und%20jetzt%20haltet%20euch%20fest,im%20Bauch%20und%20rosaroter%20Brille.",In diesem Beziehungsjahr trennen sich die meisten Paare - Brigitte
Ist Sexverweigerung ein Scheidungsgrund?,In welchem Alter trennen sich die meisten Paare?,"Verweigerung von Geschlechtsverkehr    Die Weigerung, Sex zu haben, wird nur dann zu einer schweren Eheverfehlung, wenn sie hartnäckig und grundlos ist. Gelegentliche Verweigerung oder eine auf physische oder psychische Gründe gestützte Verweigerung stellt keinen Scheidungsgrund dar.","https://www.scheidungsinfo.at/eheverfehlung/#:~:text=Verweigerung%20von%20Geschlechtsverkehr&text=Die%20Weigerung%2C%20Sex%20zu%20haben,Verweigerung%20stellt%20keinen%20Scheidungsgrund%20dar.",Eheverfehlungen: das sind die Gründe für eine Scheidung
In welchem Alter halten Beziehungen am längsten?,In welchem Alter trennen sich die meisten Paare?,"Im Zuge einer wissenschaftlichen Analyse wurden dabei 2000 britische Probanden zum ""Meilensteinen ihres Lebens"" befragt. Dabei ist hervorgekommen, dass die Studienteilnehmer durchschnittlich ab ihrem 40. Lebensjahr am glücklichsten in ihrer Beziehung waren. 9 Aug 2022","https://freizeit.at/lust-liebe/laut-studie-in-diesem-alter-trifft-man-seine-grosse-liebe/402103548#:~:text=Im%20Zuge%20einer%20wissenschaftlichen%20Analyse,gl%C3%BCcklichsten%20in%20ihrer%20Beziehung%20waren.",Laut Studie: In diesem Alter trifft man seine große Liebe - freizeit.at
Was lässt Beziehungen scheitern?,Wann gehen die meisten Beziehungen zu Ende?,"Warum Beziehungen scheitern    Ein Ungleichgewicht im Geben und Nehmen war für mehr als 26% ein Grund für die Trennung vom Partner. Weil die Bedürfnisse nach Freiheit und Nähe zu unterschiedlich waren, trennten sich 26% vom Lebenspartner. Fehlende Kommunikation war für rund 23% der Partner ein Trennungsgrund.","https://www.vaterfreuden.de/partnerschaft/leben-mit-kind/woran-scheitern-partnerschaften-und-wie-kann-man-das-scheitern-verhinde#:~:text=Warum%20Beziehungen%20scheitern&text=Ein%20Ungleichgewicht%20im%20Geben%20und,23%25%20der%20Partner%20ein%20Trennungsgrund.",Woran scheitern Partnerschaften und wie kann man ... - Vaterfreuden.de
Wann hilft Abstand in einer Beziehung?,Wann gehen die meisten Beziehungen zu Ende?,"Schafft Abstand und gebt euch Freiraum    Abstand kann helfen, einander wieder mehr wertzuschätzen und die kleinen Reibereien des Alltags zu vermeiden. Schon zwei Tage getrennt voneinander können helfen, einmal tief durchzuatmen und sich noch einmal bewusst zu machen, was man an der eigenen Beziehung schätzt. 29 Jul 2021","https://www.emotion.de/psychologie-partnerschaft/partnerschaft/beziehung-retten#:~:text=Schafft%20Abstand%20und%20gebt%20euch%20Freiraum&text=Abstand%20kann%20helfen%2C%20einander%20wieder,an%20der%20eigenen%20Beziehung%20sch%C3%A4tzt.",Beziehung retten: So gebt ihr der Liebe noch eine Chance
Was bringt eine Pause in der Beziehung?,Wann gehen die meisten Beziehungen zu Ende?,"Eine Pause kann dann helfen, um sich selber besser zu verstehen und herauszufinden, was für eigene Probleme vielleicht Grund für Beziehungsbremsen sind. Es gibt aber auch Beziehungsprobleme, für die eine Beziehungspause gar nicht notwendig ist. Wenn du das Gefühl hast festzustecken, hilft eine Pause nicht.","https://lovomi.de/beziehungspause/#:~:text=Eine%20Pause%20kann%20dann%20helfen,festzustecken%2C%20hilft%20eine%20Pause%20nicht.",Ist eine Beziehungspause das Richtige für euch? - Lovomi
Wie zeigen Narzissten ihre Liebe?,Wie flirtet ein Narzisst?,"Narzissten sind im Grunde nicht zu echter Liebe fähig. ""Liebe hat auch viel mit Fürsorge, Konstanz und dem Ertragen von Problemen zu tun. Das können die nicht"", erläutert Lammers. Dennoch verhalten diese Menschen sich am Anfang einer Beziehung oft auffällig charmant, wortgewandt und selbstbewusst. 3 Mar 2020","https://www.n-tv.de/leben/Beziehungen-mit-Narzissten-Darum-sind-sie-zum-Scheitern-verurteilt-article21544322.html#:~:text=Narzissten%20sind%20im%20Grunde%20nicht,auff%C3%A4llig%20charmant%2C%20wortgewandt%20und%20selbstbewusst.",Beziehungen mit Narzissten - Darum sind sie zum Scheitern verurteilt - Ntv
Wann sagt ein Narzisst die Wahrheit?,Wie flirtet ein Narzisst?,"Einen Narzissten dazu bringen, die Wahrheit zu sagen    Oft weichen sie immer wieder vom Thema ab oder schieben die Schuld auf andere ab. Man könnte sagen, dass Narzissten übertriebene Egos haben und die Dinge anders wahrnehmen; Aus diesem Grund könnten sie die Lügen als ihre Wahrheit wahrnehmen und entsprechend handeln. 23 May 2022","https://www.unitedwecare.com/de/wie-man-einen-narzissten-dazu-bringt-die-wahrheit-zu-sagen/#:~:text=Einen%20Narzissten%20dazu%20bringen%2C%20die%20Wahrheit%20zu%20sagen,-Wenn%20ein%20Narzisst&text=Oft%20weichen%20sie%20immer%20wieder,Wahrheit%20wahrnehmen%20und%20entsprechend%20handeln.","Wie man einen Narzissten dazu bringt, die Wahrheit zu sagen"
Wie behandelt ein Narzisst seine Partnerin?,Wie flirtet ein Narzisst?,"Fühlen sich narzisstische Menschen gekränkt, reagieren sie mit Rache. Den Partner sehen sie dann als Feind, dem sie versuchen, Schmerz zuzufügen. Narzissmus äußert sich in der Partnerschaft vor allem darin, dass der Betroffene den Anspruch hat, der Partner müsse die eigenen Wünsche und Erwartungen erfüllen. 6 Aug 2021","https://www.netdoktor.de/krankheiten/narzisstische-persoenlichkeitsstoerung/partnerschaft/#:~:text=F%C3%BChlen%20sich%20narzisstische%20Menschen%20gekr%C3%A4nkt,eigenen%20W%C3%BCnsche%20und%20Erwartungen%20erf%C3%BCllen.",Narzissmus in der Partnerschaft - NetDoktor.de
Welche Sätze verwenden Narzissten?,Ist mein Mann wirklich ein Narzisst?,"Anzeichen: 7 Sätze, die Narzissten sagen ""Du bist doch verrückt/gestört/nicht normal"" ...  ""Ich bin eben so"" ...  ""Das findest du gut? ...  ""Wir sind füreinander bestimmt und gehören für immer zusammen"" ...  ""Das stimmt nicht, das hast du dir nur eingebildet"" ...  ""Warum tust du mir das an?"" ...  ""Du hast mir nichts zu sagen"" ",https://www.prosieben.de/serien/taff/news/narzissten-sagen-das-echt-oft-typische-saetze-58192,"7 Sätze, dir nur Narzissten sagen - ProSieben"
Wie Verhalten sich Narzissten im Bett?,Ist mein Mann wirklich ein Narzisst?,"Der Narzisst ist nicht fähig, die Bedürfnisse und Gefühle des Partners zu erkennen. Er geht einfach davon aus, dass Sex mit ihm immer hervorragend sei. Dadurch wird er im Bett zunehmend dominanter. Er nimmt sich einfach, was er braucht. 3 Aug 2022","https://www.prosieben.de/serien/taff/news/ist-dein-partner-ein-narzisst-diese4-merkmale-sprechen-dafur-58009#:~:text=Der%20Narzisst%20ist%20nicht%20f%C3%A4hig,sich%20einfach%2C%20was%20er%20braucht.",Ist dein Partner ein Narzisst? Diese 4 Merkmale sprechen dafür - ProSieben
Wie redet ein Narzisst?,Ist mein Mann wirklich ein Narzisst?,"   Narzissten sprechen nicht mit jemandem, sondern erzählen in erster Linie von sich selbst. Sie verfallen in Monologe, in der sie zum Beispiel von der eigenen Großartigkeit, oder ihren grandiosen Erlebnissen berichten. Kleinigkeiten werden oft und gern zu etwas ganz Besonderem stilisiert.","https://effmert-coaching.de/kommunikation-mit-narzissten-die-fehlende-umarmung/#:~:text=Narzissten%20sprechen%20nicht%20mit%20jemandem,zu%20etwas%20ganz%20Besonderem%20stilisiert.",Kommunikation mit Narzissten: Die fehlende Umarmung - Martina Effmert
Wann beginnt ein Mann eine Frau zu vermissen?,Bin ich ihm so egal?,"Er sucht den Weg über Freunde. Er benutzt Freunde als Umweg, um seine Sehnsucht nach dir zum Ausdruck zu bringen. Wenn er viel von dir erzählt oder sich im gemeinsamen sozialen Umfeld oft nach dir erkundigt, können das durchaus Anzeichen dafür sein, dass er dich vermisst. 8 Feb 2019","https://www.parship.de/ratgeber/verabreden/vermisst-er-mich/#:~:text=Er%20sucht%20den%20Weg%20%C3%BCber,sein%2C%20dass%20er%20dich%20vermisst.","Vermisst er mich? So findest du heraus, ob er Sehnsucht hat - Parship"
Wie merke ich dass er mich loswerden will?,Bin ich ihm so egal?,"Ihr seht euch nicht mehr oft    Wenn er plötzlich immer weniger Zeit für dich hat, länger arbeitet, plötzlich unbedingt ständig zum Sport will oder sich mit Kumpels trifft, die er vorher nur besonders selten gesehen hat, dann können das Zeichen sein, dass er vermeiden will, Zeit mit dir zu verbringen. 22 Aug 2018","https://www.elle.de/anzeichen-fuer-beziehungsaus#:~:text=Ihr%20seht%20euch%20nicht%20mehr%20oft&text=Wenn%20er%20pl%C3%B6tzlich%20immer%20weniger,Zeit%20mit%20dir%20zu%20verbringen.","Beziehungsaus? Wenn er sich so verhält, will er dich loswerden - ELLE"
Wie finde ich heraus ob ich ihm wichtig bin?,Bin ich ihm so egal?,"Berührungen, die zeigen, ob ich ihm wichtig bin    Er streichelt zärtlich unseren Nacken, berührt hier und da unsere Wange, während wir mit ihm sprechen. Dein Partner fühlt sich magisch von dir angezogen – die vielen kleinen Berührungen fallen ihm gar nicht mehr auf, zeigen dir aber umso mehr, wie wichtig zu ihm bist. 21 Oct 2020","https://www.wunderweib.de/10-zeichen-dafuer-dass-du-ihm-wirklich-wichtig-bist-13596.html#:~:text=gl%C3%BCcklich%20machen%20k%C3%B6nnen-,Ber%C3%BChrungen%2C%20die%20zeigen%2C%20ob%20ich%20ihm%20wichtig%20bin,wie%20wichtig%20zu%20ihm%20bist.","10 Zeichen dafür, dass du ihm wirklich wichtig bist - Wunderweib"
