PAA Title,Parent,Text,URL,URL Title
Wie verbessert man die Kommunikation in einer Beziehung?,Kommunikation in Beziehungen,"Kommunikation in Beziehungen: 10 Tipps, Sie nachhaltig zu verbessern Sprechen Sie an, was Sie stört. ...  Sachlich bleiben, ohne zu beleidigen. ...  Konstruktiv sein: Verbesserungsvorschläge machen. ...  Sich auf eine Diskussion einlassen. ...  Verallgemeinerungen vermeiden: immer, nie, ständig. ...  Reden Sie über Ihre Gefühle. More items... • 10 Nov 2020",https://www.claudia-voelker.de/anleitung-so-klappt-die-kommunikation-mit-dem-partner/,Kommunikation in der Partnerschaft verbessern - So geht's
Was ist Kommunikation in einer Beziehung?,Kommunikation in Beziehungen,"Der Austausch über eigene Wünsche und Vorstellungen, Pläne, Hoffnungen ist ein wichtiges Fundament für eine Beziehung. Und dazu gehört, dass man sich täglich austauscht und so Nähe zum Partner erlebt. Wer das nicht tut, für den besteht die Gefahr, dass man den Partner aus den Augen verliert. 10 Dec 2020","https://www.ardalpha.de/wissen/psychologie/liebe/paare-kommunikation-streit-liebe-100.html#:~:text=Der%20Austausch%20%C3%BCber%20eigene%20W%C3%BCnsche,Partner%20aus%20den%20Augen%20verliert.",Paare und Kommunikation: ""Schatz - wir müssen reden!"" | Liebe
Was wenn Kommunikation nicht funktioniert in Beziehung?,Kommunikation in Beziehungen,"Wird in einer Beziehung nicht gesprochen oder nur noch über Belangloses geredet, kann das negative Auswirkungen auf die Beziehungsqualität haben. Fehlen tiefgehende Gespräche und wertvolle Kommunikation, ist dies in der Regel genauso schädlich, wie gar nicht mehr mit seinem Partner oder seiner Partnerin zu sprechen. 17 Feb 2022","https://ratgeber.bunte.de/fehlende-kommunikation-in-der-beziehung-das-koennen-sie-tun_132032#:~:text=Wird%20in%20einer%20Beziehung%20nicht,oder%20seiner%20Partnerin%20zu%20sprechen.",Fehlende Kommunikation in der Beziehung: Das können Sie tun
Was ist die schwierigste Phase in einer Beziehung?,Kommunikation in Beziehungen,"Auch, wenn sie noch relativ am Anfang der Beziehung steht: Die Phase der Desillusionierung fällt den meisten Paaren am schwersten. 24 Jan 2023","https://www.freundin.de/liebe-verlieben-vertrauen-phasen-beziehung#:~:text=Auch%2C%20wenn%20sie%20noch%20relativ,den%20meisten%20Paaren%20am%20schwersten.",Von Verlieben bis Vertrauen: Die 9 Phasen jeder Beziehung | freundin.de
Wie kommuniziert man positiv?,Wie verbessert man die Kommunikation in einer Beziehung?,Positive Kommunikation Lächeln Sie! ...  Sprechen Sie täglich einem Mitmenschen ein Lob aus. ...  Zeigen Sie Verständnis für Ihre Mitmenschen und motivieren sie. ...  Verabschieden Sie sich von Verallgemeinerungen. ...  Streichen Sie das Wort „nicht“ aus Ihrem Wortschatz. ,https://www.wortreich-badhersfeld.de/das-wortreich/positive-kommunikation/,Positive Kommunikation – ein Muss! - wortreich in Bad Hersfeld
Was sollte man in der Kommunikation vermeiden?,Wie verbessert man die Kommunikation in einer Beziehung?,"   Vermeiden kann man dies, wenn man einige einfache Regeln beachtet: Nicht verallgemeinern. Bestimmte Aussagen sind Gift für eine erfolgreiche Kommunikation. ...  Ich-Aussagen. Viele sprechen gar nicht konkret von dem, was sie persönlich wollen. ...  Die Signale beobachten. ...  Fragen stellen. ...  Richtig zuhören. 12 Jan 2017",https://www.faktumblog.de/2017/01/missverstaendnisse-in-der-kommunikation-vermeiden/,Missverständnisse in der Kommunikation vermeiden
Wie funktioniert eine gute Kommunikation?,Was ist Kommunikation in einer Beziehung?,"Wichtige Bestandteile sind das Zuhören, eine offene, respektvolle Haltung, bewusstes Innehalten bei Irritationen sowie klare, authentische Aussagen. Wenn Sie Ihre Botschaft genau vermitteln können, Ihr Ziel erreichen und Ihrem Gesprächspartner dabei ein gutes Gefühl geben können, kommunizieren Sie gut. 20 Jan 2023","https://blog.hubspot.de/service/gute-kommunikation#:~:text=Wichtige%20Bestandteile%20sind%20das%20Zuh%C3%B6ren,geben%20k%C3%B6nnen%2C%20kommunizieren%20Sie%20gut.",Gute Kommunikation: Sieben Tipps für erfolgreiche Gespräche
Wann ist es besser sich zu trennen?,Was ist Kommunikation in einer Beziehung?,"Wenn du das Gefühl hast, immer mehr Zeit und Aufwand in die Beziehung zu investieren als er. Wenn er ständig Dinge tut, die dich kränken und verletzen. Wenn du dich mehr freust, Zeit ohne den Partner zu verbringen als mit ihm. Wenn ihr überhaupt nicht mehr zusammen lacht. 10 Jun 2022","https://www.womenshealth.de/love/partnerschaft/trennen-ja-oder-nein/#:~:text=Wenn%20du%20das%20Gef%C3%BChl%20hast,%C3%BCberhaupt%20nicht%20mehr%20zusammen%20lacht.",Soll ich mich trennen? Entscheidungshilfe! - Women's Health
Was Paare am Anfang falsch machen?,Was ist Kommunikation in einer Beziehung?,Diese 13 Fehler solltet ihr am Anfang euer Beziehung vermeiden Sich zu schnell verlieben. ...  Die eigenen Gefühle sofort preisgeben. ...  Warnsignale erkennen. ...  Zu schnell intim miteinander werden. ...  Neugierde über die finanzielle Lage zeigen. ...  Falsches Interesse an Hobbies zeigen. ...  Ständig Nachrichten schreiben. More items... • 18 Aug 2019,https://www.instyle.de/lifestyle/fehler-anfang-beziehung,"13 Fehler, die jeder am Anfang einer Beziehung macht - InStyle"
Was sollte man seinem Partner nicht erzählen?,Was wenn Kommunikation nicht funktioniert in Beziehung?,"„Wie bitte, ihr wart schon verlobt?! “ Am besten immer nur genau das erzählen, was die Partnerin oder der Partner wissen will; und kein Wort mehr. Sex-Fantasien – Was Ihnen im Bett gefällt und was nicht, sollte natürlich kein Geheimnis bleiben. 20 Jun 2018","https://www.bz-berlin.de/archiv-artikel/7-dinge-die-du-deinem-partner-nicht-unbedingt-sagen-solltest#:~:text=%E2%80%9EWie%20bitte%2C%20ihr%20wart%20schon,sollte%20nat%C3%BCrlich%20kein%20Geheimnis%20bleiben.","7 Dinge, die du deinem Partner nicht unbedingt sagen solltest - BZ Berlin"
Wie merke ich dass die Beziehung kaputt ist?,Was wenn Kommunikation nicht funktioniert in Beziehung?,"Ihr schweigt euch eher an als miteinander zu sprechen? Dann ist das ein klares Zeichen, dass das Interesse am anderen nicht mehr vorhanden ist. Das Aus an Kommunikation bedeutet über kurz oder lang auch das Aus der Beziehung. Versucht euch und euren Partner zu beobachten, wenn ihr diskutiert oder streitet. 1 Jun 2022","https://www.prosieben.de/serien/taff/news/signale-dass-eure-beziehung-am-ende-ist-57195#:~:text=Ihr%20schweigt%20euch%20eher%20an,auch%20das%20Aus%20der%20Beziehung.&text=Versucht%20euch%20und%20euren%20Partner,wenn%20ihr%20diskutiert%20oder%20streitet.","Signale, dass eure Beziehung am Ende ist - ProSieben"
Was macht die Liebe kaputt?,Was wenn Kommunikation nicht funktioniert in Beziehung?,"Sorgen und Ängste machen sich in dir breit und lassen dich nicht zur Ruhe kommen. Auch Eifersucht kann geschürt werden, wenn mal keine Antwort vom liebsten kommt. Auf Dauer kann das „ständige voneinander Hören“ für eine Beziehung belastend sein.","https://www.liebesmeer.de/ratgeber/partnerschaft-beziehung/beziehung-kaputt/#:~:text=Sorgen%20und%20%C3%84ngste%20machen%20sich,f%C3%BCr%20eine%20Beziehung%20belastend%20sein.",Beziehung kaputt: 13+1 Signale & was du tun kannst - LiebesMeer
Wann ist man kein Paar mehr?,Was ist die schwierigste Phase in einer Beziehung?,"Die Nähe des anderen fühlt sich unangenehm an     Fühlen sich Umarmungen oder andere zärtliche Gesten plötzlich unangenehm an, kann die Partnerschaft nicht mehr in Ordnung sein. Wer die Nähe des anderen nicht mehr erträgt, sollte ernsthaft über eine Trennung nachdenken.","https://greator.com/10-anzeichen-fuer-eine-kaputte-beziehung/#:~:text=Die%20N%C3%A4he%20des%20anderen%20f%C3%BChlt%20sich%20unangenehm%20an&text=F%C3%BChlen%20sich%20Umarmungen%20oder%20andere,ernsthaft%20%C3%BCber%20eine%20Trennung%20nachdenken.",10 Anzeichen für eine kaputte Beziehung: So erkennst du sie
Was schweißt ein Paar zusammen?,Was ist die schwierigste Phase in einer Beziehung?,"Gemeinsames Ritual     Ein Guten-Morgen-Kaffee mit Post-it, auf dem eine kleine Liebeserklärung steht, das weltbeste Rührei vom Partner, das es immer sonntags gibt oder ein gemeinsames Bad nach Feierabend. Schaffen Sie ein Ritual, an dem beide Spaß haben, das verbindet und das Ihnen das Gefühl gibt: Hier bin ich Zuhause. 6 Mar 2017","https://www.freundin.de/diese-5-dinge-schweissen-paare-zusammen#:~:text=Gemeinsames%20Ritual,gibt%3A%20Hier%20bin%20ich%20Zuhause.",Diese 5 Dinge schweißen Paare zusammen - Freundin
Wann ist die Liebe zu Ende?,Was ist die schwierigste Phase in einer Beziehung?,"Weitere Anzeichen dafür, dass die Partnerschaft nicht mehr das ist, was sie mal war, können sein: fehlende Eifersucht – es macht dir nichts aus, wenn er/sie fremdflirtet. steigendes Streitpotenzial – harmonische Gespräche finden kaum noch statt, stattdessen wird über alles sofort diskutiert. 15 Oct 2020","https://www.elitepartner.de/magazin/meistern/beziehung-am-ende/#:~:text=Weitere%20Anzeichen%20daf%C3%BCr%2C%20dass%20die,wird%20%C3%BCber%20alles%20sofort%20diskutiert",Beziehung am Ende? 7 Anzeichen für ein Liebes-Aus - ElitePartner
Wie kommuniziert man ohne zu reden?,Wie kommuniziert man positiv?,"Was ist nonverbale Kommunikation? Die nonverbale Kommunikation ist der Anteil einer Unterhaltung, der nicht aktive Sprache ist. Sie funktioniert über bestimmte Kanäle, wie etwa Mimik, Gestik, Körperhaltung und Stimme. Sie kann absichtlich oder unabsichtlich erfolgen und bewusst oder unbewusst wahrgenommen werden. 26 Nov 2019","https://blog.hubspot.de/sales/nonverbale-kommunikation#:~:text=Was%20ist%20nonverbale%20Kommunikation%3F,bewusst%20oder%20unbewusst%20wahrgenommen%20werden.","Nonverbale Kommunikation: Definition, Übungen, Tipps"
Wie Fehler kommunizieren?,Wie kommuniziert man positiv?,"Elke Schüttelkopf rät etwa dazu, den Fehler zwar zu benennen, aber dann so schnell wie möglich den Fokus der Kommunikation zu ändern: Weg vom Reden über den Fehler, hin zu den Erkenntnissen die man aus der Entdeckung des Fehlers gewonnen hat und wie er beseitigt wurde. 11 Jul 2016","https://www.impulse.de/organisation/fehlerkommunikation-unternehmen/2939437.html#:~:text=Elke%20Sch%C3%BCttelkopf%20r%C3%A4t%20etwa%20dazu,und%20wie%20er%20beseitigt%20wurde.",Fehlerkommunikation in Unternehmen: Wann Sie über Ihre Fehler reden ...
Wie kann man Kommunikation trainieren?,Wie kommuniziert man positiv?,II. Tipps für verbesserte Kommunikation Nehmen Sie sich Zeit! ...  Lassen Sie sich nicht ablenken! ...  „Ich empfinde...“ ...  Hören Sie bewusst zu! ...  Wiederholen Sie zuerst und setzen dann erst den Gedanken des Gesprächspartners fort! ...  Arbeiten Sie zusammen! ...  Gehen Sie es Stück für Stück an! ...  Drücken Sie sich klar aus! More items...,https://www.studierendenberatung.at/persoenlichkeitsentwicklung/kommunikation-verbessern/tipps-fuer-verbesserte-kommunikation/,Tipps für verbesserte Kommunikation - Psychologische Studentenberatung
Was sind typische Kommunikationsfehler?,Was sollte man in der Kommunikation vermeiden?,"   Kommunikationsfehler: nicht ausreden lassen/nicht zuhören     Nummer eins bei den Kommunikationsstörungen ist hier, wenn der andere oder die andere uns nicht ausreden lässt und man so den Eindruck bekommt, der Gesprächspartner oder die Gesprächspartnerin hört uns nicht richtig zu.","https://wirksam-kommunizieren.de/5-haeufige-kommunikationsfehler/#:~:text=Kommunikationsfehler%3A%20nicht%20ausreden%20lassen%2Fnicht%20zuh%C3%B6ren,-Im%20Rahmen%20meiner&text=Nummer%20eins%20bei%20den%20Kommunikationsst%C3%B6rungen,h%C3%B6rt%20uns%20nicht%20richtig%20zu.",5 häufige Kommunikationsfehler kennen und vermeiden
Wann ist eine Kommunikation gestört?,Was sollte man in der Kommunikation vermeiden?,"Mögliche Störungen    Störungen bei der Signalübertragung vom Sender zum Empfänger durch eine laute Geräuschkulisse, Ablenkungen, Sichtbehinderungen (bei nonverbaler Kommunikation), Signalunterbrechungen. fehlerhaftes Empfangen der Nachricht durch Beeinträchtigungen des Hörens oder falsche Interpretation der Nachricht. 28 Oct 2019","https://www.channelpartner.de/a/kennen-sie-die-wichtigen-grundprinzipien-in-der-kommunikation,241502,2#:~:text=M%C3%B6gliche%20St%C3%B6rungen&text=St%C3%B6rungen%20bei%20der%20Signal%C3%BCbertragung%20vom,oder%20falsche%20Interpretation%20der%20Nachricht.",Die wichtigsten Grundprinzipien in der Kommunikation - ChannelPartner
Was sind die größten Fehler in der Kommunikation?,Was sollte man in der Kommunikation vermeiden?,"Fehler 1: Erwartungen sind nicht geklärt     Menschen müssen ganz genau wissen, was von ihnen erwartet wird. Wenn ein Verkäufer nicht weiß, dass er A, B und C erledigen soll, dann wird er es wahrscheinlich nicht mit vollem Elan erledigen. Darum brauchen Verkäufer klare Ziele. 9 May 2017","https://www.marconomy.de/die-10-haeufigsten-fehler-in-der-kommunikation-a-606219/#:~:text=Fehler%201%3A%20Erwartungen%20sind%20nicht,Darum%20brauchen%20Verk%C3%A4ufer%20klare%20Ziele.",Die 10 häufigsten Fehler in der Kommunikation - Marconomy
Was sind die 3 Grundregeln der Kommunikation?,Wie funktioniert eine gute Kommunikation?,Gesprächsführung – Grundlegende Kommunikationsregeln / 3 Regeln für das Mitarbeitergespräch 3.1 Jeder soll gewinnen. ...  3.2 Wertschätzung gegenüber dem Gesprächspartner. ...  3.3 Glaubwürdigkeit. ...  3.4 Kein Zeitdruck. ,https://www.haufe.de/personal/haufe-personal-office-platin/gespraechsfuehrung-grundlegende-kommunikationsregeln-3-regeln-fuer-das-mitarbeitergespraech_idesk_PI42323_HI583053.html,Gesprächsführung – Grundlegende Kommunikationsregeln / 3 Regeln ...
Was sind die Grundregeln der Kommunikation?,Wie funktioniert eine gute Kommunikation?,"""Es ist nicht möglich, nicht zu kommunizieren"" und "" Jede Kommunikation hat Inhalts- und Beziehungsaspekte"" sind die zwei Grundregeln der Kommunikation nach dem renomierten Sozialwissenschaftler und Psychologe Paul Watzlawick. Was genau darunter zu verstehen ist erklärt Ihnen Ruth Pink. 7 Aug 2009","https://www.onpulson.de/89/die-grundregeln-der-kommunikation/#:~:text=%22Es%20ist%20nicht%20m%C3%B6glich%2C%20nicht,ist%20erkl%C3%A4rt%20Ihnen%20Ruth%20Pink.",Die Grundregeln der Kommunikation - Onpulson
Was ist eine schlechte Kommunikation?,Wie funktioniert eine gute Kommunikation?,"Zu den häufigsten Kommunikationsproblemen gehören Missverständnisse, unklare Aussagen und Fehlinterpretationen. Meist geschieht dies durch unaufmerksames Zuhören von Gesprächspartnern oder ungleicher Qualifikation des Sprachniveaus und des Sprachverständnisses beider Personen eines Dialoges.","https://blog.neuronation.com/de/kommunikationsprobleme/#:~:text=Zu%20den%20h%C3%A4ufigsten%20Kommunikationsproblemen%20geh%C3%B6ren,Sprachverst%C3%A4ndnisses%20beider%20Personen%20eines%20Dialoges.",Kommunikationsprobleme im Alltag vermeiden - NeuroNation
Was sind die häufigsten Trennungsgründe?,Wann ist es besser sich zu trennen?,"Einer Umfrage von Parship im Juni 2019 zufolge, gaben rund 29 Prozent der befragten Singles an, dass ein Grund für die Trennung war, dass mindestens einer von beiden in der Beziehung unglücklich war. Für rund ein Fünftel der Teilnehmer stellte das Fremdgehen einer der beiden den Trennungsgrund dar.","https://de.statista.com/statistik/daten/studie/1034490/umfrage/umfrage-zu-trennungsgruenden-in-deutschland-nach-geschlecht/#:~:text=Einer%20Umfrage%20von%20Parship%20im,der%20beiden%20den%20Trennungsgrund%20dar.",Gründe für eine Trennung in Deutschland nach Geschlecht 2019
Wie verhält sich ein Mann vor der Trennung?,Wann ist es besser sich zu trennen?,"Er hört nicht mehr richtig zu. Bei Streits winkt er ab oder, schlimmer noch, äfft Aussagen nach. Auch alarmierend: Er macht sich vor Anderen über (vermeintliche) Schwächen seiner Partnerin lustig. Er schert sich nicht mehr sonderlich um sein Äußeres. 4 May 2015","https://www.brigitte.de/liebe/beziehung/liebeskrise--10-zeichen-dafuer--dass-die-trennung-kurz-bevorsteht-10195068.html#:~:text=Er%20h%C3%B6rt%20nicht%20mehr%20richtig,mehr%20sonderlich%20um%20sein%20%C3%84u%C3%9Feres.","Liebeskrise: 10 Zeichen dafür, dass die Trennung kurz bevorsteht - Brigitte"
Welche Beziehungen sind toxisch?,Wann ist es besser sich zu trennen?,"""Toxische Beziehungen erkennt man daran, dass sie überhaupt nicht gut tun, sondern sogar sehr wehtun und seelisch und auch körperlich krank machen können"", erklärt Susanne Kraft. Ein toxischer Partner reagiere laut der Beziehungsexpertin auffällig häufig mit Kritik, Schuldzuweisungen und Herabwürdigungen. 22 Nov 2021","https://www.swr.de/swr1/rp/toxische-beziehungen-100.html#:~:text=%22Toxische%20Beziehungen%20erkennt%20man%20daran,mit%20Kritik%2C%20Schuldzuweisungen%20und%20Herabw%C3%BCrdigungen.",Schmerzhafte Liebe: Wie erkennt man eine toxische Beziehung? - SWR.de
Wie oft ist es normal miteinander zu schlafen?,Was Paare am Anfang falsch machen?,"Vier von zehn Paaren zwischen 18 und 69 Jahren landen mindestens einmal pro Woche im Bett. Ein weiteres Drittel (35 Prozent) vergnügt sich zwar nicht jede Woche, aber zumindest einmal oder mehrmals im Monat. Damit haben drei von vier Paare ein stabiles, regelmäßiges Sexleben. 6 Jun 2018","https://www.presseportal.de/pm/55165/3962690#:~:text=Vier%20von%20zehn%20Paaren%20zwischen,Paare%20ein%20stabiles%2C%20regelm%C3%A4%C3%9Figes%20Sexleben.","Studie belegt: Wer häufiger Sex hat, ist auch in der Beziehung zufriedener"
Was hält zwei Menschen zusammen?,Was Paare am Anfang falsch machen?,"Vertrauen, Offenheit, Ehrlichkeit (44 Prozent) Liebe und Zuneigung (41 Prozent) konstruktive Konfliktlösung und Kommunikation (36 Prozent) gemeinsame Interessen, Hobbys und Freunde (29 Prozent)","https://www.ardalpha.de/wissen/psychologie/liebe/paare-glueck-harmonie-liebe-100.html#:~:text=Vertrauen%2C%20Offenheit%2C%20Ehrlichkeit%20(44,Hobbys%20und%20Freunde%20(29%20Prozent)",Paare und Stabilität: Wer passt zu wem? | Liebe | Psychologie | Wissen
Warum enden viele Beziehungen nach 3 Monaten?,Was Paare am Anfang falsch machen?,"Der Grund: Der Spiegel der Hormone, die für die Verliebtheit sorgen, sinkt wieder, man kann halt nicht ewig im Rausch sein, das hat die Natur nicht vorgesehen. Und wenn der Kopf wieder klarer ist, kann man erst erkennen, wen man wirklich vor sich hat, ob das auch alles passt für den Alltag. 26 Jun 2018","https://www.rtl.de/cms/drei-monats-regel-wann-spricht-man-von-beziehung-2776745.html#:~:text=Der%20Grund%3A%20Der%20Spiegel%20der,alles%20passt%20f%C3%BCr%20den%20Alltag.",Drei-Monats-Regel: Wann spricht man von 'Beziehung'? - RTL News
Was stört Männer in einer Beziehung?,Was sollte man seinem Partner nicht erzählen?,"Auch wenn Männer und Frauen hier nicht immer die gleichen Angaben gemacht haben, sind sich beide Geschlechter in den oberen Bereichen des Rankings einig: Die schlimmsten No-Gos in einer Beziehung sind demnach unter anderem, sich gegenseitig zu ignorieren, im Streit zu schreien oder Beziehungskonflikte auszuplaudern. 2 Nov 2017","https://www.freundin.de/liebe-verletzte-maenner#:~:text=Auch%20wenn%20M%C3%A4nner%20und%20Frauen,zu%20schreien%20oder%20Beziehungskonflikte%20auszuplaudern.",Studie: Das verletzt Männer am meisten | freundin.de
Welche Geheimnisse darf es auch in einer Beziehung geben?,Was sollte man seinem Partner nicht erzählen?,"Solange man das Vertrauen des anderen nicht missbraucht und ihn betrügt (wie auch immer der Betrug geartet sein mag), ist alles gut. Eine kleine Heimlichkeit hier und da tut gut, Ihnen und Ihrer Beziehung. Lassen Sie sich bloß nichts anderes erzählen. Vergessen Sie nicht: Man darf alles essen, aber nicht alles wissen. 21 Nov 2020","https://www.gq-magazin.de/beziehung-sex/artikel/expertin-diese-geheimnisse-sollte-man-sich-in-einer-beziehung-bewahren#:~:text=Solange%20man%20das%20Vertrauen%20des,essen%2C%20aber%20nicht%20alles%20wissen.",Expertin: Diese Geheimnisse sollte man sich in einer Beziehung ... - GQ
Ist es ok Geheimnisse vor dem Partner zu haben?,Was sollte man seinem Partner nicht erzählen?,"Nicht alle Geheimnisse vor dem Partner sind schädlich     Denn es handele sich durchaus um eine menschliche Eigenschaft, dem Partner oder der Partnerin Dinge zu verschweigen, die kurzfristig für Unmut sorgen würden, aber langfristig keinerlei Bedeutung haben. 13 Aug 2020","https://www.gq-magazin.de/beziehung-sex/artikel/studie-ungesund-geheimnisse-partner#:~:text=Nicht%20alle%20Geheimnisse%20vor%20dem%20Partner%20sind%20sch%C3%A4dlich&text=Denn%20es%20handele%20sich%20durchaus,aber%20langfristig%20keinerlei%20Bedeutung%20haben.",Studie: So ungesund sind Geheimnisse vor dem Partner - GQ
In welchem Monat gehen die meisten Beziehungen kaputt?,Wie merke ich dass die Beziehung kaputt ist?,"Die Statistik bringt es eindeutig auf den Punkt: Die meisten Trennungen passieren im Frühjahr rund um Ostern und in der Vorweihnachtszeit, meist kurz vor Heiligabend. Wenn man sich die beiden Zeiträume ansieht, dann ist wahrscheinlich die vorweihnachtliche Zeit die Schlimmere, vor allem bei einem Partner. 12 Mar 2019","https://www.bunte.de/family/liebe/beziehung/trennung-das-ist-der-zeitpunkt-dem-die-meisten-beziehungen-die-brueche-gehen.html#:~:text=Die%20Statistik%20bringt%20es%20eindeutig,vor%20allem%20bei%20einem%20Partner.","Trennung: Das ist der Zeitpunkt, an dem die meisten Beziehungen in ..."
Was ist Gift für eine Beziehung?,Was macht die Liebe kaputt?,"Auf Dauer sind Kritik, Nörgelei und Vorwürfe Gift für deine Beziehungen. Gemeint ist hier besonders die Art von Kritik, die ungefragt geäußert wird, die anklagt und die vom anderen verlangt, dass er/sie etwas oder sich ändern soll.","https://www.alexandramarko.com/7-fragen-um-deine-kritik-loszulassen/#:~:text=Auf%20Dauer%20sind%20Kritik%2C%20N%C3%B6rgelei,etwas%20oder%20sich%20%C3%A4ndern%20soll.",Kritik ist Gift für deine Beziehungen! 7 Fragen um deine Kritik loszulassen.
Was ist ein Beziehungskiller?,Was macht die Liebe kaputt?,"Aktuelle Forschungen haben folgenden Beziehungskiller identifiziert: Angst vor Ablehnung und daraus folgend eine Distanzierung vom Partner. Viele Leute haben Angst, verletzt zu werden. Verständlich. Doch im Zuge dessen lassen sie sich erst gar nicht richtig auf den anderen ein. 27 Jul 2021","https://www.welt.de/kmpkt/article158751687/7-Wege-wie-du-deine-Beziehung-endgueltig-ruinierst.html#:~:text=Aktuelle%20Forschungen%20haben%20folgenden%20Beziehungskiller,richtig%20auf%20den%20anderen%20ein.","7 Wege, wie du deine Beziehung endgültig ruinierst - WELT"
Was soll man in einer Beziehung auf keinen Fall tun?,Was macht die Liebe kaputt?,"10 Dinge, die du in einer glücklichen Beziehung nie tun solltest Du machst alles gemeinsam mit deinem Partner. ...  Du vergleichst deinen Partner mit anderen. ...  Du lebst nur für deinen Partner. ...  Du vernachlässigst deine Hobbys. ...  Du hast wenig Kontakt zu deinen Freunden. ...  Du kritisierst deinen Partner. ...  Du sagst nicht oft genug „Danke“ More items... • 9 Sept 2016",https://www.instyle.de/lifestyle/10-dinge-die-du-nie-einer-gluecklichen-beziehung-tun-solltest,"10 Dinge, die du in einer glücklichen Beziehung nie tun solltest. - InStyle"
Wann wird eine Beziehung zur Belastung?,Wann ist man kein Paar mehr?,"Finanzielle Probleme, Stress im Job oder Arbeitslosigkeit etwa belasten Beziehungen. Auch die Geburt eines Kindes oder die schwere Krankheit eines Partners machen es der Beziehung zumindest vorübergehend schwer. Jeder Stress macht immer auch der Beziehung Stress, könnte man sagen. 19 Nov 2015","https://www.welt.de/gesundheit/psychologie/article149054337/Wann-sich-das-Glueck-in-Beziehungen-einstellt.html#:~:text=Finanzielle%20Probleme%2C%20Stress%20im%20Job,Beziehung%20Stress%2C%20k%C3%B6nnte%20man%20sagen.",Liebe: Wann sich das Glück in Beziehungen einstellt - WELT
Warum bleiben Paare zusammen wenn sie nicht glücklich sind?,Wann ist man kein Paar mehr?,"Angst vor dem Alleinsein     Menschen, die in einer unglücklichen Beziehung bleiben, haben oft grosse Angst vor Veränderungen und Einsamkeit. Sie fürchten sich, alleine zurechtkommen zu müssen. Kommt es dennoch zur Trennung, flüchten sie sich umgehend in die nächste Beziehung. 3 Aug 2021","https://www.doktorstutz.ch/7-gruende-warum-menschen-in-kaputten-beziehungen-bleiben/#:~:text=Angst%20vor%20dem%20Alleinsein,umgehend%20in%20die%20n%C3%A4chste%20Beziehung.","7 Gründe, warum Menschen in kaputten Beziehungen bleiben"
Wann sollte man sich trotz Liebe trennen?,Wann ist man kein Paar mehr?,"Eine Trennung trotz Liebe ist eine persönliche Entscheidung    Wie bereits erörtert, ist dein seelisches Wohlbefinden ein guter Indikator, um dich für eine Trennung zu entscheiden. Wenn du mehr unter der Beziehung leidest, als dass sie dich glücklich macht, ist ein Schlussstrich oftmals die bessere Wahl.","https://greator.com/trennung-trotz-liebe/#:~:text=Eine%20Trennung%20trotz%20Liebe%20ist%20eine%20pers%C3%B6nliche%20Entscheidung,-Soll%20ich%20um&text=Wie%20bereits%20er%C3%B6rtert%2C%20ist%20dein,Schlussstrich%20oftmals%20die%20bessere%20Wahl.",Trennung trotz Liebe: Wann ist dieser Schritt unumgänglich? - Greator
Was verbindet Paare am meisten?,Was schweißt ein Paar zusammen?,"Sexualität gehört zu einer Liebesbeziehung, denn sie sorgt für Bindung der Partner aneinander. Hat man immer weniger Sex, und leidet zumindest einer der Partner darunter, zerfällt auch das Wir-Gefühl schneller. [mehr - zum Artikel: Paare und Intimität - Ohne Sex läuft es nicht, oder? ] 10 Dec 2020","https://www.ardalpha.de/wissen/psychologie/liebe/paare-zusammenhalt-kommunikation-liebe-100.html#:~:text=Sexualit%C3%A4t%20geh%C3%B6rt%20zu%20einer%20Liebesbeziehung,l%C3%A4uft%20es%20nicht%2C%20oder%3F%20%5D","Was Paare zusammenhält: Liebe braucht Zeit, Zärtlichkeit, Zuwendung"
