PAA Title,Parent,Text,URL,URL Title
Wann ist es zu spät Beziehung?,Wann hat die Beziehung keine Zukunft mehr?,"Wenn es keinen Teil mehr in uns gibt, der unseren Partner liebt, ihm nah sein möchte und zusammen mit ihm alt werden will, ist es zu spät für diese Liebe. Nach wenigen weiteren Jahren geht es für den Partner, der um Paartherapie gebeten hat, nicht mehr weiter.","https://www.eft-paartherapie-hannover.de/wann-ist-es-zu-spaet/#:~:text=Wenn%20es%20keinen%20Teil%20mehr,gebeten%20hat%2C%20nicht%20mehr%20weiter.",Wann ist es zu spät? - EFT Paartherapie Hannover
Wann ist es zu spät für eine Paartherapie?,Wie verhält sich ein Mann vor der Trennung?,"An welchem Zeitpunkt einer Krise oder Beziehung sollte man einen Paartherapeuten aufsuchen? Aus Sicht der Experten gehen viele Paare zu spät zu einem Therapeuten - nämlich dann, wenn die Beziehung schon so marode ist, dass sie nicht mehr zu retten ist, wie Bernd Boettger sagt. 29 Jul 2016","https://www.sueddeutsche.de/leben/familie-alles-ueber-paartherapie-anfang-vom-ende-oder-letzte-rettung-dpa.urn-newsml-dpa-com-20090101-160721-99-768263#:~:text=An%20welchem%20Zeitpunkt%20einer%20Krise,ist%2C%20wie%20Bernd%20Boettger%20sagt.",Familie - Alles über Paartherapie: Anfang vom Ende oder letzte Rettung
Wie kann ich testen ob er mich noch liebt?,Wie verhält sich ein Mann vor der Trennung?,Liebt er mich noch Checkliste Er ist abwesend. ...  Er zeigt weniger Interesse an deinem Leben. ...  Er respektiert dich nicht mehr. ...  Er kümmert sich nicht mehr um deine Bedürfnisse. ...  Er geht schlechter mit Konflikten um. ...  Er redet negativ und hoffnungslos über eure Beziehung. ...  Er hängt nur noch am Handy. ...  Er sagt nicht mehr “Ich liebe dich” ,https://lovomi.de/liebt-er-mich-noch/,Liebt er mich noch? 8 entscheidende Alarmsignale - Lovomi
Wann weiß ich dass die Beziehung keinen Sinn mehr macht?,Wie verhält sich ein Mann vor der Trennung?,"Wenn noch so kleine Meinungsverschiedenheiten immer wieder in großen Streitereien und Dramen enden, ist das ein deutliches Zeichen dafür, dass Ihnen diese Beziehung nicht guttut. Egal, wie schön die Versöhnungen sein mögen – diese Basis der Kommunikation ist definitiv nicht gesund für eine glückliche Partnerschaft. 26 Aug 2020","https://www.fuersie.de/psychologie/5-anzeichen-dafuer-dass-die-beziehung-am-ende-ist-5555.html#:~:text=Wenn%20noch%20so%20kleine%20Meinungsverschiedenheiten,gesund%20f%C3%BCr%20eine%20gl%C3%BCckliche%20Partnerschaft.","5 Anzeichen dafür, dass die Beziehung keinen Sinn mehr macht"
Wie merke ich dass er in eine andere verliebt ist?,Wie verhält sich ein Mann Wenn er sich trennen will?,"Dein Partner geht dir aus dem Weg    Eines der deutlichsten Warnsignale ist es, wenn dein Partner Ausreden findet, um keine Zeit mit dir verbringen zu müssen. Hast du das Gefühl, er geht dir aus dem Weg, solltest du dich fragen, ob mehr dahinter steckt. 21 Feb 2018","https://www.instyle.de/lifestyle/partner-liebt-andere#:~:text=Dein%20Partner%20geht%20dir%20aus,fragen%2C%20ob%20mehr%20dahinter%20steckt.","5 Hinweise darauf, dass sich dein Freund gerade in eine Andere verliebt"
Wann beendet ein Mann eine Beziehung?,Wie verhält sich ein Mann Wenn er sich trennen will?,"Häufig kommt es vor, dass Langzeitbeziehungen in die Brüche gehen, sobald beide oder einer der Partner das 30. Lebensjahr erreicht. Grund ist häufig das Thema Familienplanung, das ab diesem Zeitpunkt immer präsenter wird, weil Freunde plötzlich anfangen zu heiraten oder Kinder bekommen. 7 Jan 2019","https://www.freundin.de/liebe-maenner-trennung-trotz-liebe#:~:text=H%C3%A4ufig%20kommt%20es%20vor%2C%20dass,zu%20heiraten%20oder%20Kinder%20bekommen.","Warum Männer Frauen verlassen, die sie eigentlich lieben | freundin.de"
Wie merkt man das man sich trennen sollte?,Wie verhält sich ein Mann Wenn er sich trennen will?,"   7 Anzeichen, dass du dich trennen solltest Du fühlst dich nicht wertgeschätzt. Der Gedanke an die Zukunft macht dir Angst. Du fühlst dich alleine. Du bist ständig gereizt. Ihr streitet destruktiv. Du fühlst dich zu anderen Menschen hingezogen. Du willst dich trennen. 26 Feb 2022",https://chrisbloom.de/blog/soll-ich-mich-trennen/,"Soll ich mich trennen? 7 Anzeichen, die für ""Ja"" sprechen - Chris Bloom"
Was sind die 4 Trennungsphasen?,Was muss ich als Erstes tun bei einer Trennung?,"Bei einer Trennung gibt es vier Phasen: Schock, Wut/Trauer, Reflexion/Neuorientierung und Neuanfang.","https://www.getyourlawyer.ch/familienrecht/trennung/#:~:text=Bei%20einer%20Trennung%20gibt%20es,%2C%20Reflexion%2FNeuorientierung%20und%20Neuanfang.",Die 4 Phasen der Trennung: vom Schock zum Aufbruch
Wie trennt man sich am besten wenn man zusammen wohnt?,Was muss ich als Erstes tun bei einer Trennung?,"Im gemeinsamen Gespräch sollte der Umgang mit dem weiteren Zusammenleben bis zum Auszug besprochen werden. So könnte die Wohnung in persönliche Bereiche aufgeteilt werden, während Küche und Bad weiterhin geteilt werden. Wichtig ist auch, dass nur noch getrennt gewirtschaftet wird und dass sich jeder selbst versorgt. 16 Jul 2020","https://www.tonight.de/ratgeber/bezehung-beenden-aus-fuer-die-liebe-wie-mache-ich-richtig-schluss_67292.html#:~:text=Im%20gemeinsamen%20Gespr%C3%A4ch%20sollte%20der,dass%20sich%20jeder%20selbst%20versorgt.",Liebes-Beziehung beenden: Wie macht man richtig Schluss?
Wer muss bei einer Trennung das Haus verlassen?,Was muss ich als Erstes tun bei einer Trennung?,"Grundsatz: Bei einer Trennung kann kein Ehegatte den anderen zum Auszug aus der Wohnung zwingen! Grundsätzlich hat jeder der beiden Eheleute das gleiche Recht, in der Ehewohnung zu bleiben, wie der andere Ehegatte.","https://www.scheidung-online.de/ehewohnung/auszug-bei-trennung/#:~:text=Grundsatz%3A%20Bei%20einer%20Trennung%20kann,bleiben%2C%20wie%20der%20andere%20Ehegatte.",Auszug bei Trennung - Wer muss ausziehen? - Scheidung Online
Welche Fragen stellt der paartherapeut?,Wann lohnt sich noch eine Paartherapie?,   Beginnen wir mit einigen möglichen Fragen für die erste Sitzung: 1 – Wie lange sind Sie schon ein Paar? ...  3 – Waren Sie schon einmal in einer Paartherapie? ...  5 – Was erwarten Sie sich von dieser Paartherapie? ...  7 – Was ist für Sie derzeit das größte Problem in der Beziehung? More items... • 10 Feb 2021,https://clevermemo.com/blog/paartherapie-fragen-paarberatung-systemische-paartherapie/,57 Paartherapie Fragen – Für die Paarberatung und systemische ...
Warum will er keine Paartherapie?,Wann lohnt sich noch eine Paartherapie?,"Der Weg zur Paartherapie impliziert für manche Männer, dass sie nicht selbst mit ihrer Partnerschaft und auftretende Unsicherheiten klarkommen. Sie sehen eine Beratung daher nicht als positiven Ansatz, um die Beziehung zu retten, sondern eher als Niederlage. 10 May 2021","https://www.lebensidealisten.de/blog/warum-wollen-maenner-keine-paartherapie/#:~:text=Der%20Weg%20zur%20Paartherapie%20impliziert,retten%2C%20sondern%20eher%20als%20Niederlage.",Warum wollen Männer keine Paartherapie? - Lebensidealisten
Wie oft muss man zur Paartherapie?,Wann lohnt sich noch eine Paartherapie?,"Behandlungsdauer von Paarberatung im Durchschnitt    10 % der Paare profitieren bei 1–2 Paarterminen. 50 % der Paare nutzen etwa sechs Sitzungen, um sich als Paar näherzukommen und die Veränderungen in der Beziehung weiterzuführen.","https://www.paarberatung-in-berlin.de/faqs/dauer-paartherapie-eheberatung#:~:text=Behandlungsdauer%20von%20Paarberatung%20im%20Durchschnitt,Ver%C3%A4nderungen%20in%20der%20Beziehung%20weiterzuf%C3%BChren.",Wie lang dauert eine Paartherapie? - Paarberatung in Berlin
Kann man alleine zur Eheberatung?,Wird eine Eheberatung von der Krankenkasse bezahlt?,"Eine Paartherapie alleine bietet dir einen sicheren Rahmen, um deine Bedürfnisse zu platzieren und kann auch bei möglichen Entscheidungsprozessen helfen - und ist manchmal sogar ein Akt der Selbstliebe. 2. Du kannst selbst ins Tun kommen und fühlst dich nicht mehr hilflos und alleine. 24 Jul 2020","https://lovemoves.de/paartherapie-blog/paartherapie-ueberreden-allein#:~:text=Eine%20Paartherapie%20alleine%20bietet%20dir,nicht%20mehr%20hilflos%20und%20alleine.",Soll ich meine bessere Hälfte zur Paartherapie überreden oder lieber ...
Wie viele Sitzungen Paartherapie?,Wird eine Eheberatung von der Krankenkasse bezahlt?,Eine Paartherapie ist eine auf kurze Zeit ausgerichtete Therapiemaßnahme. Viele Paare berichten über eine deutliche Besserung ihrer Beziehung nach 2-3 Sitzungen und beenden die Paartherapie meist nach 5-6 Sitzungen.,"https://www.einxzwei-paartherapie.de/ihr-termin/ablauf-einer-paartherapie/#:~:text=Dauer%20der%20Paartherapie-,Eine%20Paartherapie%20ist%20eine%20auf%20kurze%20Zeit%20ausgerichtete%20Therapiema%C3%9Fnahme.,meist%20nach%205%2D6%20Sitzungen.","Ablauf, Dauer und Inhalt der Paartherapie"
Was bringt mir eine Eheberatung?,Wird eine Eheberatung von der Krankenkasse bezahlt?,"Paartherapie und Eheberatung hilft dabei, das Gefühlschaos zu ordnen, Verletzungen zu minimieren und einen bestmöglichen Weg für beide Partner zu finden, an dessen Ende immer die bestmögliche Form der Beziehung steht, wie auch immer sich diese gestaltet. 20 Nov 2016","https://www.daniel-hitschmann.at/psychotherapie-blog/beziehung-paartherapie-eheberatung/#:~:text=Paartherapie%20und%20Eheberatung%20hilft%20dabei,auch%20immer%20sich%20diese%20gestaltet.",Wenn Trennung das Beste für die Beziehung ist – Paartherapie und ...
Kann man eine Paartherapie von der Steuer absetzen?,Welche Krankenkasse zahlt Paartherapie?,Sie können die Kosten der Paartherapie/Paarberatung gemäß § 33 EstG unter ""außergewöhnliche Belastungen allgemeiner Art"" steuerlich absetzen.,"https://www.praxisbonn.de/paartherapie/kosten/#:~:text=Sie%20k%C3%B6nnen%20die%20Kosten%20der,Belastungen%20allgemeiner%20Art%22%20steuerlich%20absetzen.",Kosten von Paartherapie und Paarberatung
Kann man Paartherapie von der Steuer absetzen?,Welche Krankenkasse zahlt Paartherapie?,"Paartherapie ist keine „Kassenleistung“ und wird damit von den gesetzlichen Krankenversicherungen nicht übernommen. Die Kosten für eine Paartherapie sind in den meisten Fällen jedoch als Außergewöhnliche Belastungen steuerlich absetzbar. Ein unverbindliches Kennenlern-Gespräch (90 Minuten) kostet 70,- €.","https://www.psychotherapie-in-nuernberg.eu/hinweise-zur-kostenerstattung#:~:text=Paartherapie%20ist%20keine%20%E2%80%9EKassenleistung%E2%80%9C%20und,)%20kostet%2070%2C%2D%20%E2%82%AC.","Hinweise zur Kostenerstattung bei Psychotherapie, Paartherapie"
Welche Arten von Paartherapie gibt es?,Welche Krankenkasse zahlt Paartherapie?,"   Bei der Paartherapie werden drei Ansätze unterschieden, die Studien zufolge gleichermaßen wirkungsvoll sind: die Verhaltenstherapie, die systemische und die tiefenpsychologische Paartherapie. Die Verhaltenstherapie versucht ungünstige Handlungsmuster in der Beziehung aufzudecken und Alternativen zu erarbeiten. 19 Feb 2008","https://www.brigitte.de/liebe/beziehung/paartherapie--tipps-vom-experten-10113310.html#:~:text=Bei%20der%20Paartherapie%20werden%20drei,aufzudecken%20und%20Alternativen%20zu%20erarbeiten.",Paartherapie: Tipps vom Experten | BRIGITTE.de
Wie kann ich die Beziehung retten?,Wer zahlt die Eheberatung?,"Tipps, wie ihr eure Beziehung noch retten könnt Schafft Abstand und gebt euch Freiraum. ...  Macht euch bewusst, warum ihr zusammen seid. ...  Schafft gemeinsame Rituale im Alltag. ...  Lasst euch auf Kompromisse ein. ...  Überrascht einander mit aufmerksamen Gesten. ...  Nähert euch körperlich wieder an. ...  Kommuniziert gewaltfrei. More items... • 29 Jul 2021",https://www.emotion.de/psychologie-partnerschaft/partnerschaft/beziehung-retten,Beziehung retten: So gebt ihr der Liebe noch eine Chance
Wann wird eine Paartherapie bezahlt?,Wer zahlt die Eheberatung?,"Eine Paartherapie wird in den meisten Fällen nicht von der Krankenkasse übernommen. Das liegt daran, dass eine solche Beratung nicht als Therapie im Sinne der gesetzlichen oder privaten Krankenversicherung zählt und auch nicht in den Bereich einer Psychotherapie fällt. 7 Jun 2021","https://www.lebensidealisten.de/blog/wird-eine-paarberatung-von-der-krankenkasse-uebernommen-oder-ist-sie-steuerlich-absetzbar/#:~:text=Eine%20Paartherapie%20wird%20in%20den,den%20Bereich%20einer%20Psychotherapie%20f%C3%A4llt.",Paartherapie: Krankenkasse oder steuerliche Absetzung?
Wie viele Paare trennen sich nach Paartherapie?,Was passiert in der Paartherapie?,"Auch eine konstruktive Trennung kann hilfreich sein und wird in der modernen Ergebnisforschung entsprechend bewertet. Vereinfacht gesagt, sind etwa zwei Drittel der Paartherapien erfolgreich, das heißt etwa 66 von 100 Paaren erleben irgendeine Verbesserung. 17 May 2010","https://www.sueddeutsche.de/wissen/paartherapie-66-prozent-erleben-irgendeine-besserung-1.456782#:~:text=Auch%20eine%20konstruktive%20Trennung%20kann,100%20Paaren%20erleben%20irgendeine%20Verbesserung.",Paartherapie - ""66 Prozent erleben irgendeine Besserung"" - Wissen
Wie viel kostet eine Stunde Paartherapie?,Was passiert in der Paartherapie?,"Bei einem seriösen und zertifizierten Therapeuten liegen die Kosten bei 80 bis 200€ pro Therapiestunde, je nach Dauer und Form der Paartherapie. Beachten Sie, ob die Abrechnung für 60 oder 90 Minuten Beratungszeit gilt. 5 May 2022","https://www.commerzbank.de/ratgeber/familie/was-kostet-eine-paartherapie/#:~:text=Bei%20einem%20seri%C3%B6sen%20und%20zertifizierten,oder%2090%20Minuten%20Beratungszeit%20gilt.",Kosten einer Paartherapie in der Übersicht - Commerzbank
Wer trägt die Kosten für eine Paartherapie?,Was passiert in der Paartherapie?,Paartherapie-Kosten müssen in der Regel von den betroffenen Paaren selbst getragen werden. Jeder Paartherapeut / jede Paartherapeutin kann die eigenen Preise frei festlegen.,"https://www.paarbalance.de/beziehungstipps/paartherapie-kosten/#:~:text=Paartherapie%2DKosten%20m%C3%BCssen%20in%20der,die%20eigenen%20Preise%20frei%20festlegen.",Komplette Übersicht aller Kosten einer Paartherapie - PaarBalance
Wie viel kostet eine Eheberatung?,Wie viel kostet ein beziehungscoach?,"Durchschnittlich liegen die Kosten für eine Eheberatung zwischen 80 und 120 Euro pro Stunde. Diese müssen von den Ehepartnern selbst getragen werden, da die Krankenkasse diese nicht übernimmt.","https://www.sat1.de/themen/ratgeber/news/eheberatung-kosten-ablauf-und-erfolg-der-paartherapie-50622#:~:text=Durchschnittlich%20liegen%20die%20Kosten%20f%C3%BCr,die%20Krankenkasse%20diese%20nicht%20%C3%BCbernimmt.","Eheberatung: Kosten, Ablauf und Erfolg - SAT.1 Ratgeber"
Was wird bei der Eheberatung besprochen?,Wie viel kostet ein beziehungscoach?,"   Was macht man bei einer Paartherapie? Die Inhalte der Paartherapie richten sich an den Zielen des Paares aus. Das kann sein, die Partnerschaft zu verbessern, aber auch darin bestehen, die Beziehung zu beenden. In der ersten Sitzung klärt der Therapeut mit dem Paar, was in der Paartherapie bearbeitet werden soll. 23 Aug 2021","https://www.netdoktor.de/therapien/psychotherapie/paartherapie/#:~:text=den%20Sitzungen%20hinzu.-,Was%20macht%20man%20bei%20einer%20Paartherapie%3F,der%20Paartherapie%20bearbeitet%20werden%20soll.","Paartherapie: Methode, Anwendung, Wirkung - NetDoktor.de"
Wird ein Coaching von der Krankenkasse bezahlt?,Wie viel kostet ein beziehungscoach?,"Psychologische Beratung und Coaching werden von den Krankenkassen grundsätzlich nicht übernommen. Diese Leistungen können Sie daher nur als Selbstzahler in Anspruch nehmen. Sie erhalten nach unserem Gespräch eine Rechnung, die Sie entweder direkt in bar oder per Überweisung bezahlen können.","https://www.beratung-retzbach.de/ablauf-und-kosten/#:~:text=Psychologische%20Beratung%20und%20Coaching%20werden,oder%20per%20%C3%9Cberweisung%20bezahlen%20k%C3%B6nnen.",Ablauf und Kosten | Psychologische Beratung und Therapie
Wann lehnt Krankenkasse Therapie ab?,Wird Psychotherapie von der AOK bezahlt?,"Wenn die Psychotherapie allein der Erziehungs-, Ehe-, Lebens- oder Sexualberatung dient, ist sie keine Leistung der Krankenversicherung, das heißt, die TK kann keine Kosten übernehmen.","https://www.tk.de/techniker/leistungen-und-mitgliedschaft/informationen-versicherte/leistungen/weitere-leistungen/faq-psychotherapie/wann-uebernimmt-tk-kosten-fuer-psychotherapie-2005914#:~:text=Wenn%20die%20Psychotherapie%20allein%20der,TK%20kann%20keine%20Kosten%20%C3%BCbernehmen.",Wann übernimmt die TK die Kosten für eine Psychotherapie?
Wie viele Therapiestunden zahlt die Krankenkasse?,Wird Psychotherapie von der AOK bezahlt?,Systemische Therapie: 36 Stunden. Verhaltenstherapie: 60 Stunden. Tiefenpsychologisch fundierte Psychotherapie: 60 Stunden. Analytische Psychotherapie: 160.,"https://www.tk.de/techniker/leistungen-und-mitgliedschaft/informationen-versicherte/leistungen/weitere-leistungen/faq-psychotherapie/welche-psychotherapeutischen-behandlungenarten-zahlt-tk-2005916#:~:text=Systemische%20Therapie%3A%2036%20Stunden,Analytische%20Psychotherapie%3A%20160",Welche psychotherapeutischen Behandlungsarten zahlt die TK?
Was kann man alles ohne Nachweis von der Steuer absetzen?,Was zählt zu den außergewöhnlichen Belastungen?,"Arbeitsmittel, wie Schreibwaren, Computer, Arbeitskleidung oder Fachliteratur können bis zu einem Wert von 110 Euro ohne Beleg als Werbungskosten eingetragen werden. Arbeitsmittel sind ein Klassiker der Nichtbeanstandungsgrenzen und werden daher von den meisten Finanzämtern ohne Probleme anerkannt. 12 Feb 2021","https://finanzensteuern.de/aufwendungen-ohne-belege-absetzen-was-sind-nichtbeanstandungsgrenzen/#:~:text=Arbeitsmittel%2C%20wie%20Schreibwaren%2C%20Computer%2C,meisten%20Finanz%C3%A4mtern%20ohne%20Probleme%20anerkannt.",Aufwendungen ohne Belege absetzen – Was sind ...
Was kann ich bei einer Trennung steuerlich absetzen?,Was zählt zu den außergewöhnlichen Belastungen?,Ab dem Zeitpunkt der Trennung können Unterhaltszahlungen mit bis zu 13.805 € pro Jahr über das sogenannte begrenzte Realsplitting oder als außergewöhnliche Belastung mit bis zu 8.820 € jährlich steuerlich abgesetzt werden. 22 Dec 2022,"https://www.kanzlei-hasselbach.de/blog/scheidung-und-steuern/#:~:text=Ab%20dem%20Zeitpunkt%20der%20Trennung,%E2%82%AC%20j%C3%A4hrlich%20steuerlich%20abgesetzt%20werden.",Scheidungskosten absetzen - Scheidung und Steuern
Wird eine Familientherapie von der Krankenkasse bezahlt?,Was macht man in einer Familientherapie?,"Da Paar- und Familientherapie nicht zur Psychotherapie zählen, werden die Kosten auch nicht von den gesetzlichen oder privaten Krankenkassen übernommen.","https://www.therapie.de/psyche/info/fragen/wichtigste-fragen/paartherapie-familientherapie/#:~:text=Da%20Paar%2D%20und%20Familientherapie%20nicht,gesetzlichen%20oder%20privaten%20Krankenkassen%20%C3%BCbernommen.",Kostenübernahme bei Paartherapie / Familientherapie - Therapie.de
Wie lange dauert eine Sitzung in der Familientherapie?,Was macht man in einer Familientherapie?,"Aufsuchende Familientherapie dauert zwischen 26 und 52 Wochen. Hierdurch soll vermieden werden, dass eine Familie sich an die Therapie gewöhnt. Außerdem soll gefördert werden, dass die Familienmitglieder eigenverantwortlich handeln und ihre Ressourcen nutzen. 30 Jun 2021","https://www.betanet.de/aufsuchende-famlientherapie.html#:~:text=Aufsuchende%20Familientherapie%20dauert%20zwischen%2026,handeln%20und%20ihre%20Ressourcen%20nutzen.",Aufsuchende Familientherapie - Systemische Therapie im eigenen ...
Wann ist eine Liebe nicht mehr zu retten?,Wann ist es zu spät Beziehung?,"Trennt sich der eine ohne jede Vorankündigung und ohne weitere Reue zu zeigen, ist die Beziehung wahrscheinlich kaum noch zu retten. Haben beide die Anzeichen zwar bemerkt, konnten aber ohne Hilfe von außen nicht damit umgehen und wird die Trennung im Nachgang auch bedauert, dann ist da noch Hoffnung. 22 Jun 2021","https://www.parship.at/ratgeber/beziehung/beziehung-retten/#:~:text=Trennt%20sich%20der%20eine%20ohne,dann%20ist%20da%20noch%20Hoffnung.",Beziehung retten - ja oder nein: Gehen oder bleiben? - Parship
Kann eine kaputte Liebe wieder heilen?,Wann ist es zu spät Beziehung?,"   Rette deine kaputte Beziehung, indem du lernst, deine Bedürfnisse klarer zu kommunizieren. Unter einigen Voraussetzungen lassen sich sowohl kaputte Beziehungen als auch bereits beendete Partnerschaften retten. Es ist nur sinnvoll, eine Beziehung zu retten, wenn ihr eine gemeinsame Vision formulieren könnt. 2 Feb 2021","https://chrisbloom.de/blog/beziehung-retten/#:~:text=Rette%20deine%20kaputte%20Beziehung%2C%20indem,eine%20gemeinsame%20Vision%20formulieren%20k%C3%B6nnt.","Beziehung retten: 9 Tipps, um die Liebe zu reparieren - Chris Bloom"
In welcher Phase trennen sich die meisten Paare?,Wie viele Paare trennen sich nach Paartherapie?,"Immer häufiger trennen sich Paare in den ersten drei Beziehungsphasen, weil es ihnen an Verständnis und Akzeptanz fehlt. In dieser Phase hat die Beziehung bereits alle Höhen und Tiefen durchlebt. Es sind viele Dinge passiert, die einen zusammengeschweißt haben.","https://www.forschung-und-wissen.de/magazin/die-5-phasen-der-liebe-in-einer-beziehung-13372118#:~:text=Immer%20h%C3%A4ufiger%20trennen%20sich%20Paare,passiert%2C%20die%20einen%20zusammengeschwei%C3%9Ft%20haben.",Die 5 Phasen der Liebe in einer Beziehung - Forschung und Wissen
Wie oft finden getrennte Paare wieder zusammen?,Wie viele Paare trennen sich nach Paartherapie?,"Denn viele Paare, die ihre Beziehung beenden, finden am Ende doch wieder zueinander. Demnach ergab eine Studie aus dem Jahr 2013, dass mehr als ein Drittel der Paare, die zusammenleben, und ein Fünftel der verheirateten Paare nach einer Trennung wieder zusammengekommen sind. 30 Apr 2022","https://www.businessinsider.de/leben/beziehung/ihr-seid-nach-einer-trennung-wieder-zusammen-dieser-leitfaden-zeigt-euch-wie-ihr-den-erneuten-weg-in-die-beziehung-in-acht-schritten-meistert-b/#:~:text=Denn%20viele%20Paare%2C%20die%20ihre,einer%20Trennung%20wieder%20zusammengekommen%20sind.",Wieder mit dem Ex zusammen: So klappt eine zweite Beziehung
Kann Abstand die Beziehung retten?,Wie viele Paare trennen sich nach Paartherapie?,"Wenn ihr euch in einer Situation komplett verfahren habt, kann auch eine Auszeit helfen, um Abstand zu gewinnen. Manchmal hilft eine räumliche Trennung für ein paar Tage. Bei großen Krisen ist auch eine Beziehungspause ratsam, um wieder mehr Klarheit über die Partnerschaft zu bekommen. 29 Jun 2021","https://www.parship.de/ratgeber/loslassen/beziehung-retten/#:~:text=Wenn%20ihr%20euch%20in%20einer,%C3%BCber%20die%20Partnerschaft%20zu%20bekommen.",Beziehung retten: So kämpfst du erfolgreich um den Partner - Parship
Wann die Ehe aufgeben?,Kann eine Eheberatung wirklich helfen?,"Wann es besser ist sich zu trennen    Dies ist immer der Fall, wenn Gewalt gegen die eigene Person oder die Kinder im Spiel ist, egal ob diese physischer oder psychischer Natur ist. Wenn die Beziehung toxisch und verletzend ist, muss man seine Ehe nicht retten (wollen). 26 Mar 2022","https://www.familie.de/familienleben/ehe-retten-tipps-fuer-eltern-in-der-krise/#:~:text=Wann%20es%20besser%20ist%20sich%20zu%20trennen,-W%C3%A4hrend%20es%20gute&text=Dies%20ist%20immer%20der%20Fall,Ehe%20nicht%20retten%20(wollen).",Ehe retten: 11 Tipps und 5 Gründe eure Beziehung zu retten - Familie.de
Wann soll ich mich trennen?,Kann eine Eheberatung wirklich helfen?,"Wenn du das Gefühl hast, immer mehr Zeit und Aufwand in die Beziehung zu investieren als er. Wenn er ständig Dinge tut, die dich kränken und verletzen. Wenn du dich mehr freust, Zeit ohne den Partner zu verbringen als mit ihm. Wenn ihr überhaupt nicht mehr zusammen lacht. 10 Jun 2022","https://www.womenshealth.de/love/partnerschaft/trennen-ja-oder-nein/#:~:text=Wenn%20du%20das%20Gef%C3%BChl%20hast,%C3%BCberhaupt%20nicht%20mehr%20zusammen%20lacht.",Soll ich mich trennen? Entscheidungshilfe! - Women's Health
Wie kann man wieder zueinander finden?,Kann eine Eheberatung wirklich helfen?,Diese Tipps können helfen: Entspanne dich! ...  Seid mal wieder gut zueinander! ...  Macht mal etwas anderes! ...  Habt mal spontan Sex! ...  Unternimm öfter etwas alleine! ...  Mache den Zufriedenheits-Test! ...  Führt öfter 2+2-Gespräche! ...  Schafft euch eine gemeinsame Vision! More items... • 23 Jan 2023,https://www.womenshealth.de/love/partnerschaft/beziehung-auffrischen-mit-einfachen-tipps/,Beziehung retten: 9 Tipps | WOMEN'S HEALTH
Wann ist es zu spät für eine Paartherapie?,Wie viele Sitzungen Paartherapie?,"An welchem Zeitpunkt einer Krise oder Beziehung sollte man einen Paartherapeuten aufsuchen? Aus Sicht der Experten gehen viele Paare zu spät zu einem Therapeuten - nämlich dann, wenn die Beziehung schon so marode ist, dass sie nicht mehr zu retten ist, wie Bernd Boettger sagt. 29 Jul 2016","https://www.sueddeutsche.de/leben/familie-alles-ueber-paartherapie-anfang-vom-ende-oder-letzte-rettung-dpa.urn-newsml-dpa-com-20090101-160721-99-768263#:~:text=An%20welchem%20Zeitpunkt%20einer%20Krise,ist%2C%20wie%20Bernd%20Boettger%20sagt.",Familie - Alles über Paartherapie: Anfang vom Ende oder letzte Rettung
Wann ist es zu spät für die Ehe?,Wie viele Sitzungen Paartherapie?,"Wenn sich schon eine Form der Gleichgültigkeit gegenüber dem Partner eingeschlichen hat. Wenn sich Partner gegenseitig verletzen und diese Kränkungen unter den Tisch fallen lassen ohne darüber zu sprechen, ohne sich mitzuteilen, dann ist der richtige Zeitpunkt für die Ehe definitiv überschritten. 26 Jan 2015","https://www.bild.de/ratgeber/partnerschaft/ehe/langzeitliebe-oder-strohfeuer-wann-ist-es-zu-spaet-fuer-die-ehe-39418916.bild.html#:~:text=Wenn%20sich%20schon%20eine%20Form,f%C3%BCr%20die%20Ehe%20definitiv%20%C3%BCberschritten.",Langzeitliebe vs. Strohfeuer: Wann ist es zu spät für die Ehe? - BILD.de
