PAA Title,Parent,Text,URL,URL Title
Was sind die 4 Ebenen der Kommunikation?,Wann ist eine Kommunikation nicht gelungen?,"   Nach dem Kommunikationsmodell hat jede Nachricht vier Seiten: Sachebene, Selbstoffenbarung, Beziehung und Appell. 30 Jul 2020","https://www.bachelorprint.de/methodik/4-ohren-modell/#:~:text=Nach%20dem%20Kommunikationsmodell%20hat%20jede,%2C%20Selbstoffenbarung%2C%20Beziehung%20und%20Appell.",Das Vier-Ohren-Modell - Klassisches Kommunikationsmodell
Was gehört alles zur Kommunikation?,Wann ist eine Kommunikation nicht gelungen?,"Kommunikation umfasst alle Fähigkeiten des Menschen, sich anderen mitzuteilen und andere zu verstehen. Sie ist das Mittel, um Botschaften, Wünsche, Erwartungen und Gefühle auszutauschen.","https://www.berufsstrategie.de/bewerbung-karriere-soft-skills/kommunikation.php#:~:text=Kommunikation%20umfasst%20alle%20F%C3%A4higkeiten%20des,W%C3%BCnsche%2C%20Erwartungen%20und%20Gef%C3%BChle%20auszutauschen.",Kommunikation und Kommunikationsmodelle
Was sind die 3 Grundregeln der Kommunikation?,Welche drei Arten von Kommunikation gibt es?,Gesprächsführung – Grundlegende Kommunikationsregeln / 3 Regeln für das Mitarbeitergespräch 3.1 Jeder soll gewinnen. ...  3.2 Wertschätzung gegenüber dem Gesprächspartner. ...  3.3 Glaubwürdigkeit. ...  3.4 Kein Zeitdruck. ,https://www.haufe.de/personal/haufe-personal-office-platin/gespraechsfuehrung-grundlegende-kommunikationsregeln-3-regeln-fuer-das-mitarbeitergespraech_idesk_PI42323_HI583053.html,Gesprächsführung – Grundlegende Kommunikationsregeln / 3 Regeln ...
Welche 4 Elemente gehören zur Kommunikation?,Welche drei Arten von Kommunikation gibt es?,"4 Arten der Kommunikation Nonverbale Kommunikation. Es ist interessant festzustellen, dass die nonverbale Kommunikation sowohl absichtlich als auch unabsichtlich eingesetzt wird. ...  Verbale Kommunikation. ...  Schriftliche Kommunikation. ...  Visuelle Kommunikation. 19 Jan 2021",https://www.valamis.com/de/hub/kommunikationsformen,"4 Arten der Kommunikation: Verbal, Nonverbal, Schriftlich, Visuell"
Wann beginnt eine Kommunikation?,Welche drei Arten von Kommunikation gibt es?,"Sobald sich zwei Menschen zusammen aufhalten, läuft bewusst oder unterbewusst Kommunikation ab. Daraus ergibt sich, dass man auch mit dem Körper kommunizieren kann. Sogar die Kleidung kann ein Teil der Kommunikation sein.","https://www.studienkreis.de/deutsch/kommunikation-ueberblick/#:~:text=Sobald%20sich%20zwei%20Menschen%20zusammen,ein%20Teil%20der%20Kommunikation%20sein.",Was ist Kommunikation? - Deutsch Klasse 10 - Studienkreis.de
Was stört die Kommunikation?,Was verbessert die Kommunikation?,"Mögliche Störungen    Störungen bei der Signalübertragung vom Sender zum Empfänger durch eine laute Geräuschkulisse, Ablenkungen, Sichtbehinderungen (bei nonverbaler Kommunikation), Signalunterbrechungen. fehlerhaftes Empfangen der Nachricht durch Beeinträchtigungen des Hörens oder falsche Interpretation der Nachricht. 28 Oct 2019","https://www.channelpartner.de/a/kennen-sie-die-wichtigen-grundprinzipien-in-der-kommunikation,241502,2#:~:text=M%C3%B6gliche%20St%C3%B6rungen&text=St%C3%B6rungen%20bei%20der%20Signal%C3%BCbertragung%20vom,oder%20falsche%20Interpretation%20der%20Nachricht.",Die wichtigsten Grundprinzipien in der Kommunikation - ChannelPartner
Was ist eine schlechte Kommunikation?,Was verbessert die Kommunikation?,"Zu den häufigsten Kommunikationsproblemen gehören Missverständnisse, unklare Aussagen und Fehlinterpretationen. Meist geschieht dies durch unaufmerksames Zuhören von Gesprächspartnern oder ungleicher Qualifikation des Sprachniveaus und des Sprachverständnisses beider Personen eines Dialoges.","https://blog.neuronation.com/de/kommunikationsprobleme/#:~:text=Zu%20den%20h%C3%A4ufigsten%20Kommunikationsproblemen%20geh%C3%B6ren,Sprachverst%C3%A4ndnisses%20beider%20Personen%20eines%20Dialoges.",Kommunikationsprobleme im Alltag vermeiden - NeuroNation
Wie verbessert man die Kommunikation in einer Beziehung?,Was verbessert die Kommunikation?,"Kommunikation in Beziehungen: 10 Tipps, Sie nachhaltig zu verbessern Sprechen Sie an, was Sie stört. ...  Sachlich bleiben, ohne zu beleidigen. ...  Konstruktiv sein: Verbesserungsvorschläge machen. ...  Sich auf eine Diskussion einlassen. ...  Verallgemeinerungen vermeiden: immer, nie, ständig. ...  Reden Sie über Ihre Gefühle. More items... • 10 Nov 2020",https://www.claudia-voelker.de/anleitung-so-klappt-die-kommunikation-mit-dem-partner/,Kommunikation in der Partnerschaft verbessern - So geht's
Wie kommuniziert man ohne zu reden?,Wann geht Kommunikation schief?,"Was ist nonverbale Kommunikation? Die nonverbale Kommunikation ist der Anteil einer Unterhaltung, der nicht aktive Sprache ist. Sie funktioniert über bestimmte Kanäle, wie etwa Mimik, Gestik, Körperhaltung und Stimme. Sie kann absichtlich oder unabsichtlich erfolgen und bewusst oder unbewusst wahrgenommen werden. 26 Nov 2019","https://blog.hubspot.de/sales/nonverbale-kommunikation#:~:text=Was%20ist%20nonverbale%20Kommunikation%3F,bewusst%20oder%20unbewusst%20wahrgenommen%20werden.","Nonverbale Kommunikation: Definition, Übungen, Tipps"
Was sind Fehler in der Kommunikation?,Wann geht Kommunikation schief?,"Fehler # 1: Kein Ziel, kein Plan     Mit dem ""Viel reden, wenig sagen - Kommunikationsstil"" bist du ganz klar im peinlichen Bereich der Kommunikation. Wie es besser geht: Überlege dir vorher, was du genau sagen möchtest. Den Zuhörern hilft es sogar, wenn du diese Kernaussage ankündigst. 22 Jun 2021","https://www.xing.com/news/insiders/articles/diese-5-peinlichen-kommunikationsfehler-kannst-du-ganz-einfach-vermeiden-4048101?xng_share_origin=web#:~:text=Fehler%20%23%201%3A%20Kein%20Ziel%2C%20kein%20Plan&text=Mit%20dem%20%22Viel%20reden%2C%20wenig,wenn%20du%20diese%20Kernaussage%20ank%C3%BCndigst.",Diese 5 peinlichen Kommunikationsfehler kannst du ...
Wie klärt man Missverständnisse?,Wann geht Kommunikation schief?,"Beim Gespräch aktiv zuhören     Mitarbeitende möchten wissen, ob sie verstanden wurden. Ein Lächeln oder Nicken signalisiert, dass dies der Fall ist. Doch auch Nachfragen vermitteln, dass man zugehört hat – vor allem, wenn man dabei in eigenen Worten kurz wiedergibt, was der oder die andere zuvor gesagt hat. 26 Mar 2021","https://topeins.dguv.de/arbeitssicherheit/missverstaendnisse-vermeiden-so-gehts/#:~:text=Beim%20Gespr%C3%A4ch%20aktiv%20zuh%C3%B6ren&text=Mitarbeitende%20m%C3%B6chten%20wissen%2C%20ob%20sie,die%20andere%20zuvor%20gesagt%20hat.","Missverständnisse vermeiden, so geht's – top eins - DGUV"
Wie verhält sich ein toxischer Mann?,Welche Beziehungen sind toxisch?,"Wie verhalten sich toxische Männer? Toxische Männer schlucken ihre Emotionen einfach herunter, denn sie glauben, alles andere wäre ein Zeichen von Schwäche. Sie geben alles, um immer der dominante Part zu sein und haben kein Problem damit, andere Personen herabzuwürdigen – vor allem Frauen.","https://greator.com/toxische-maenner/#:~:text=%C3%BCberholten%20Verst%C3%A4ndnis%20geht.-,Wie%20verhalten%20sich%20toxische%20M%C3%A4nner%3F,Personen%20herabzuw%C3%BCrdigen%20%E2%80%93%20vor%20allem%20Frauen.",8 Anzeichen für toxische Männer in einer Beziehung - Greator
Was ärgert toxische Menschen?,Welche Beziehungen sind toxisch?,"Sie verwickeln Sie in ihre Manipulationen. Mit Gaslighting, emotionaler Erpressung und anderen Manipulationstechniken sind toxische Menschen vertraut. Solche Personen manipulieren, um andere Menschen zu kontrollieren. Um sich Vorteile zu verschaffen, untergraben, verwirren und verletzen sie andere Menschen. 17 May 2018","https://www.karstennoack.de/toxische-menschen-tipps/#:~:text=Sie%20verwickeln%20Sie%20in%20ihre%20Manipulationen,und%20verletzen%20sie%20andere%20Menschen.","Toxische Menschen: 11 Tipps, was sie tun und wie mit ihnen ..."
Wie verhält sich ein Narzisst in einer Beziehung?,Welche Beziehungen sind toxisch?,"Durch den starken Egoismus des Narzissten ist der Partner gezwungen, mehr auf den narzisstischen Partner zu achten als auf sich selbst. Der Narzisst steht im Mittelpunkt – durch permanente Stimmungsschwankungen und Empfindlichkeit ist es dem Partner beinahe unmöglich eigene Ansprüche zu äußern.","https://www.oberbergkliniken.de/artikel/narzissmus-und-partnerschaft#:~:text=Durch%20den%20starken%20Egoismus%20des,unm%C3%B6glich%20eigene%20Anspr%C3%BCche%20zu%20%C3%A4u%C3%9Fern.",Narzissmus und Partnerschaft - Oberberg Kliniken
Wann ist es keine Liebe mehr?,Wie merkt man dass eine Beziehung zu Ende ist?,"Wenn du dich in seiner / ihrer Nähe nicht mehr wohlfühlst, eure Zweisamkeit nicht mehr genießen kannst und dich stattdessen ein schlechtes Gewissen plagt, weil du dir immer häufiger Zeit für dich allein oder die Gesellschaft von anderen Personen wünschst, ist das ein eindeutiges Zeichen dafür, dass sich deine Gefühle ... 17 Dec 2021","https://www.cosmopolitan.de/keine-gefuehle-mehr-115276.html#:~:text=Wenn%20du%20dich%20in%20seiner,daf%C3%BCr%2C%20dass%20sich%20deine%20Gef%C3%BChle",Keine Gefühle mehr: Diese 5 Anzeichen sprechen dafür
Welche Beziehungen sind toxisch?,Wie merkt man dass eine Beziehung zu Ende ist?,"""Toxische Beziehungen erkennt man daran, dass sie überhaupt nicht gut tun, sondern sogar sehr wehtun und seelisch und auch körperlich krank machen können"", erklärt Susanne Kraft. Ein toxischer Partner reagiere laut der Beziehungsexpertin auffällig häufig mit Kritik, Schuldzuweisungen und Herabwürdigungen. 22 Nov 2021","https://www.swr.de/swr1/rp/toxische-beziehungen-100.html#:~:text=%22Toxische%20Beziehungen%20erkennt%20man%20daran,mit%20Kritik%2C%20Schuldzuweisungen%20und%20Herabw%C3%BCrdigungen.",Schmerzhafte Liebe: Wie erkennt man eine toxische Beziehung? - SWR.de
Was Macht die Liebe kaputt?,Wie merkt man dass eine Beziehung zu Ende ist?,"Sorgen und Ängste machen sich in dir breit und lassen dich nicht zur Ruhe kommen. Auch Eifersucht kann geschürt werden, wenn mal keine Antwort vom liebsten kommt. Auf Dauer kann das „ständige voneinander Hören“ für eine Beziehung belastend sein.","https://www.liebesmeer.de/ratgeber/partnerschaft-beziehung/beziehung-kaputt/#:~:text=Sorgen%20und%20%C3%84ngste%20machen%20sich,f%C3%BCr%20eine%20Beziehung%20belastend%20sein.",Beziehung kaputt: 13+1 Signale & was du tun kannst - LiebesMeer
Wie verhält sich ein Mann Wenn er sich trennen will?,Wie verhält sich ein Mann der nicht mehr liebt?,"Er hört Ihnen nicht zu     Sie haben jeden seiner Termine im Kopf, aber kaum geht es um Ihre, haben Sie das Gefühl, diese ständig wiederholen zu müssen? Dann scheint sein Interesse in Ihr Leben wohl weniger groß zu sein. Dabei sollte es in einer funktionierenden Beziehung doch immer um die Belange beider Partner gehen. 16 Jun 2022","https://www.freundin.de/trennung-vorhersehen-zeichen-dass-er-sich-trennt#:~:text=Er%20h%C3%B6rt%20Ihnen%20nicht%20zu,die%20Belange%20beider%20Partner%20gehen.","5 Zeichen dafür, dass er sich vermutlich trennen wird | freundin.de"
Was wenn der Partner kein sexuelles Interesse mehr zeigt?,Wie verhält sich ein Mann der nicht mehr liebt?,"Gehen Sie zum Beispiel zusammen wandern oder machen Sie ein romantisches Picknick. Auch ein Urlaub sorgt für neue Impulse. Das kann die Leidenschaft im Bett wieder aufflammen lassen. Sollten Sie im Bett etwas Neues ausprobieren wollen, können z.B. auch aufregende Sex Rollenspiele oder Sex-Spielzeuge helfen. 27 Dec 2018","https://www.freundin.de/sex-was-tun-wenn-partner-keinen-sex-mehr-moechte#:~:text=Gehen%20Sie%20zum%20Beispiel%20zusammen,Rollenspiele%20oder%20Sex%2DSpielzeuge%20helfen.","Das sollten Sie tun, wenn Ihr Partner keinen Sex mehr möchte | freundin.de"
Wie verhält sich ein Mann vor der Trennung?,Wie verhält sich ein Mann der nicht mehr liebt?,"Er hört nicht mehr richtig zu. Bei Streits winkt er ab oder, schlimmer noch, äfft Aussagen nach. Auch alarmierend: Er macht sich vor Anderen über (vermeintliche) Schwächen seiner Partnerin lustig. Er schert sich nicht mehr sonderlich um sein Äußeres. 4 May 2015","https://www.brigitte.de/liebe/beziehung/liebeskrise--10-zeichen-dafuer--dass-die-trennung-kurz-bevorsteht-10195068.html#:~:text=Er%20h%C3%B6rt%20nicht%20mehr%20richtig,mehr%20sonderlich%20um%20sein%20%C3%84u%C3%9Feres.","Liebeskrise: 10 Zeichen dafür, dass die Trennung kurz bevorsteht - Brigitte"
Was löst sexuelles Verlangen aus?,Was wenn der Partner kein sexuelles Interesse mehr zeigt?,Aus den Eierstöcken und Nebennieren gelangen Sexualhormone wie Östrogen und Testosteron über das Blut ins Gehirn. Sie überschwemmen die primitiven Hirnareale nahe dem Hirnstamm und regen die Produktion von Botenstoffen an. Diese Neurotransmitter sind die eigentliche Essenz des Verlangens. 13 Jan 2014,"https://www.focus.de/gesundheit/ratgeber/sexualitaet/erforscht-die-lust-seite-3-die-biochemie-steuert-sexuelles-verlangen_id_3543966.html#:~:text=Aus%20den%20Eierst%C3%B6cken%20und%20Nebennieren,die%20eigentliche%20Essenz%20des%20Verlangens.",Die Biochemie steuert sexuelles Verlangen - FOCUS online
Was hemmt den Sexualtrieb bei Männern?,Was wenn der Partner kein sexuelles Interesse mehr zeigt?,"Unter einer Minderung der Libido versteht man die Abnahme des Sexualtriebs. Mögliche Ursachen sind u. a. psychische Faktoren (wie Depressionen, Angstzustände oder Beziehungsprobleme), Medikamente und ein niedriger Testosteronspiegel.","https://www.msdmanuals.com/de-de/heim/gesundheitsprobleme-von-m%C3%A4nnern/sexuelle-funktionsst%C3%B6rungen-bei-m%C3%A4nnern/verringerte-libido-bei-m%C3%A4nnern#:~:text=Unter%20einer%20Minderung%20der%20Libido,und%20ein%20niedriger%20Testosteronspiegel.",Verringerte Libido bei Männern - MSD Manuals
Woher kommt sexuelle Unlust bei Männern?,Was wenn der Partner kein sexuelles Interesse mehr zeigt?,"Oft verlieren wir das Interesse am Sex, wenn wir gestresst oder müde sind oder Beziehungsprobleme haben. Manchmal kann sexuelle Unlust aber auch gesundheitliche Ursachen haben, zum Beispiel Probleme mit der Schilddrüse. Die sexuelle Lust ist bei jedem Menschen anders, und es gibt keine „normale“ Libido. 26 May 2021","https://www.kry.de/magazin/sexuelle-unlust-gruende-fuer-libidoverlust/#:~:text=Oft%20verlieren%20wir%20das%20Interesse,gibt%20keine%20%E2%80%9Enormale%E2%80%9C%20Libido.",Keine Lust auf Sex? 8 mögliche Ursachen - Kry.de
Was sind die häufigsten Trennungsgründe?,Wann ist es richtig sich zu trennen?,"Einer Umfrage von Parship im Juni 2019 zufolge, gaben rund 29 Prozent der befragten Singles an, dass ein Grund für die Trennung war, dass mindestens einer von beiden in der Beziehung unglücklich war. Für rund ein Fünftel der Teilnehmer stellte das Fremdgehen einer der beiden den Trennungsgrund dar.","https://de.statista.com/statistik/daten/studie/1034490/umfrage/umfrage-zu-trennungsgruenden-in-deutschland-nach-geschlecht/#:~:text=Einer%20Umfrage%20von%20Parship%20im,der%20beiden%20den%20Trennungsgrund%20dar.",Gründe für eine Trennung in Deutschland nach Geschlecht 2019
In welchem Alter trennen sich die meisten Paare?,Wann ist es richtig sich zu trennen?,Dabei fand Rosenfeld heraus: Viele Partnerschaften schaffen es gar nicht erst bis zum gefürchteten siebten Beziehungsjahr. Der Studie zufolge war nämlich bereits das erste Beziehungsjahr das wahrscheinlichste für eine Trennung. Ganze 60 Prozent der beobachteten Paare trennten sich schon nach weniger als zwölf Monaten. 9 Dec 2022,"https://www.morgenpost.de/vermischtes/article236734661/wann-trennen-sich-paare-beziehung-am-ende-partnerschaft-ehe.html#:~:text=Dabei%20fand%20Rosenfeld%20heraus%3A%20Viele,nach%20weniger%20als%20zw%C3%B6lf%20Monaten.",In diesem Beziehungsjahr trennen sich die meisten Paare
Wann gehen die meisten Beziehungen zu Ende?,Wann ist es richtig sich zu trennen?,"Die Statistik bringt es eindeutig auf den Punkt: Die meisten Trennungen passieren im Frühjahr rund um Ostern und in der Vorweihnachtszeit, meist kurz vor Heiligabend. Wenn man sich die beiden Zeiträume ansieht, dann ist wahrscheinlich die vorweihnachtliche Zeit die Schlimmere, vor allem bei einem Partner. 12 Mar 2019","https://www.bunte.de/family/liebe/beziehung/trennung-das-ist-der-zeitpunkt-dem-die-meisten-beziehungen-die-brueche-gehen.html#:~:text=Die%20Statistik%20bringt%20es%20eindeutig,vor%20allem%20bei%20einem%20Partner.","Trennung: Das ist der Zeitpunkt, an dem die meisten Beziehungen in ..."
Wie flirtet ein Narzisst?,Wie verhält sich ein toxischer Mann?,"Narzisstische Persönlichkeiten sind raffinierte Eroberer. Wundern Sie sich also nicht, wenn Sie von einem Narzissten am Anfang einer Beziehung mit Aufmerksamkeit, Komplimenten und romantischen Gesten überschüttet und von ihm auf ein Podest gestellt werden. 8 Apr 2015","https://www.weekend.at/lifestyle/liebe/narzissmus-10-anzeichen-dafuer-dass-man-einen-narzissten-datet/11.679.225#:~:text=Narzisstische%20Pers%C3%B6nlichkeiten%20sind%20raffinierte%20Eroberer,auf%20ein%20Podest%20gestellt%20werden.","Narzissmus: 10 Anzeichen dafür, dass man einen Narzissten datet"
Ist mein Mann wirklich ein Narzisst?,Wie verhält sich ein toxischer Mann?,"Er neigt zur Selbstüberschätzung und handeln meist rücksichtslos und egoistisch. Einen Narzissten erkennen Sie häufig daran, dass er stark auf sich selbst fokussiert ist. Er hat ein besonders positives Selbstbild. - Gegen Kritik von außen sind Narzissten praktisch immun.","https://lemonswan.de/ratgeber/partnersuche/narzissten-erkennen#:~:text=Er%20neigt%20zur%20Selbst%C3%BCbersch%C3%A4tzung%20und,au%C3%9Fen%20sind%20Narzissten%20praktisch%20immun.","Narzissten erkennen: 20 Anzeichen, Eigenschaften und Vorteile"
Bin ich ihm so egal?,Wie verhält sich ein toxischer Mann?,"Er geht Gesprächen aus dem Weg    Wenn er Gesprächen, die dir extrem wichtig sind, immer wieder aus dem Weg geht oder sie aus fadenscheinigen Gründen auf einen späteren Zeitpunkt verschiebt, dann weißt du, dass es ihm egal ist, wie es dir geht. Wärst du ihm wichtig, würde er dir zuhören. 28 Sept 2017","https://www.elle.de/du-bist-ihm-egal#:~:text=Er%20geht%20Gespr%C3%A4chen%20aus%20dem%20Weg&text=Wenn%20er%20Gespr%C3%A4chen%2C%20die%20dir,wichtig%2C%20w%C3%BCrde%20er%20dir%20zuh%C3%B6ren.","6 Anzeichen dafür, dass du ihm egal bist - ELLE"
Wann sollte man sich nicht trennen?,Wann passt ein Paar nicht zusammen?,"Wenn er ständig Dinge tut, die dich kränken und verletzen. Wenn du dich mehr freust, Zeit ohne den Partner zu verbringen als mit ihm. Wenn ihr überhaupt nicht mehr zusammen lacht. Wenn ihr jenseits von Alltagskram keine gemeinsamen Gesprächsthemen findet. 10 Jun 2022","https://www.womenshealth.de/love/partnerschaft/trennen-ja-oder-nein/#:~:text=Wenn%20er%20st%C3%A4ndig%20Dinge%20tut,Alltagskram%20keine%20gemeinsamen%20Gespr%C3%A4chsthemen%20findet.",Soll ich mich trennen? Entscheidungshilfe! - Women's Health
Wie merke ich dass er mir nicht gut tut?,Wann passt ein Paar nicht zusammen?,"Dein Partner versucht ständig dich von Freunden und Familie fernzuhalten und redet oftmals schlecht über sie? Vorsicht, das ist ein besonders lautes Warnsignal, dass er dir nicht gut tut! Du solltest deine Liebsten niemals für einen Mann aufgeben. 22 Aug 2016","https://www.elle.de/beziehung-tut-dir-nicht-gut#:~:text=Dein%20Partner%20versucht%20st%C3%A4ndig%20dich,niemals%20f%C3%BCr%20einen%20Mann%20aufgeben.","7 Anzeichen, dass deine Beziehung dir nicht gut tut - ELLE"
Wer macht am häufigsten Schluss?,Wann passt ein Paar nicht zusammen?,"Wer macht öfter Schluss - Frauen oder Männer? Laut ElitePartner-Studie sind es eindeutig erstere: 44 Prozent der Frauen geben an, bei ihrer letzten Beziehung selbst aktiv Schluss gemacht zu haben. Unter den Männern sind es nur 28 Prozent. 27 Jul 2021","https://www.presseportal.de/pm/55165/4978884#:~:text=Wer%20macht%20%C3%B6fter%20Schluss%20%2D%20Frauen,sind%20es%20nur%2028%20Prozent.","Liebeskummer dauert im Schnitt 12,4 Monate - wer verlassen wird, leidet ..."
Wie merkt man gegenseitige Anziehung?,Können Seelen miteinander verbunden sein?,"Gegenseitige Anziehung: Ihr vergesst die Welt um euch herum    Wenn ihr euch private Details übereinander verratet, miteinander sprecht und alles um euch herum ausblendet, so hat er*sie mehr Interesse an dir. Wer sich zueinander hingezogen fühlt, möchte gerne mehr übereinander erfahren. 29 Dec 2022","https://www.wunderweib.de/7-anzeichen-dass-ihr-euch-gegenseitig-anziehend-findet-121165.html#:~:text=Gegenseitige%20Anziehung%3A%20Ihr%20vergesst%20die%20Welt%20um%20euch%20herum,-Wenn%20ihr%20zusammen&text=Wenn%20ihr%20euch%20private%20Details,m%C3%B6chte%20gerne%20mehr%20%C3%BCbereinander%20erfahren.","7 Anzeichen, dass ihr euch gegenseitig anziehend findet"
Was spüren Seelenpartner?,Können Seelen miteinander verbunden sein?,"Ein weiteres Indiz für einen Seelenpartner ist das unbestimmte Gefühl, dass mit dieser Beziehung alles besser wird. Sie spüren, dass Ihnen dieser Mensch und seine Nähe gut tun. Sie selbst verändern sich positiv und werden zu einem besseren Menschen.","https://karrierebibel.de/seelenpartner/#:~:text=Ein%20weiteres%20Indiz%20f%C3%BCr%20einen,werden%20zu%20einem%20besseren%20Menschen.",Seelenpartner erkennen + finden: 17 magische Anzeichen - Karrierebibel
Was spüren Seelenverwandte?,Können Seelen miteinander verbunden sein?,"Dazu gehören: Unmittelbares Gefühl tiefer Verbundenheit und Zusammengehörigkeit gleich bei der ersten Begegnung. Bedingungsloses Vertrauen zueinander. ""Gedanken lesen"", wortloses Verstehen und fast telepathisches Kommunizieren. 10 Feb 2020","https://www.liebenswert-magazin.de/seelenverwandtschaft-erkennen-anzeichen-fuer-seelenpartner-5730.html#:~:text=Dazu%20geh%C3%B6ren%3A,Verstehen%20und%20fast%20telepathisches%20Kommunizieren",Seelenverwandtschaft erkennen: Anzeichen für Seelenpartner
Was ist ein no go in einer Beziehung?,Was ist wirklich wichtig in einer Partnerschaft?,"Das „Ur-No Go“ einer jeden Beziehung schlechthin ist der Betrug. Fremdgeher fügen der Partnerschaft erheblichen Schaden zu. Selbst, wenn der betrogene Partner noch eine Chance einräumt, der Knick im Vertrauen bleibt. Für die meisten Paare mündet dieses No Go tatsächlich auch in der Trennung.","https://www.datingcafe.de/cafeteria/beratung/klares-no-go-das-beschaedigt-jede-beziehung/#:~:text=Das%20%E2%80%9EUr%2DNo%20Go%E2%80%9C,tats%C3%A4chlich%20auch%20in%20der%20Trennung.",Klares No Go: Das beschädigt jede Beziehung - Dating Cafe
Was sind die Säulen einer Beziehung?,Was ist wirklich wichtig in einer Partnerschaft?,"   Im Beitrag findest du die drei wichtigsten Säulen einer Beziehung: Verbundenheit, Kommunikation und Grenzen. Tiefe Verbundenheit beschreibt das Gefühl beider Partner, ein „gutes Team“ zu sein. Gute Kommunikation hilft Paaren insbesondere dabei, Konflikte konstruktiv auszutragen – ein echter Stabilitätsfaktor. 3 Jul 2021","https://chrisbloom.de/blog/das-wichtigste-in-einer-beziehung/#:~:text=Im%20Beitrag%20findest%20du%20die,konstruktiv%20auszutragen%20%E2%80%93%20ein%20echter%20Stabilit%C3%A4tsfaktor.",Was ist das Wichtigste in einer Beziehung? 3 Säulen - Chris Bloom
Was hält zwei Menschen zusammen?,Was ist wirklich wichtig in einer Partnerschaft?,"Vertrauen, Offenheit, Ehrlichkeit (44 Prozent) Liebe und Zuneigung (41 Prozent) konstruktive Konfliktlösung und Kommunikation (36 Prozent) gemeinsame Interessen, Hobbys und Freunde (29 Prozent)","https://www.ardalpha.de/wissen/psychologie/liebe/paare-glueck-harmonie-liebe-100.html#:~:text=Vertrauen%2C%20Offenheit%2C%20Ehrlichkeit%20(44,Hobbys%20und%20Freunde%20(29%20Prozent)",Paare und Stabilität: Wer passt zu wem? | Liebe | Psychologie | Wissen
Wann ist es besser sich zu trennen?,Wann ist die schwierigste Zeit in einer Beziehung?,"   Wer gar keine positiven Gefühle mehr für den Partner übrig hat, der sollte sich trennen. Denn ohne Liebe macht eine Beziehung keinen Sinn und ohne positive Gefühle füreinander ist es schwer, die Liebe wieder aufleben zu lassen.","https://www.trennung.de/trennungsgruende.html#:~:text=Wer%20gar%20keine%20positiven%20Gef%C3%BChle,Liebe%20wieder%20aufleben%20zu%20lassen.",TRENNUNGSGRÜNDE – Soll ich mich trennen? - TRENNUNG.de
Wann ist es zu spät Beziehung?,Wann ist die schwierigste Zeit in einer Beziehung?,"Wenn es keinen Teil mehr in uns gibt, der unseren Partner liebt, ihm nah sein möchte und zusammen mit ihm alt werden will, ist es zu spät für diese Liebe. Nach wenigen weiteren Jahren geht es für den Partner, der um Paartherapie gebeten hat, nicht mehr weiter.","https://www.eft-paartherapie-hannover.de/wann-ist-es-zu-spaet/#:~:text=Wenn%20es%20keinen%20Teil%20mehr,gebeten%20hat%2C%20nicht%20mehr%20weiter.",Wann ist es zu spät? - EFT Paartherapie Hannover
Wie fühlt sich tiefe Liebe an?,Wann ist die schwierigste Zeit in einer Beziehung?,"""Verliebtsein fühlt sich schnell, gefangen, stürmisch, aufregend an; das Gefühl der Liebe ist eher ruhig, klar, angenehm, warm, freundlich, frei"", differenziert die Berliner Paarberaterin Anna Holfeld. ""Es sind unterschiedliche Phasen. 22 Feb 2020","https://www.zeit.de/zett/liebe-sex/2020-02/das-ist-der-moment-in-dem-du-weisst-dass-du-jemanden-liebst#:~:text=%22Verliebtsein%20f%C3%BChlt%20sich%20schnell%2C%20gefangen,%22Es%20sind%20unterschiedliche%20Phasen.","Das ist der Moment, in dem du weißt, dass du jemanden liebst | ze.tt"
