Wie verbessert man die Kommunikation in einer Beziehung?;
Was ist Kommunikation in einer Beziehung?;
Was wenn Kommunikation nicht funktioniert in Beziehung?;
Was ist die schwierigste Phase in einer Beziehung?;
Wie kommuniziert man positiv?;
Was sollte man in der Kommunikation vermeiden?;
Wie funktioniert eine gute Kommunikation?;
Wann ist es besser sich zu trennen?;
Was Paare am Anfang falsch machen?;
Was sollte man seinem Partner nicht erzählen?;
Wie merke ich dass die Beziehung kaputt ist?;
Was macht die Liebe kaputt?;
Wann ist man kein Paar mehr?;
Was schweißt ein Paar zusammen?;
Wann ist die Liebe zu Ende?;
Wie kommuniziert man ohne zu reden?;
Wie Fehler kommunizieren?;
Wie kann man Kommunikation trainieren?;
Was sind typische Kommunikationsfehler?;
Wann ist eine Kommunikation gestört?;
Was sind die größten Fehler in der Kommunikation?;
Was sind die 3 Grundregeln der Kommunikation?;
Was sind die Grundregeln der Kommunikation?;
Was ist eine schlechte Kommunikation?;
Was sind die häufigsten Trennungsgründe?;
Wie verhält sich ein Mann vor der Trennung?;
Welche Beziehungen sind toxisch?;
Wie oft ist es normal miteinander zu schlafen?;
Was hält zwei Menschen zusammen?;
Warum enden viele Beziehungen nach 3 Monaten?;
Was stört Männer in einer Beziehung?;
Welche Geheimnisse darf es auch in einer Beziehung geben?;
Ist es ok Geheimnisse vor dem Partner zu haben?;
In welchem Monat gehen die meisten Beziehungen kaputt?;
Was ist Gift für eine Beziehung?;
Was ist ein Beziehungskiller?;
Was soll man in einer Beziehung auf keinen Fall tun?;
Wann wird eine Beziehung zur Belastung?;
Warum bleiben Paare zusammen wenn sie nicht glücklich sind?;
Wann sollte man sich trotz Liebe trennen?;
Was verbindet Paare am meisten?;
Was stärkt die Bindung in einer Beziehung?;
Was für Beziehungen halten am längsten?;
Warum liebt man plötzlich nicht mehr?;
Kann eine Pause eine Beziehung retten?;
Welche Signale drücken Ablehnung aus?;
Welche Körpersprache signalisiert eher Unsicherheit?;
Welche Körpersprache fördert die Kommunikation?;
Wie kommuniziert man effektiv?;
Was macht Kommunikation so schwierig?;
Wie kann ich positiv kommunizieren?;
Was sind Stärken in der Kommunikation?;
Wie kommt es zu Störungen in der Kommunikation?;
Was tun bei fehlender Kommunikation?;
Was stört eine gute Kommunikation?;
Welche Kommunikationsregeln gibt es?;
Welche 4 Elemente gehören zur Kommunikation?;
Was sind die 4 Ebenen der Kommunikation?;
Wann ist eine Kommunikation nicht gelungen?;
Welche drei Arten von Kommunikation gibt es?;
Was verbessert die Kommunikation?;
Wann geht Kommunikation schief?;
Wie merkt man dass eine Beziehung zu Ende ist?;
Wie verhält sich ein Mann der nicht mehr liebt?;
Was wenn der Partner kein sexuelles Interesse mehr zeigt?;
Wann ist es richtig sich zu trennen?;
Wie verhält sich ein toxischer Mann?;
Wie lange dauert der Geschlechtsakt im Durchschnitt?;
Wann passt ein Paar nicht zusammen?;
Können Seelen miteinander verbunden sein?;
Was ist wirklich wichtig in einer Partnerschaft?;
Wann ist die schwierigste Zeit in einer Beziehung?;
Welche Figur finden Männer attraktiv?;
Wann ist es keine Liebe mehr?;
Was gefällt Mann beim Küssen?;
Wo fängt Kontrolle in einer Beziehung an?;
Wie sollte sich eine gesunde Beziehung anfühlen?;
Wann tut Liebe weh?;
Wann trennt sich ein toxischer Partner?;
In welchem Alter halten Beziehungen am längsten?;
Wer beendet öfter die Beziehung?;
Wie enden die meisten Beziehungen?;
Bin ich toxisch oder er?;
Wie stärke ich eine Beziehung?;
Was sind typische Beziehungsprobleme?;
Was blockiert die Liebe?;
Wie merkt man das man in der Beziehung unglücklich ist?;
Wann sollte ich mich nicht trennen?;
Was die meisten Paare falsch machen?;
Wann sollte man eine Beziehung aufgeben?;
Wann macht eine Beziehung krank?;
Wie verhält sich ein Mann Wenn er sich trennen will?;
Was hält eine Beziehung zusammen?;
Sollte man sich trennen Wenn man unglücklich ist?;
Sollte man sich trennen wenn man sich liebt?;
Was sind die 4 Trennungsphasen?;
Wann hat die Beziehung keine Zukunft mehr?;
Was darf in einer Beziehung nicht fehlen?;
Welche drei Dinge machen eine gute Beziehung aus?;
Was glückliche Paare richtig machen?;
Wie zeigt sich eine gute Bindung?;
Welche Werte sind wichtig in einer Beziehung?;
Wann ist die schwerste Zeit einer Beziehung?;
In welcher Jahreszeit gehen die meisten Beziehungen kaputt?;
Wie merkt man dass man sich entliebt hat?;
Wann ist es endgültig vorbei?;
Wie schnell vergeht die Liebe?;
Ist Abstand gut für eine Beziehung?;
Warum kein Augenkontakt?;
Was passiert wenn man sich sehr lange in die Augen schaut?;
Was bedeutet es wenn jemand beim Sprechen die Augen schließt?;
Was stört die Kommunikation?;
Was sind Kommunikationsregeln?;
Was sind Fehler in der Kommunikation?;
Wie erkennt man Kommunikationsprobleme?;
Wie formuliere ich Sätze positiv?;
Was benötigen wir um miteinander zu kommunizieren?;
Was macht eine gelungene Kommunikation aus?;
Wie löst man Konflikte in einer Beziehung?;
Wie werde ich Kommunikationsstärke?;
Warum fällt mir Kommunikation schwer?;
Welche Faktoren haben Einfluss auf die Kommunikation?;
Was macht eine gute Unterhaltung aus?;
Was ist Kommunikationsstörung Beispiel?;
Wann misslingt die Kommunikation?;
Was stört bei einem Gespräch?;
Welche Folgen hat schlechte oder keine Kommunikation?;
Warum ist es wichtig zu kommunizieren?;
Wann gilt Kommunikation als gelungen?;
Was sind die 5 Instrumente einer erfolgreichen Gesprächsführung?;
Was sind die 4 Schritte der gewaltfreien Kommunikation?;
Welches ist das beste Kommunikationsmodell?;
Welche 2 Arten von Kommunikation gibt es?;
Wie funktioniert die Kommunikation?;
Was gibt es für Kommunikationsstrategien?;
Wie wende ich das 4-Ohren-Modell an?;
Was nimmt der Hörer mit dem Beziehungsohr wahr?;
Was sagt die Beziehungsebene aus?;
Was gehört alles zur Kommunikation?;
Wann beginnt eine Kommunikation?;
Wie klärt man Missverständnisse?;
Was ärgert toxische Menschen?;
Wie verhält sich ein Narzisst in einer Beziehung?;
Was Macht die Liebe kaputt?;
Was löst sexuelles Verlangen aus?;
Was hemmt den Sexualtrieb bei Männern?;
Woher kommt sexuelle Unlust bei Männern?;
In welchem Alter trennen sich die meisten Paare?;
Wann gehen die meisten Beziehungen zu Ende?;
Wie flirtet ein Narzisst?;
Ist mein Mann wirklich ein Narzisst?;
Bin ich ihm so egal?;
Wann sollte man sich nicht trennen?;
Wie merke ich dass er mir nicht gut tut?;
Wer macht am häufigsten Schluss?;
Wie merkt man gegenseitige Anziehung?;
Was spüren Seelenpartner?;
Was spüren Seelenverwandte?;
Was ist ein no go in einer Beziehung?;
Was sind die Säulen einer Beziehung?;
Wann ist es zu spät Beziehung?;
Wie fühlt sich tiefe Liebe an?;
Was ist die schwierigste Zeit in einer Beziehung?;
Wie Männer Beziehungen zerstören?;
Welche Haare finden Männer am schönsten?;
Welche Haarfarbe kommt bei Männern am besten an?;
Welche Augenfarbe finden Männer am schönsten?;
Wann hat ein Mann abgeschlossen?;
Wie merke ich dass er in eine andere verliebt ist?;
Ist Küssen sexueller Kontakt?;
Wie küsst ein Mann der Gefühle hat?;
Wo fasst man einen Mann an beim Küssen?;
Wann ist eine Beziehung nicht gesund?;
Was ist das Wichtigste was man in einer Beziehung beachten sollte?;
Wann sollte man die Liebe aufgeben?;
Wann fängt wahre Liebe an?;
Soll ich mich trennen obwohl ich ihn Liebe?;
Wer ist anfällig für toxische Beziehung?;
Warum wird man toxisch?;
Was ist Gaslighting in einer Beziehung?;
Warum gehen die meisten Beziehungen nach 3 Monaten kaputt?;
Wie viele Partner hat man im Leben?;
Wer macht eher Schluss Mann oder Frau?;
Ist Sexverweigerung ein Scheidungsgrund?;
Wie erkenne ich ob ich mich trennen sollte?;
Was rettet eine Beziehung?;
Wann weiß ich dass die Beziehung keinen Sinn mehr Macht?;
Wie entsteht Respektlosigkeit in der Beziehung?;
Welche drei Dinge sind dir in einer Beziehung am wichtigsten?;
Was sind die häufigsten Beziehungskiller?;
Ist es Liebe wenn man zweifelt?;
Kann Liebe auf einmal weg sein?;
Wie äußert sich emotionale Überforderung?;
Wann ist eine Beziehung krank?;
Wie erkenne ich eine ungesunde Beziehung?;
Wie finde ich heraus ob ich ihn noch Liebe?;
Was sollte in einer Beziehung nicht geben?;
Was kann man zu zweit im Bett machen?;
Wie oft sollte sich ein Paar sehen?;
Wie merkt man dass man unglücklich in einer Beziehung ist?;
Wie beendet ein Mann eine Beziehung?;
Wie verhält sich eine depressive Frau?;
Wann macht eine Beziehung depressiv?;
Wie merke ich dass er mich loswerden will?;
Bin ich ihm egal?;
Wie erkennt man die wahre Liebe?;
Was sollten Beziehungen immer haben?;
Wie verhält sich ein Mann Wenn er liebt?;
Was ist der beste Weg sich zu trennen?;
Wann eine Beziehung keinen Sinn mehr macht?;
Wann es besser ist eine Beziehung zu beenden?;
Was sollte man nach der Trennung nicht tun?;
Was ist der erste Schritt bei einer Trennung?;
Wann gehen Gefühle nach Trennung weg?;
Wann sollte man um eine Beziehung kämpfen?;
Wann zerbricht eine Beziehung?;
Was machen Paare zusammen abends?;
Kann man sich verlieben obwohl man in einer glücklichen Beziehung ist?;
Wie fängt eine gute Beziehung an?;
Wie äußert sich eine unsichere Bindung?;
Wie erkennt man eine unsichere Bindung?;
Wie erkennt man eine bindungsstörung?;
Was ist die Basis für eine Beziehung?;
Was ist für eine Frau wichtig in einer Beziehung?;
Wie viel Zweifel in einer Beziehung sind normal?;
In welchem Monat trennen sich die meisten Paare?;
Wie lange hält Verliebtheit bei Männern an?;
Kann die Liebe plötzlich weg sein?;
Woher weiß ich ob wir zusammen passen?;
Wie lang hält eine durchschnittliche Beziehung?;
Welche Beziehungen halten länger?;
Warum enden so viele Beziehungen nach 3 Monaten?;
Wie merkt man das man sich trennen sollte?;
Wie viele Paare trennen sich und kommen wieder zusammen?;
In welchem Jahr gehen die meisten Beziehungen kaputt?;
Wie Entliebt sich ein Mann?;
Wann ist es zu spät um eine Beziehung zu retten?;
Was bedeutet es wenn jemand keinen Augenkontakt halten kann?;
Warum schaut er mir immer so tief in die Augen?;
Wie kann man ohne Worte kommunizieren?;
Wie sieht man Liebe in den Augen?;
Wie sehen verliebte Augen aus?;
Kann man Gefühle in den Augen sehen?;
Was bedeutet es wenn man beim Reden nach oben schaut?;
Warum fällt es mir schwer Augenkontakt zu halten?;
Was bedeutet es wenn jemand die Augenbrauen hoch zieht?;
Was ist das Wichtigste bei Kommunikation?;
Wie zeigt sich gute Kommunikationsfähigkeit?;
Wie wollen wir miteinander kommunizieren?;
Was bedeutet es wenn sich jemand am Ohr zupft?;
Wohin schauen beim Reden?;
Was bedeutet Hand vor dem Mund?;
Was bedeutet negative Kommunikation?;
Wie verbessere ich die Kommunikation mit meinem Partner?;
Was tun wenn der Partner nicht redet?;
Wie kann ich besser mit meinem Partner reden?;
Was ist die Grundlage der Kommunikation?;
Was kann man statt kein Problem sagen?;
Wie bilde ich schöne Sätze?;
Was kann man sagen anstatt kein Problem?;
Was macht ein gutes Miteinander aus?;
Was beeinflusst die Kommunikation positiv?;
Was zeichnet einen Menschen aus der mit anderen Menschen gut kommuniziert?;
Wann kommuniziert man?;
Was sollte man in einer Beziehung vermeiden?;
Was tun bei Unzufriedenheit in der Beziehung?;
Wie zeigt sich Belastbarkeit?;
Bin ich kommunikationsfähig?;
Was soll man sagen wenn man nicht weiß was man sagen soll?;
Warum rede ich nicht gerne über meine Gefühle?;
Welche drei Elemente müssen unbedingt vorhanden sein wenn man von Kommunikation spricht?;
Was sind typische Ursachen für Kommunikationsstörungen?;
Wie fängt man ein klärendes Gespräch an?;
Wie entstehen tiefe Gespräche?;
Wie beginne ich ein ernstes Gespräch mit meinem Partner?;
Wie man richtig kommuniziert?;
Warum geht Kommunikation manchmal schief?;
Wie gelingt eine verständnisvolle Kommunikation?;
Wie sieht ein gutes Gespräch aus?;
Wie überzeuge ich im Gespräch?;
Wieso fällt es mir schwer Gespräche zu führen?;
Was tun wenn Kommunikation nicht funktioniert?;
Wie wichtig ist Kommunikation in einer Beziehung?;
Was ist eine gelungene Kommunikation?;
Wann ist es Zeit sich zu trennen Test?;
Was versteht man unter einer gestörten Kommunikation?;
Was sind die wichtigsten Regeln beim Smalltalk?;
Wie kommuniziere ich wertschätzend?;
Was ist die Wolfssprache?;
Ist Kommunikation Psychologie?;
Was sind Kommunikationsziele Beispiele?;
Was macht eine gute Kommunikationsstrategie aus?;
Was passiert wenn man nur mit dem Beziehungsohr hört?;
Wie funktioniert das 4-Ohren-Modell?;
Was bedeutet Sach Ohr?;
Welche drei Arten der Kommunikation gibt es?;
Welche Aspekte der Kommunikation sind wichtig?;
Was drückt sich in der Kommunikation auf der Beziehungsebene aus?;
Wie kann man kommunizieren Beispiele?;
Was ist das Ziel der Kommunikation?;
Was erschwert eine gute Kommunikation?;
Wie erkläre ich Kommunikation?;
Wann wird Kommunikation schwierig?;
Wie zeigt sich Kommunikation?;
Wie vermeide ich Missverständnisse in Gesprächen?;
Wie löse ich Probleme in der Beziehung?;
Wie kann man die Kommunikation verbessern?;
Welche Folgen können Missverständnisse haben?;
Was ist das Ziel von toxischen Menschen?;
Wie reagiert ein toxischer Partner auf Trennung?;
Welche Sätze sagen Narzissten?;
Wie Verhalten sich Narzissten im Bett?;
Wie teste ich einen Narzissten?;
Was ist ein Narzisst in der Beziehung?;
Wann soll man aufhören zu kämpfen?;
Wie äußert sich die Midlife Crisis bei Männern?;
Welches Mittel macht Frauen scharf?;
Wie kann ich mein sexuelles Verlangen steigern?;
Was bewirkt Enthaltsamkeit beim Mann?;
Wann lässt der Sexualtrieb bei Männern nach?;
Was regt den Sexualtrieb an?;
Wer beendet häufiger eine Beziehung?;
Für wen ist die Trennung schlimmer?;
Was lässt Beziehungen scheitern?;
Wann hilft Abstand in einer Beziehung?;
Was bringt eine Pause in der Beziehung?;
Wie zeigen Narzissten ihre Liebe?;
Wann sagt ein Narzisst die Wahrheit?;
Wie behandelt ein Narzisst seine Partnerin?;
Welche Sätze verwenden Narzissten?;
Wie redet ein Narzisst?;
Wann beginnt ein Mann eine Frau zu vermissen?;
Wie finde ich heraus ob ich ihm wichtig bin?;
Wann weiß ich dass die Beziehung keinen Sinn mehr macht?;
Wie erkenne ich dass es der falsche ist?;
Warum enden die meisten Beziehungen nach 3 Monaten?;
Was sind Gründe sich zu trennen?;
Kann man den Seelenpartner spüren?;
Kann man die Liebe spüren?;
Wie merke ich versteckte Gefühle?;
Warum tut die Seelenliebe so weh?;
In welchem Alter treffen sich Dualseelen?;
Wie erkennt man sein Seelenpartner?;
Woher erkenne ich meinen Seelenpartner?;
Was ist das Minimum in einer Beziehung?;
Was zählt wirklich in einer Beziehung?;
In welchem Alter trennen sich die meisten?;
Wie erkennt man dass man geliebt wird?;
Wie kann man indirekt Ich Liebe dich sagen?;
Wann sollte man sich in einer Beziehung trennen?;
Was ist das Schlimmste was man in einer Beziehung machen kann?;
Welche Figur gefällt Männern am besten?;
Welche Frisuren finden Männer unattraktiv?;
Welche Haarfarbe ist am besten im Bett?;
Welche Augenfarbe lügt?;
Was ist die schönste Haarfarbe der Welt?;
Wie merke ich dass er zweigleisig fährt?;
Wie lange hält Fremdverliebtheit an?;
Was bedeutet Zungenkuss für Mann?;
Wo darf man sich nicht Küssen?;
Was bedeutet Küssen ohne Zunge?;
Was bedeutet es wenn man beim Küssen die Augen offen hat?;
Was sind intime Küsse?;
Was ist für Männer das Wichtigste in einer Beziehung?;
Was zerstört die Beziehung?;
Was sind die drei wichtigsten Dinge in einer Beziehung?;
Wann sollte man nicht mehr um eine Beziehung kämpfen?;
Wann ist es wert um eine Beziehung zu kämpfen?;
Wann macht es keinen Sinn mehr zu kämpfen?;
Wann ist es zu spät für die Liebe?;
Wann ist es tiefe Liebe?;
Wie Verhalten sich Frauen mit wenig Selbstwertgefühl?;
Wie bestraft ein Narzisst seinen Partner?;
Welche Frauen gefallen Narzissten?;
Wie ticken toxische Menschen?;
Wie erkennt man dass man manipuliert wird?;
Wie erkenne ich ob mein Partner mich manipuliert?;
Wie verhält sich ein Narzisst in der Partnerschaft?;
In welchem Alter trennen sich Paare am meisten?;
Wie lange hält die durchschnittliche Beziehung?;
Wie lange ist es normal Single zu sein?;
Wie oft sehen sich Paare die nicht zusammen wohnen?;
Was sind gute trennungsgründe?;
Was ist der meiste Trennungsgrund?;
Wann beendet ein Mann eine Beziehung?;
Ist eine Frau verpflichtet mit ihrem Mann zu schlafen?;
Wie merke ich ob es die grosse Liebe ist?;
Wann ist die Beziehung nicht mehr zu retten?;
Was macht ein glückliches Paar aus?;
Was sind die häufigsten Probleme in einer Beziehung?;
Wann lohnt es sich zu kämpfen?;
Wie zeigt sich mangelnder Respekt?;
Warum behandelt er mich so respektlos?;
Wie zeige ich meinem Partner Grenzen auf?;