Wo schläft eine Katze am liebsten?;Was denkt meine Katze Wenn ich sie küsse?;"Manche Katzen lieben erhöhte Schlafplätze; andere verkriechen sich lieber in einer Höhle am Boden. Manche Katzen mögen es warm und kuschelig; wie in einem Bett oder dem Sofa; andere bevorzugen kühlende Fliesen.";"https://portapet.de/meine-katze-und-ich/der-richtige-schlafplatz-fuer-deine-katze/#:~:text=Manche%20Katzen%20lieben%20erh%C3%B6hte%20Schlafpl%C3%A4tze;Sofa%2C%20andere%20bevorzugen%20k%C3%BChlende%20Fliesen.";Der richtige Schlafplatz für Deine Katze - PortaPet
Was mögen Katzen beim Kuscheln?;Kann eine Katze Fernsehen?;"   Viele Katzen lieben es; mit ihren Menschen zu kuscheln und zu schmusen. Sie drücken sich fest an den Menschen; fordern Streicheleinheiten und manche legen sich sogar gerne auf Bauch oder Brust ihres Menschen; schnurren und schlafen dort ein. Manche Katzen fordern sogar von völlig fremden Menschen Streicheleinheiten. 16 Sept 2022";"https://herz-fuer-tiere.de/haustiere/katzen/verhalten-von-katzen/deshalb-kuscheln-manche-katzen-gerne-und-andere-gar-nicht#:~:text=Viele%20Katzen%20lieben%20es%2C%20mit;von%20v%C3%B6llig%20fremden%20Menschen%20Streicheleinheiten.";Deshalb kuscheln manche Katzen gerne und andere gar nicht
Was passiert wenn man mit der Katze nicht spielt?;Kann eine Katze Fernsehen?;"Spielen ist für eine Katze genauso wichtig wie fressen und schlafen: es hält sie gesund und munter. Spielen bekämpft Langeweile; stimuliert den natürlichen Jagdtrieb und hält die Muskulatur und Gelenke gesund. Es hilft auch gegen Stress; Depressionen und verringert Problemverhalten; wie Möbelkratzen oder Beißen. 1 Mar 2019";"https://www.pawshake.de/blog/warum-will-meine-katze-nicht-spielen#:~:text=Spielen%20ist%20f%C3%BCr%20eine%20Katze;Problemverhalten%2C%20wie%20M%C3%B6belkratzen%20oder%20Bei%C3%9Fen.";Warum will meine Katze nicht spielen? | Pawshake Blog
Kann eine Katze ihren Besitzer erkennen?;Kann eine Katze Fernsehen?;"Katzen können erkennen; ob ihre Halter mit ihnen oder mit einem Menschen sprechen. Das zumindest ist das Ergebnis einer kleinen französischen Studie; die im Fachblatt ""Animal Cognition"" veröffentlicht wurde. 25 Oct 2022";"https://www.geo.de/natur/tierwelt/katzen-erkennen--wenn-besitzer-mit-ihnen-sprechen-32847232.html#:~:text=Katzen%20k%C3%B6nnen%20erkennen%2C%20ob%20ihre;%22Animal%20Cognition%22%20ver%C3%B6ffentlicht%20wurde.";"Katzen erkennen; wenn Besitzer mit ihnen sprechen - GEO"
Kann eine Katze frieren?;Kann sich eine Katze im Spiegel sehen?;"   Trotz Pelzmantel – auch Katzen können frieren. Wie viel Kälte eine Katze aushält; hängt auch von Verfassung; Alter; Gesundheit und Gewicht ab. Freigänger mit dichtem Winterfell trotzen Eis und Schnee eher; als Stubentiger mit gelegentlicher Frischluftzufuhr.";"https://www.green-petfood.de/articles/katze-winter#:~:text=Trotz%20Pelzmantel%20%E2%80%93%20auch%20Katzen%20k%C3%B6nnen;als%20Stubentiger%20mit%20gelegentlicher%20Frischluftzufuhr.";Katze im Winter: Heiße Tipps für kalte Tage - Green Petfood
Können Katzen uns verstehen?;Kann sich eine Katze im Spiegel sehen?;"Hauskatzen (Felis silvestris catus) können tatsächlich ihren Namen aus anderen Wörtern heraushören. Das schreiben Atsuko Saito von der Sophia-Universität in Tokio und sein Team im Fachmagazin Scientific Reports. Es sei der erste experimentelle Nachweis; dass Katzen verbale Lautäußerungen von Menschen verstehen können. 4 Apr 2019";"https://kurier.at/wissen/was-katzen-von-der-menschensprache-verstehen/400456363#:~:text=Hauskatzen%20(Felis%20silvestris%20catus)%20k%C3%B6nnen;Laut%C3%A4u%C3%9Ferungen%20von%20Menschen%20verstehen%20k%C3%B6nnen.";Was Katzen von der Menschensprache verstehen - Kurier
Wie viele Bezugspersonen hat eine Katze?;Kann sich eine Katze im Spiegel sehen?;"   Das Ergebnis: 64;3 Prozent der Katzen zeigten Anzeichen einer gefestigten und sicheren Bindung zu ihrem Besitzer. 3 Oct 2019";"https://www.welt.de/kmpkt/article201226694/Katzen-bauen-enge-Bindung-zu-ihren-Besitzern-auf.html#:~:text=Das%20Ergebnis%3A%2064%2C3%20Prozent;sicheren%20Bindung%20zu%20ihrem%20Besitzer.";Katzen bauen enge Bindung zu ihren Besitzern auf - Die Welt
Wie sagt man auf Katzensprache Hallo?;Wie kann ich meiner Katze zeigen dass ich sie lieb habe?;"Ein hochaufgerichteter Schwanz bedeutet: Hallo! Die Begrüßung wird durch einen hocherhobenen Kopf noch unterstrichen. Leichtes Wedeln mit dem Schwanz; Schnurrhaare nach vorne und breit gefächert; Ohren spitzen und nach vorne drehen heißt: Aufmerksam!";"https://www.planet-wissen.de/natur/haustiere/katzen/pwiediesprachederkatzen100.html#:~:text=Ein%20hochaufgerichteter%20Schwanz%20bedeutet%3A%20Hallo;nach%20vorne%20drehen%20hei%C3%9Ft%3A%20Aufmerksam!";Die Sprache der Katzen - Katzen - Haustiere - Natur - Planet Wissen
Wie sagen Katzen danke?;Wie kann ich meiner Katze zeigen dass ich sie lieb habe?;"3. Gurren. Es ist ein kurzer; weicher Laut; der sich fast wie ein stimmhaftes Zungenspitzen-R anhört; also ""mrrrh"" oder ""brrrh"". Es ist die freundliche Art der Katze; einmal Danke zu sagen.";"https://www.bildderfrau.de/familie-leben/haustiere/article206411083/Katzensprache-verstehen.html#:~:text=3.;Katze%2C%20einmal%20Danke%20zu%20sagen.";Katzensprache verstehen: Die Bedeutung von Lauten und Verhalten
Was bedeutet es wenn die Katze bei einem im Bett schläft?;Wie kann ich meiner Katze zeigen dass ich sie lieb habe?;"   Was dafür spricht: Nicht nur die Katze findet diese gemeinsamen Stunden kuschelig und entspannend; sondern auch der Mensch. Die Körperwärme und das Schnurren lassen uns zur Ruhe kommen; helfen uns; das Gedankenkarussell abzustellen und so leichter in den Schlaf zu finden.";"https://www.aquatop-aachen.de/katzen-schlafen-im-bett#:~:text=Was%20daf%C3%BCr%20spricht%3A%20Nicht%20nur;in%20den%20Schlaf%20zu%20finden.";Katzen schlafen im Bett - Aquatop Aachen
Warum duckt sich meine Katze Wenn ich sie Streicheln will?;Warum beißen Katzen nach dem Streicheln?;"   Meine Katze duckt sich immer beim Streicheln    Das Ducken gilt als Warnung und soll eine Grenzüberschreitung signalisieren. Falls du nicht darauf reagierst; könnte die Katze ihre Abwehrtechniken intensivieren; sie könnte also fauchen; beißen oder mit ausgefahrenen Krallen nach dir hauen.";"https://www.tierheim.de/katze-streicheln/#:~:text=Meine%20Katze%20duckt%20sich%20immer%20beim%20Streicheln&text=Das%20Ducken%20gilt%20als%20Warnung;ausgefahrenen%20Krallen%20nach%20dir%20hauen.";"Die Katze streicheln; ohne dass sie sich unwohl fühlt - Tierheim.de"
Wo sollte man Katzen nicht Streicheln?;Warum beißen Katzen nach dem Streicheln?;"   Genauso haben viele Katzen aber auch Tabuzonen; an denen sie nicht angefasst werden möchten. Dazu gehören die Beine; die Pfoten und insbesondere der Bauch. Verletzungen an diesen Zonen waren für die Vorfahren der Hauskatze früher oft lebensbedrohlich. 1 Mar 2019";"https://www.ivh-online.de/de/presse-medien/archiv/mitteilung-des-ivh-pressedienstes/news/detail/News/was-katzen-wirklich-wollen-richtig-streicheln-will-gelernt-sein.html#:~:text=Genauso%20haben%20viele%20Katzen%20aber;der%20Hauskatze%20fr%C3%BCher%20oft%20lebensbedrohlich.";Was Katzen wirklich wollen: Richtig Streicheln will gelernt sein
Sollte man immer das gleiche Katzenfutter füttern?;Warum beißen Katzen nach dem Streicheln?;"Katzenfutter muss abwechslungsreich sein     Du musst Dir keine Gedanken machen; wenn Deine Katze nicht täglich ein anderes Menü serviert bekommt. Auch in der Natur frisst eine Katze schließlich; was ihr so zwischen die Krallen kommt. 24 Mar 2020";"https://www.ausliebezumhaustier.de/katzen-ernaehrung/futter-fakten-was-stimmt-was-nicht#:~:text=Katzenfutter%20muss%20abwechslungsreich%20sein&text=Du%20musst%20Dir%20keine%20Gedanken;so%20zwischen%20die%20Krallen%20kommt.";10 Futter-Fakten: Was stimmt? Was nicht? - Aus Liebe zum Haustier
Kann eine Katze beleidigt sein?;Wie schnell vergessen Katzen ihre Besitzer?;"Auch Katzen können schmollen und beleidigt sein; wenn ihnen etwas nicht passt und sie sich unwohl fühlen. Die Gründe sowie die Art; wie sich das Schmollen äußert; sind aber sehr unterschiedlich. 24 Aug 2015";"https://herz-fuer-tiere.de/haustiere/katzen/verhalten-von-katzen/warum-katzen-schmollen#:~:text=Auch%20Katzen%20k%C3%B6nnen%20schmollen%20und;%C3%A4u%C3%9Fert%2C%20sind%20aber%20sehr%20unterschiedlich.";Warum Katzen schmollen | herz-fuer-tiere.de
Kann eine Katze weinen?;Wie schnell vergessen Katzen ihre Besitzer?;"   Ebenso wie Menschen können Katzen durchaus weinen und auch Emotionen empfinden. Allerdings besteht zwischen der Träne und dem Gefühl kein Zusammenhang; denn Katzen drücken ihre Emotionen anders aus. 23 Feb 2022";"https://www.agila.de/agila-magazin/3113-koennen-katzen-weinen#:~:text=Ebenso%20wie%20Menschen%20k%C3%B6nnen%20Katzen;dr%C3%BCcken%20ihre%20Emotionen%20anders%20aus.";Können Katzen weinen? - AGILA
Warum folgt mir meine Katze auf Schritt und Tritt?;Wie schnell vergessen Katzen ihre Besitzer?;"Katzen; die ihrem Menschen überall hin folgen; betteln häufig um dessen Aufmerksamkeit. Sie laufen vor die Beine; streichen um ihren Menschen herum und bezirzen ihn durch Gurren und leises Miauen. Häufig zeigt die Katze dieses Verhalten auch; um zu signalisieren; dass sie Hunger hat. 7 Sept 2020";"https://herz-fuer-tiere.de/haustiere/katzen/verhalten-von-katzen/warum-laeuft-mir-die-katze-staendig-hinterher#:~:text=Katzen%2C%20die%20ihrem%20Menschen%20%C3%BCberall;signalisieren%2C%20dass%20sie%20Hunger%20hat.";Warum läuft mir die Katze ständig hinterher? | herz-fuer-tiere.de
Können Katzen Liebe spüren?;Wie zeigt eine Katze das sie traurig ist?;"   Katzen können verschmust und verspielt sein. Vor allem aber gelten sie als unabhängig und eigenständig – ganz im Gegensatz zu Hunden! Eine neue Studie zeigt nun; dass Katzen viel beziehungsfähiger sind als bisher angenommen. Sie binden sich ähnlich an ihre Besitzer wie Kleinkinder an ihre Eltern. 27 Sept 2019";"https://www.mdr.de/wissen/katzen-katzenpsychologie-katzenbesitzer-100.html#:~:text=Katzen%20k%C3%B6nnen%20verschmust%20und%20verspielt;wie%20Kleinkinder%20an%20ihre%20Eltern.";Katzen: Auch sie lieben ihre Besitzer | MDR.DE
Wie schläft eine kranke Katze?;Wie zeigt eine Katze das sie traurig ist?;"   Kranke Katzen dösen auch häufig in der Sphinx-Stellung auf dem Bauch. Die Vorderpfoten sind dabei nach vorne gestreckt oder auch vor oder unter dem Bauch eingeschlagen; das Köpfchen nicht abgelegt; die Rückenhaare oftmals aufgeplustert. 2 Mar 2021";"https://www.tierwelt.ch/artikel/katzen/was-die-schlafposition-uber-ihre-katze-verrat-405029#:~:text=Kranke%20Katzen%20d%C3%B6sen%20auch%20h%C3%A4ufig;abgelegt%2C%20die%20R%C3%BCckenhaare%20oftmals%20aufgeplustert.";Was die Schlafposition über ihre Katze verrät - tierwelt.ch
Wie schlafen Katzen wenn sie Schmerzen haben?;Wie zeigt eine Katze das sie traurig ist?;"   Viele Katzen verstecken sich daher; wenn sie Schmerzen haben und verbringen den gesamten Tag zurückgezogen unter Betten; Sofas oder in Schränken. 15 Sept 2022";"https://www.royalcanin.com/de/cats/health-and-wellbeing/woran-erkenne-ich-dass-meine-katze-schmerzen-hat#:~:text=Viele%20Katzen%20verstecken%20sich%20daher;Betten%2C%20Sofas%20oder%20in%20Schr%C3%A4nken.";"Woran erkenne ich; dass meine Katze Schmerzen hat? - Royal Canin"
Was mögen Katzen an Menschen nicht?;Können Katzen gute Menschen erkennen?;"Zu viel Körperkontakt mögen Katzen nicht    Was Katzen überhaupt nicht mögen; ist zu viel Körperkontakt. Zwangskuscheln oder die Katze unter Protest hochzunehmen; ist ein Tabu. Damit schaden sie der Beziehung zu Ihrem Haustier enorm. Sie schränken die Katze so nämlich stark in ihrer Bewegungsfreiheit ein. 25 Apr 2022";"https://herz-fuer-tiere.de/haustiere/katzen/verhalten-von-katzen/3-dinge-die-katzen-an-menschen-nicht-moegen#:~:text=Zu%20viel%20K%C3%B6rperkontakt%20m%C3%B6gen%20Katzen;stark%20in%20ihrer%20Bewegungsfreiheit%20ein.";"3 Dinge; die Katzen an Menschen nicht mögen | herz-fuer-tiere.de"
Welche Art von Menschen mögen Katzen?;Können Katzen gute Menschen erkennen?;"   Wenn Sie die körperlichen Signale Ihrer Katze verstehen und respektieren; wird sie sich bei Ihnen wohler fühlen. Katzen mögen Menschen; die ihren Raum respektieren.";"https://www.perfect-fit.de/katzenhaltung/ich-und-mein-haustier/katze-bezugsperson#:~:text=Wenn%20Sie%20die%20k%C3%B6rperlichen%20Signale;Menschen%2C%20die%20ihren%20Raum%20respektieren.";Hat eine Katze eine liebste Bezugsperson? - Perfect Fit
Kann eine Katze ihren Besitzer vergessen?;Können Katzen gute Menschen erkennen?;"   Es kann durchaus sein; dass deine Katze dich vermisst; wenn du nicht zuhause bist. Besonders; wenn ihr beide eine sehr enge Bindung hat oder du längere Zeit außer Haus bist. Natürlich ist die Beziehung zwischen Mensch und Katze immer sehr individuell. Manche Tiere vermissen ihre Besitzer deutlich mehr als andere. 1 Jul 2022";"https://catinaflat.de/blog/vermisst-mich-meine-katze-wenn-ich-nicht-zuhause-bin#:~:text=Es%20kann%20durchaus%20sein%2C%20dass;Besitzer%20deutlich%20mehr%20als%20andere.";"Vermisst mich meine Katze; wenn ich nicht Zuhause bin? - Cat in a Flat"
Kann eine Katze lachen?;Kann eine Katze frieren?;"   Können Katzen lachen? Das täuscht. Wenn eine Katze ihr Schnäuzchen zu einem Lächeln verzieht; kann es sein; dass sie krank ist und Fieber hat. Ihr ist heiß und darum atmet sie stärker durch den Mund.";"https://www.servus.com/a/t/7-fakten-die-sie-noch-nicht-ueber-katzen-kennen#:~:text=K%C3%B6nnen%20Katzen%20lachen%3F;-Foto%3A%20iStock&text=Das%20t%C3%A4uscht.;sie%20st%C3%A4rker%20durch%20den%20Mund.";"7 Fakten; die Sie noch nicht über Katzen kennen - Servus"
Wie spricht man mit Katzen?;Kann eine Katze frieren?;"Katzen sprechen drei ""Sprachen"": Sie geben Laute von sich; zeigen Gesten und versprühen Düfte. Ein freundliches bis unverschämtes ""Miau!"" heißt so viel wie ""Ich will was!""; Knurren und Jaulen sind Kampfgeschrei. Zufriedenheit äußern Katzen eher sanft und leise: Schnurren ist ihre Form der Liebeserklärung.";"https://www.geo.de/geolino/natur-und-umwelt/1656-rtkl-tiersprache-katzensprache-fuer-anfaenger#:~:text=Katzen%20sprechen%20drei%20%22Sprachen%22%3A;ist%20ihre%20Form%20der%20Liebeserkl%C3%A4rung.";Tiersprache: Katzensprache für Anfänger - [GEOLINO]
Warum mögen es Katzen nicht am Bauch gestreichelt zu werden?;Kann eine Katze frieren?;"   Die Haarfollikel am Bauch und im Schwanzbereich sind besonders berührungsempfindlich; weshalb es für Katzen unangenehm sein kann; dort gestreichelt zu werden; erklärt Provoost. „Katzen ziehen es vor; am Kopf gekrault zu werden; besonders am Kinn und an den Wangen“; wo sich auch ihre Duftdrüsen befinden. 12 Jun 2019";"https://www.nationalgeographic.de/tiere/2019/06/warum-wollen-katzen-nicht-am-bauch-gestreichelt-werden#:~:text=Die%20Haarfollikel%20am%20Bauch%20und;sich%20auch%20ihre%20Duftdr%C3%BCsen%20befinden.";Warum wollen Katzen nicht am Bauch gestreichelt werden?
Was ist die schlimmste Krankheit bei Katzen?;Wie verhält sich eine Katze die krank ist?;"Die chronische Niereninsuffizienz     Vor allem ältere Katzen sind von der Niereninsuffizienz; kurz CNI; betroffen. Hierbei handelt es sich um eine sehr gefährliche Krankheit für die Tiere; welche leider in den meisten Fällen nach und nach zum Tod der Katzen führt.";"https://www.zoobio.de/blog/die-10-haufigsten-krankheiten-bei-katzen-mit-ihren-symptomen-1047#:~:text=von%20W%C3%BCrmern%20m%C3%B6glich.-;Die%20chronische%20Niereninsuffizienz;zum%20Tod%20der%20Katzen%20f%C3%BChrt.";Die 10 häufigsten Krankheiten bei Katzen mit ihren Symptomen
Was ist die häufigste Krankheit bei Katzen?;Wie verhält sich eine Katze die krank ist?;"Definition: Katzenschnupfen ist eine der häufigsten Katzenkrankheiten. Es handelt sich um eine Infektionskrankheit; die Entzündungen hauptsächlich im Bereich der Augen und Atemwege hervorruft. 3 Jun 2019";"https://tractive.com/blog/de/gesundheit/die-10-haeufigsten-katzenkrankheiten#:~:text=Definition%3A%20Katzenschnupfen%20ist%20eine%20der;der%20Augen%20und%20Atemwege%20hervorruft.";Die 10 häufigsten Katzenkrankheiten - Symptome & Behandlung - Tractive
Wie wirkt sich Corona bei Katzen aus?;Wie verhält sich eine Katze die krank ist?;"Eine Corona-Infektion äußere sich bei Katzen ähnlich wie beim Menschen. Einige infizierte Katzen zeigten gar keine Symptome; während andere unter Appetitlosigkeit; Durchfall; Erbrechen; Husten oder flacher Atmung litten. 12 Feb 2021";"https://www.apotheken-umschau.de/krankheiten-symptome/infektionskrankheiten/coronavirus/bei-covid-19-nicht-mit-der-katze-schmusen-768321.html#:~:text=Eine%20Corona%2DInfektion%20%C3%A4u%C3%9Fere%20sich;Husten%20oder%20flacher%20Atmung%20litten.";Bei Covid-19 nicht mit der Katze schmusen | Apotheken Umschau
Wie oft darf eine Katze niesen?;Wie wirkt sich Corona bei Katzen aus?;"   Niest die Katze nur gelegentlich; ist der Grund dafür meist harmlos. Im Vergleich zum Menschen mit 20 bis 30 Millionen Riechzellen besitzt die Katze ganze 60 Millionen. Es ist also kein Wunder; dass unsere Fellnasen schon bei Raumsprays; Parfum oder Putzmitteln gern einmal niesen.";"https://www.zooplus.de/magazin/katze/katzengesundheit-pflege/katze-niest#:~:text=Niest%20die%20Katze%20nur%20gelegentlich;oder%20Putzmitteln%20gern%20einmal%20niesen.";Katze niest: Warum und was tun? | zooplus Magazin
Kann eine Katze Farben sehen?;Wie wirkt sich Corona bei Katzen aus?;"   Ja; Katzen können Farben sehen; allerdings nicht alle. Sie sehen Blau- und Gelbtöne; darunter auch Grün; aber kein Rot. Ihre Wahrnehmung von Grauabstufungen ist dafür wesentlich ausgeprägter und detaillierter als die menschliche. 17 Feb 2022";"https://uelzener.de/magazin/katze/haeufige-fragen/koennen-katzen-farben-sehen/#:~:text=Ja%2C%20Katzen%20k%C3%B6nnen%20Farben%20sehen;und%20detaillierter%20als%20die%20menschliche.";Können Katzen Farben sehen? - Uelzener
Was ist wenn Katzen viel niesen?;Wie wirkt sich Corona bei Katzen aus?;"   Katzen niesen genau wie Menschen als Abwehrreflex. Auf diese Weise können Staub und andere Fremdkörper aus der Nase entfernt werden. Das ist eine natürliche Reaktion; die nicht weiter besorgniserregend ist. Niesen bei der Katze kann aber auch ausgelöst werden durch eine Allergie oder Krankheit wie Katzenschnupfen.";"https://felmo.de/ratgeber/katze-niest#:~:text=Katzen%20niesen%20genau%20wie%20Menschen;Allergie%20oder%20Krankheit%20wie%20Katzenschnupfen.";Deine Katze niest oft? Wir erkären warum | felmo Ratgeber
Wie sagt man Katze ich Liebe dich?;Was ist der größte Liebesbeweis einer Katze?;"   Ihre geliebte Mitbewohner—Mieze blinzelt Sie mit beiden Augen an. Das entspricht Küssen mit den Augen und heißt so viel wie: „Ich liebe Dich. “ Wenn Sie Ihrer Katze ein Lächeln in Katzensprache schenken möchten; blinzeln auch Sie ihr einfach mit beiden Augen zu. Ihre Katze wird das verstehen.";"https://www.zooplus.de/magazin/katze/katzenhaltung/liebt-meine-katze-mich-10-zeichen-die-es-beweisen#:~:text=Ihre%20geliebte%20Mitbewohner%E2%80%94Mieze%20blinzelt;Ihre%20Katze%20wird%20das%20verstehen.";"Liebt meine Katze mich? 10 Zeichen; die es beweisen | zooplus Magazin"
Wie kann ich meiner Katze zeigen dass ich sie lieb habe?;Was ist der größte Liebesbeweis einer Katze?;"   8 Möglichkeiten um “Ich liebe dich” in Katzensprache zu sagen Streichel deine Katze da; wo sie es am liebsten mag. ...  Spiele mit deiner Katze; bis sie müde ist. ...  Biete deiner Katze ein Versteck. ...  Setze auf das langsame Blinzeln. ...  Mach mit beim Kopfstupser. ...  Erlaube deiner Katze; dich zu beschnuppern und abzulecken. More items...";https://www.rover.com/de/blog/8-moeglichkeiten-um-ich-liebe-dich-in-katzensprache-zu-sagen/;8 Möglichkeiten um “Ich liebe dich” in Katzensprache zu sagen - Rover
Was denkt meine Katze wer ich bin?;Was ist der größte Liebesbeweis einer Katze?;"Das Ergebnis war erstaunlich: Die Stubentiger haben ein feines Gespür für die menschlichen Emotionen und handeln sogar danach – ähnlich wie Hunde. Dabei orientieren sie sich an Stimme; Mimik und Bewegung. Dies in Kombination mit dem Aussehen und dem Geruch und die Katze erkennt ihre Lieblingsmenschen zweifelsfrei.";"https://www.tierwelt.ch/artikel/katzen/woran-das-busi-seinen-menschen-erkennt-407651#:~:text=Das%20Ergebnis%20war%20erstaunlich%3A%20Die;Katze%20erkennt%20ihre%20Lieblingsmenschen%20zweifelsfrei.";Woran das Büsi seinen Menschen erkennt - tierwelt.ch
Was ist der größte Liebesbeweis einer Katze?;Was heißt auf Katzensprache nein?;"Schlafen auf dem Schoß     Manche Katzen haben eine Vorliebe dafür sich auf Schoß; Brust oder Bauch ihres Menschen zu legen; sobald sich die Möglichkeit dazu ergibt. Dieses Verhalten ist ein tiefer Vertrauensbeweis und ein klares Zeichen von Liebe.";"https://happycat.de/magazin/katzenwissen/was-ist-der-groesste-liebesbeweis-einer-katze/#:~:text=Schlafen%20auf%20dem%20Scho%C3%9F;ein%20klares%20Zeichen%20von%20Liebe.";Was ist der größte Liebesbeweis einer Katze? - Happy Cat
Wie schimpfe ich mit meiner Katze?;Was heißt auf Katzensprache nein?;"Macht deine Katze etwas Unerwünschtes; muss dein Unterlass-Kommando unmittelbar folgen; sonst weiß sie nicht; für was sie gerade gerügt wird. Setzt deine Katze beispielsweise an; wieder einmal am Sofa zu kratzen; reagiere sofort mit einem deutlichen „Nein“ und zeige ihr so; dass das Verhalten unerwünscht ist.";"https://www.zooroyal.de/magazin/katzen/katzen-erziehen-ein-ding-der-unmoeglichkeit/#:~:text=Macht%20deine%20Katze%20etwas%20Unerw%C3%BCnschtes;dass%20das%20Verhalten%20unerw%C3%BCnscht%20ist.";Katzenerziehung - so klappt es kinderleicht | ZooRoyal Magazin
Was machen Katzen wenn sie sich freuen?;Was heißt auf Katzensprache nein?;"""Milchtritt"" bezeichnete Tapsen auf allen vier Pfoten auf einer Stelle gehört zum Verhaltensrepertoire von Katzen. Auch auf ihrem Menschen treteln Katzen oft herum. Dieses Verhalten zeigt; dass sich Ihre Katze gerade und auch allgemein auf Ihnen so wohlfühlt; dass ihr dabei direkt wieder ihre Kinderstube einfällt. 11 Jun 2021";"https://herz-fuer-tiere.de/haustiere/katzen/verhalten-von-katzen/7-zeichen-dass-sich-ihre-katze-wohlfuehlt#:~:text=%22Milchtritt%22%20bezeichnete%20Tapsen%20auf%20allen;direkt%20wieder%20ihre%20Kinderstube%20einf%C3%A4llt.";"7 Zeichen; dass sich Ihre Katze wohlfühlt | herz-fuer-tiere.de"
Was hassen Katzen am meisten?;Was ist tödlich für die Katze?;"Zu den weniger anziehenden Odeurs zählen der Geruch von Teebaumöl; Menthol; Eukalyptus sowie das Aroma von Kaffee. Zwiebeln und Knoblauch: Der Duft von Zwiebeln und von Knoblauch scheint ebenfalls abtörnend auf Katzen zu wirken. 27 Apr 2021";"https://www.stallbedarf24.de/ratgeber/welche-wirkung-haben-bestimmte-duftstoffe-auf-katzen/#:~:text=Zu%20den%20weniger%20anziehenden%20Odeurs;abt%C3%B6rnend%20auf%20Katzen%20zu%20wirken.";Welche Wirkung haben bestimmte Duftstoffe auf Katzen? - Stallbedarf24
Was ist Tierquälerei bei Katzen?;Was ist tödlich für die Katze?;"Katzen töten ist generell strafbar    Die versuchte oder fahrlässige Tierquälerei gilt als Ordnungswidrigkeit und kann mit einem hohen Bußgeld geahndet werden. Bemerken Sie ausgelegte Köder; sollten Sie zum Katzenschutz ihre Katze eine Weile nicht unbeaufsichtigt nach draußen lassen. 6 Dec 2022";"https://www.bussgeldkatalog.org/tierschutz-katze/#:~:text=Katzen%20t%C3%B6ten%20ist%20generell%20strafbar&text=Die%20versuchte%20oder%20fahrl%C3%A4ssige%20Tierqu%C3%A4lerei;nicht%20unbeaufsichtigt%20nach%20drau%C3%9Fen%20lassen.";Katzen und Katzenschutz - Tierschutz-Bußgeldkatalog 2023
Wo sterben Katzen am liebsten?;Was ist tödlich für die Katze?;"   Katzen; die bald sterben; verstecken sich oft an einem abgelegenen Ort. Das kann unter / auf Möbelstücken oder auch Draußen im Freien sein. Manchmal ist es sogar ein Ort; an dem sie sich vorher noch nie hingelegt haben.";"https://felmo.de/ratgeber/katze-stirbt#:~:text=Katzen%2C%20die%20bald%20sterben%2C%20verstecken;vorher%20noch%20nie%20hingelegt%20haben.";"Was tun; wenn die Katze stirbt? | felmo Ratgeber"
Wie erkenne ich ob meine Katze unglücklich ist?;Wann geht es einer Katze nicht gut?;"   Anzeichen; dass deine Katze unglücklich ist; sind unter anderem: Kratzen an Türzargen; Wänden; Tapeten; Möbeln. Harnmarkieren an Wänden; Möbeln; aufs Bett; obwohl sie trotzdem weiter die Katzentoilette benutzt. ...  Häufiges Verstecken im Schrank; unterm Bett. Längeres Wegbleiben von zu Hause. More items...";https://www.feliway.com/de/warum-feliway/anzeichen-unglueckliche-katze;Anzeichen unglückliche Katze - Feliway
Wie erkenne ich ob meine Katze traurig ist?;Wann geht es einer Katze nicht gut?;"   Folgende Anzeichen deuten darauf hin; dass die Katze traurig ist: Klagendes; lautes; ununterbrochenes Miauen bzw. Schreien. Schnelle; unkontrollierte Bewegungen mit dem Schwanz. Unruhiges Verhalten. Unreinheit. Verstecken. Verweigerung von Nahrung oder Drang; sich zu überfressen. 14 Apr 2022";https://www.weekend.at/lifestyle/haustiere/katze-ist-traurig-gruende;"Wie erkenne ich; dass meine Katze traurig ist? - Weekend Magazin"
Wie sieht eine traurige Katze aus?;Wann geht es einer Katze nicht gut?;"   Tatsächlich ist eine depressive Katze katzenuntypisch ruhig. Sie spielt kaum oder gar nicht; schläft fast nur noch; wirkt lustlos und desinteressiert und frisst weniger als normal oder auch gar nicht mehr. Manche Tiere vernachlässigen sogar die ihnen sonst so heilige Fellpflege. Ihr Haarkleid wird stumpf und verfilzt.";"https://www.tierisch-wohnen.de/katze/ernaehrung-gesundheit-katze/depressionen-bei-katzen-erkennen/#:~:text=Tats%C3%A4chlich%20ist%20eine%20depressive%20Katze;Haarkleid%20wird%20stumpf%20und%20verfilzt.";Depressionen bei Katzen erkennen und behandeln | tierisch wohnen
