Was ist die Lieblingsfarbe von Katzen?;Was ist wenn Katzen viel niesen?;"Eine Untersuchung des zoologischen Instituts in Mainz ergab; dass Blau die Lieblingsfarbe vieler Katzen war. Um ans Futter zu gelangen; mussten sich die Katzen zwischen Gelb und Blau entscheiden. 95% wählten Blau! 9 Jun 2022";"https://herz-fuer-tiere.de/haustiere/katzen/verhalten-von-katzen/wie-sehen-katzen#:~:text=Eine%20Untersuchung%20des%20zoologischen%20Instituts;95%25%20w%C3%A4hlten%20Blau!";Wie sehen Katzen? Diese Farben erkennt die Katze | herz-fuer-tiere.de
Was bedeutet das Schnurren von Katzen?;Wie sagt man Katze ich Liebe dich?;"   Katzen schnurren in Momenten extremer Entspannung. Allerdings glauben Tierexperten; dass Katzen auch dann schnurren; wenn sie sehr gestresst sind oder große Schmerzen haben – beispielsweise bei einem Tierarztbesuch oder sogar unter der Geburt. Wissenschaftler nehmen an; dass Katzen schnurren; um sich zu beruhigen.";"https://meinhaustierundich.elanco.com/de/neue-tierhalter/vier-gruende-warum-katzen-schnurren#:~:text=Katzen%20schnurren%20in%20Momenten%20extremer;schnurren%2C%20um%20sich%20zu%20beruhigen.";Katzen schnurren – aber warum? Wir nennen Ihnen 4 Gründe
Ist Katzenschnupfen für den Menschen gefährlich?;Wie sagt man Katze ich Liebe dich?;"   Ist Katzenschnupfen für den Menschen gefährlich? In der Regel hat Katzenschnupfen keinen negativen Einfluss auf den Menschen. Trägt die Katze den Erreger Bordetella bronchiseptica in sich; lässt sich dieser auf den Menschen übertragen.";"https://www.medikamente-per-klick.de/apotheke/tierkrankheiten/katzenschnupfen/#:~:text=Ist%20Katzenschnupfen%20f%C3%BCr%20den%20Menschen;dieser%20auf%20den%20Menschen%20%C3%BCbertragen.";Katzenschnupfen | Ihre Apotheke informiert über Tierkrankheiten
Was tun wenn die Katze gestresst ist?;Wie sagt man Katze ich Liebe dich?;"Bei akuter Angst bzw. akutem Stress hilft es; beruhigend mit der Mieze zu sprechen und sie (je nach Katze) zu streicheln. Versuchen Sie nicht; die Katze zum Gegenstand ihrer Angst zu tragen; um ihr zu zeigen; dass kein Grund zur Sorge besteht. Sie wird es nicht verstehen und nur noch mehr Angst haben.";"https://www.fellomed.de/ratgeber/tipps-hund-katze/stress-und-angst-katzen/#:~:text=Bei%20akuter%20Angst%20bzw.;nur%20noch%20mehr%20Angst%20haben.";"Stress & Angst bei Katzen: 33 Tipps; wie Sie helfen können - fellomed"
Was sehen Katzen im Fernsehen?;Wie kann ich meiner Katze zeigen dass ich sie lieb habe?;"Fernsehen für Katzen – lieber Sportschau oder Nachrichten? Läuft der Fernseher; dann reagieren die Katzen nicht nur auf schnelle Bewegungen; sondern auch auf Geräusche; flackernde Lichter; abwechslungsreiche Farben und Objekte; die sich bewegen. Schlussendlich reagiert sie auf alles; was ihre Instinkte anspricht. 16 Nov 2022";"https://www.bildderfrau.de/familie-leben/haustiere/article236924827/Katzen-fernsehen.html#:~:text=Fernsehen%20f%C3%BCr%20Katzen%20%E2%80%93%20lieber%20Sportschau;alles%2C%20was%20ihre%20Instinkte%20anspricht.";"Was Katzen wirklich sehen; wenn sie mit uns fernsehen - Bild der Frau"
Was ist der größte Liebesbeweis einer Katze?;Wie kann ich meiner Katze zeigen dass ich sie lieb habe?;"Schlafen auf dem Schoß     Manche Katzen haben eine Vorliebe dafür sich auf Schoß; Brust oder Bauch ihres Menschen zu legen; sobald sich die Möglichkeit dazu ergibt. Dieses Verhalten ist ein tiefer Vertrauensbeweis und ein klares Zeichen von Liebe.";"https://happycat.de/magazin/katzenwissen/was-ist-der-groesste-liebesbeweis-einer-katze/#:~:text=Schlafen%20auf%20dem%20Scho%C3%9F;ein%20klares%20Zeichen%20von%20Liebe.";Was ist der größte Liebesbeweis einer Katze? - Happy Cat
Was bedeutet es wenn meine Katze neben mir schläft?;Wie kann ich meiner Katze zeigen dass ich sie lieb habe?;Der Stubentiger drückt sein Vertrauen aus    Die körperliche Nähe zu euch beim Schlafen ist ein Vertrauensbeweis. Eine schlafende Katze ist Gefahren ausgesetzt. Eure Fellnase vertraut euch ohne Einschränkungen. Beim Schlafen ist sie verwundbar und der kleine Räuber legt sein Leben in eure Hände.;"https://www.mein-haustier.de/magazin/katze-liegt-auf-mir/#:~:text=Der%20Stubentiger%20dr%C3%BCckt%20sein%20Vertrauen;sein%20Leben%20in%20eure%20H%C3%A4nde.";Die Katze liegt auf mir: Warum tut sie das? - Mein-Haustier.de
Wie zeigt eine Katze das sie traurig ist?;Was denkt meine Katze wer ich bin?;"   Folgende Anzeichen deuten darauf hin; dass die Katze traurig ist: Klagendes; lautes; ununterbrochenes Miauen bzw. Schreien. Schnelle; unkontrollierte Bewegungen mit dem Schwanz. 14 Apr 2022";"https://www.weekend.at/lifestyle/haustiere/katze-ist-traurig-gruende#:~:text=Folgende%20Anzeichen%20deuten%20darauf%20hin;unkontrollierte%20Bewegungen%20mit%20dem%20Schwanz";"Wie erkenne ich; dass meine Katze traurig ist? - Weekend Magazin"
Wie sehen Katzen aus wenn sie traurig sind?;Was denkt meine Katze wer ich bin?;"   Die Anzeichen für eine Depression bei Katzen sind oft erst auf den zweiten Blick erkennbar. Tatsächlich ist eine depressive Katze katzenuntypisch ruhig. Sie spielt kaum oder gar nicht; schläft fast nur noch; wirkt lustlos und desinteressiert und frisst weniger als normal oder auch gar nicht mehr.";"https://www.tierisch-wohnen.de/katze/ernaehrung-gesundheit-katze/depressionen-bei-katzen-erkennen/#:~:text=Die%20Anzeichen%20f%C3%BCr%20eine%20Depression;oder%20auch%20gar%20nicht%20mehr.";Depressionen bei Katzen erkennen und behandeln | tierisch wohnen
Wo schläft eine Katze am liebsten?;Was denkt meine Katze wer ich bin?;"Manche Katzen lieben erhöhte Schlafplätze; andere verkriechen sich lieber in einer Höhle am Boden. Manche Katzen mögen es warm und kuschelig; wie in einem Bett oder dem Sofa; andere bevorzugen kühlende Fliesen.";"https://portapet.de/meine-katze-und-ich/der-richtige-schlafplatz-fuer-deine-katze/#:~:text=Manche%20Katzen%20lieben%20erh%C3%B6hte%20Schlafpl%C3%A4tze;Sofa%2C%20andere%20bevorzugen%20k%C3%BChlende%20Fliesen.";Der richtige Schlafplatz für Deine Katze - PortaPet
Wie kann ich meiner Katze zeigen dass ich sie lieb habe?;Was ist der größte Liebesbeweis einer Katze?;"   8 Möglichkeiten um “Ich liebe dich” in Katzensprache zu sagen Streichel deine Katze da; wo sie es am liebsten mag. ...  Spiele mit deiner Katze; bis sie müde ist. ...  Biete deiner Katze ein Versteck. ...  Setze auf das langsame Blinzeln. ...  Mach mit beim Kopfstupser. ...  Erlaube deiner Katze; dich zu beschnuppern und abzulecken. More items...";https://www.rover.com/de/blog/8-moeglichkeiten-um-ich-liebe-dich-in-katzensprache-zu-sagen/;8 Möglichkeiten um “Ich liebe dich” in Katzensprache zu sagen - Rover
Was die Katzen nicht mögen?;Was ist der größte Liebesbeweis einer Katze?;"   Welche Gerüche mögen Katzen nicht? Katzen mögen den Geruch von Zitrusfrüchten; Weinraute; Lavendel; Essig und Zwiebeln nicht. Auch Naphthalin; Paprika; Zimt und der Geruch einer schmutzigen Katzentoilette sind ihnen zuwider. 31 May 2022";"https://zooland.com.de/WELCHE-DUFTE-MOGEN-KATZEN-NICHT-5-DUFTE-DIE-DIE-KATZEN-ERSCHRECKEN-blog-ger-1653979873.html#:~:text=Welche%20Ger%C3%BCche%20m%C3%B6gen%20Katzen%20nicht;schmutzigen%20Katzentoilette%20sind%20ihnen%20zuwider.";"WELCHE DÜFTE MÖGEN KATZEN NICHT? 5 DÜFTE; DIE ... - Zooland"
Kann eine Katze nachtragend sein?;Was ist der größte Liebesbeweis einer Katze?;"Katzen sind sensibel und nachtragend. Sie reagieren auf die Veränderung ihrer Lebensumstände mit Verärgerung und Rückzug. Katzen sind sehr sensible Gewohnheitstiere; die auf die geringsten Veränderungen bei ihren Lebensumständen mit Verhaltensänderungen reagieren können.";"https://www.petdoctors.at/katze/verhalten-ausbildung/wenn-katzen-schmollen#:~:text=Katzen%20sind%20sensibel%20und%20nachtragend;Lebensumst%C3%A4nden%20mit%20Verhaltens%C3%A4nderungen%20reagieren%20k%C3%B6nnen.";Wenn Katzen schmollen - petdoctors.at
Warum duckt sich meine Katze Wenn ich sie Streicheln will?;Was machen Katzen wenn sie sich freuen?;"   Meine Katze duckt sich immer beim Streicheln    Das Ducken gilt als Warnung und soll eine Grenzüberschreitung signalisieren. Falls du nicht darauf reagierst; könnte die Katze ihre Abwehrtechniken intensivieren; sie könnte also fauchen; beißen oder mit ausgefahrenen Krallen nach dir hauen.";"https://www.tierheim.de/katze-streicheln/#:~:text=Meine%20Katze%20duckt%20sich%20immer%20beim%20Streicheln&text=Das%20Ducken%20gilt%20als%20Warnung;ausgefahrenen%20Krallen%20nach%20dir%20hauen.";"Die Katze streicheln; ohne dass sie sich unwohl fühlt - Tierheim.de"
Was denkt meine Katze wer ich bin?;Was machen Katzen wenn sie sich freuen?;"Das Ergebnis war erstaunlich: Die Stubentiger haben ein feines Gespür für die menschlichen Emotionen und handeln sogar danach – ähnlich wie Hunde. Dabei orientieren sie sich an Stimme; Mimik und Bewegung. Dies in Kombination mit dem Aussehen und dem Geruch und die Katze erkennt ihre Lieblingsmenschen zweifelsfrei.";"https://www.tierwelt.ch/artikel/katzen/woran-das-busi-seinen-menschen-erkennt-407651#:~:text=Das%20Ergebnis%20war%20erstaunlich%3A%20Die;Katze%20erkennt%20ihre%20Lieblingsmenschen%20zweifelsfrei.";Woran das Büsi seinen Menschen erkennt - tierwelt.ch
Kann eine Katze dankbar sein?;Was machen Katzen wenn sie sich freuen?;"   Für Katzen ist Dankbarkeit selbstverständlich. Im Gegensatz zu Menschen halten sich Samtpfoten nicht damit auf; sich über Dinge zu ärgern; die sie nicht haben. Stattdessen sind sie zufrieden mit dem; was da ist; oder fordern es mit liebevoller Hartnäckigkeit ein; wenn sie doch mal etwas brauchen.";"https://einfachtierisch.de/katzen/katzenhaltung/dankbarkeit-von-katzen-lernen-4-schnurrige-glueckstipps-94405#:~:text=F%C3%BCr%20Katzen%20ist%20Dankbarkeit%20selbstverst%C3%A4ndlich;sie%20doch%20mal%20etwas%20brauchen.";Dankbarkeit von Katzen lernen: 4 schnurrige Glückstipps
Was sollte man mit Katzen nicht machen?;Was hassen Katzen am meisten?;"   Lärm; laute Musik und Schimpfen hören sich für deine Katze deshalb deutlich eindringlicher an und können sogar Schmerzen hervorrufen. Das kann schnell Stress verursachen. Vermeide zu laute Geräusche und schreie deine Katze niemals an.";"https://www.zooroyal.de/magazin/katzen/training-erziehung-katzen/7-no-gos-bei-der-katzenerziehung/#:~:text=L%C3%A4rm%2C%20laute%20Musik%20und%20Schimpfen;schreie%20deine%20Katze%20niemals%20an.";7 No-Gos bei der Katzenerziehung | ZooRoyal Magazin
Was bedeutet es wenn meine Katze mir auf Schritt und Tritt folgt?;Was hassen Katzen am meisten?;"Das „Ich liebe dich“ deiner Katze    Wenn deine Katze dich schon an der Tür erwartet und dir dann auf Schritt und Tritt folgt; kann dieses Verhalten eine Zuneigungsbotschaft sein. Streicht die Fellnase dann auch noch schnurrend an deinen Beinen entlang; ist das wie ein kleiner Liebesbrief.";"https://www.katzenkram.net/verhalten/katze-laeuft-mir-hinterher/#:~:text=Jetzt%20Einl%C3%B6sen-;Das%20%E2%80%9EIch%20liebe%20dich%E2%80%9C%20deiner%20Katze;das%20wie%20ein%20kleiner%20Liebesbrief.";Darum folgt dir deine Katze überall hin ▷ - Katzenkram
Wie sagt man einer Katze nein?;Was hassen Katzen am meisten?;"Macht deine Katze etwas Unerwünschtes; muss dein Unterlass-Kommando unmittelbar folgen; sonst weiß sie nicht; für was sie gerade gerügt wird. Setzt deine Katze beispielsweise an; wieder einmal am Sofa zu kratzen; reagiere sofort mit einem deutlichen „Nein“ und zeige ihr so; dass das Verhalten unerwünscht ist.";"https://www.zooroyal.de/magazin/katzen/katzen-erziehen-ein-ding-der-unmoeglichkeit/#:~:text=Macht%20deine%20Katze%20etwas%20Unerw%C3%BCnschtes;dass%20das%20Verhalten%20unerw%C3%BCnscht%20ist.";Katzenerziehung - so klappt es kinderleicht | ZooRoyal Magazin
Wie sagt man Katze ich Liebe dich?;Was ist Tierquälerei bei Katzen?;"   Ihre geliebte Mitbewohner—Mieze blinzelt Sie mit beiden Augen an. Das entspricht Küssen mit den Augen und heißt so viel wie: „Ich liebe Dich. “ Wenn Sie Ihrer Katze ein Lächeln in Katzensprache schenken möchten; blinzeln auch Sie ihr einfach mit beiden Augen zu. Ihre Katze wird das verstehen.";"https://www.zooplus.de/magazin/katze/katzenhaltung/liebt-meine-katze-mich-10-zeichen-die-es-beweisen#:~:text=Ihre%20geliebte%20Mitbewohner%E2%80%94Mieze%20blinzelt;Ihre%20Katze%20wird%20das%20verstehen.";"Liebt meine Katze mich? 10 Zeichen; die es beweisen | zooplus Magazin"
Was denkt meine Katze Wenn ich sie küsse?;Was ist Tierquälerei bei Katzen?;"Katzen mögen es nicht mit feuchten Lippen abgeküsst zu werden. Wenn sie dabei noch festgehalten werden; heißt das nicht; es gefällt der Katze. Sie duldet es nur; weil sie nicht wegkann. Ständig geküsste Katzen rechnen immer mit einer neuen Kussattacke.";"https://www.schlappohr.de/tiere/aus-diesem-grund-moechten-katzen-nicht-gekuesst-werden#:~:text=Katzen%20m%C3%B6gen%20es%20nicht%20mit;immer%20mit%20einer%20neuen%20Kussattacke.";Aus diesem Grund möchten Katzen nicht geküsst werden! - Schlappohr
Warum guckt meine Katze mich immer an?;Was ist Tierquälerei bei Katzen?;"Katzen; die Sie mit ihrem Blick fixieren und anstarren; sind aufmerksam. Starrt die Katze etwas mit einem fixierten Blick an; bedeutet dies zunächst vor allem; dass sie sich vollkommen auf das Objekt konzentriert. Für sie als Jäger zahlt sich dieses Verhalten in der Natur aus. 28 Oct 2019";"https://www.miamor.de/magazin/katze-starrt-mich-an#:~:text=beim%20Anstarren%20g%C3%A4hnen-;Katzen%2C%20die%20Sie%20mit%20ihrem%20Blick%20fixieren%20und%20anstarren%2C%20sind;Verhalten%20in%20der%20Natur%20aus.";Meine Katze starrt mich an – was bedeutet das?
Wie kann man sich bei einer Katze entschuldigen?;Wo sterben Katzen am liebsten?;"So entschuldigst du dich richtig bei deiner Katze Schritt 1: Verbeuge dich vor der Katze und bitte sie um eine Audienz. Schritt 2: Gib ihr ein Leckerli. Schritt 3: Erkläre ihr; dass du dir deines Verbrechens vollkommen bewusst bist und es dir unendlich leid tut. Schritt 4: Gib ihr ein Leckerli. More items...";https://www.watson.ch/katze/tier/888953397-wie-entschuldigt-man-sich-richtig-bei-einer-katze-hier-ist-eine-einfache-anleitung;So entschuldigst du dich richtig bei deiner Katze - Watson
Soll Katze im Bett schlafen?;Wo sterben Katzen am liebsten?;"Pro: Was spricht dafür; die Katze im Bett schlafen zu lassen? Katzen bewirken inneren Frieden und Ruhe beim Menschen. Schläft die Katze abends auf der Bettdecke ein oder begrüßt ihren menschlichen Mitbewohner morgens schnurrend; wirkt sich dies positiv auf das Gesamtbefinden der Zweibeiner aus.";"https://www.zooplus.de/magazin/katze/katzenhaltung/sollte-ich-meine-katze-im-bett-schlafen-lassen#:~:text=eine%20gute%20L%C3%B6sung-;Pro%3A%20Was%20spricht%20daf%C3%BCr%2C%20die%20Katze%20im%20Bett%20schlafen%20zu;das%20Gesamtbefinden%20der%20Zweibeiner%20aus.";Sollte ich meine Katze im Bett schlafen lassen? | zooplus Magazin
Was nervt Katzen am meisten?;Wo sterben Katzen am liebsten?;"   Top 1 - Hey; hör auf mit dem Gekrabbel! Top 2 – Falsches Spiel! Top 3 – Versteh mich doch!";"https://www.zooroyal.de/magazin/katzen/was-katzen-an-uns-nervt/#:~:text=Top%201%20%2D%20Hey%2C%20h%C3%B6r%20auf;Top%203%20%E2%80%93%20Versteh%20mich%20doch!";Was Katzen an uns nervt – die Top 3 | ZooRoyal Magazin
Was ist der Feind der Hauskatze?;Wie erkenne ich ob meine Katze unglücklich ist?;"Katzen sind sehr eigenwillige Geschöpfe. ... Steckbrief. Name Hauskatze (Felis silvestris catus) Nahrung Mäuse; Vögel; Eidechsen Feinde Fuchs; Luchs; Wolf bei wildlebenden Katzen Gefährdung Autos 8 more rows";https://kiwithek.kidsweb.at/index.php/Katze;Katze - KiwiThek
Was ist der natürliche Feind von Katzen?;Wie erkenne ich ob meine Katze unglücklich ist?;"   Natürliche Feinde sind Luchs und Wolf; für junge Wildkatzen auch Uhu; Steinadler; Habicht; Fuchs und Marder.";"https://www.jagdverband.de/zahlen-fakten/tiersteckbriefe/wildkatze-felis-silvestris#:~:text=Nat%C3%BCrliche%20Feinde%20sind%20Luchs%20und;%2C%20Habicht%2C%20Fuchs%20und%20Marder.";Wildkatze (Felis silvestris) - Deutscher Jagdverband
Sollte man mit Katzen spazieren gehen?;Wie erkenne ich ob meine Katze unglücklich ist?;"Fazit: Gassi gehen mit der Katze ist weder artgerecht noch hat es für das Tier positive Aspekte. Eine Wohnungskatze ist in ihrem „Revier“ besser aufgehoben. Wenn das Tier außerdem Freigang nicht kennt; vermisst es diesen auch nicht. Im Freien bedeutet die Leine für eine Katze ein Sicherheitsrisiko. 4 Mar 2022";"https://www.fressnapf.de/magazin/katze/erziehung/katze-an-der-leine/#:~:text=Fazit%3A%20Gassi%20gehen%20mit%20der;f%C3%BCr%20eine%20Katze%20ein%20Sicherheitsrisiko.";Wann darf ich mit meiner Katze an der Leine Gassi gehen? - Fressnapf
Was ist tödlich für die Katze?;Wie erkenne ich ob meine Katze traurig ist?;"Rohe Kartoffeln; Auberginen und unreife Tomaten: Sind giftig für Katzen. Rohe Kartoffeln und Auberginen enthalten Solanin. Dieser Giftstoff schädigt die Schleimhäute von Katzen und kann zu Durchfall; Krämpfen und Atemlähmung bei Vierbeinern führen. 30 Nov 2022";"https://www.petsdeli.de/magazin/katzen/katze-gesundheit/giftig-fur-katzen#:~:text=Toxoplasmose%20belastet%20sein.-;Rohe%20Kartoffeln%2C%20Auberginen%20und%20unreife%20Tomaten%3A%20Sind%20giftig%20f%C3%BCr%20Katzen;und%20Ateml%C3%A4hmung%20bei%20Vierbeinern%20f%C3%BChren.";Giftig für Katzen: Was dürfen Katzen fressen und was nicht? - Pets Deli
Kann eine Katze weinen?;Wie erkenne ich ob meine Katze traurig ist?;"   Ebenso wie Menschen können Katzen durchaus weinen und auch Emotionen empfinden. Allerdings besteht zwischen der Träne und dem Gefühl kein Zusammenhang; denn Katzen drücken ihre Emotionen anders aus. 23 Feb 2022";"https://www.agila.de/agila-magazin/3113-koennen-katzen-weinen#:~:text=Ebenso%20wie%20Menschen%20k%C3%B6nnen%20Katzen;dr%C3%BCcken%20ihre%20Emotionen%20anders%20aus.";Können Katzen weinen? - AGILA
Was ist sofort tödlich für Katzen?;Wie erkenne ich ob meine Katze traurig ist?;"Rohes Schweinefleisch kann das für Katzen meist tödliche Aujeszky-Virus enthalten. Achte also bei der Zubereitung darauf; dass sich Dein Stubentiger kein rohes Fleischstückchen mopst. Damit es gar nicht erst dazu kommt; kochst Du besser ohne ihn.";"https://www.vergleichen-und-sparen.de/blog/giftig-fuer-katzen/#:~:text=Rohes%20Schweinefleisch%20kann%20das%20f%C3%BCr;kochst%20Du%20besser%20ohne%20ihn.";Welche Stoffe und Lebensmittel sind für Katzen giftig? |VS.
Können Katzen Liebe spüren?;Wie sieht eine traurige Katze aus?;"   Katzen können verschmust und verspielt sein. Vor allem aber gelten sie als unabhängig und eigenständig – ganz im Gegensatz zu Hunden! Eine neue Studie zeigt nun; dass Katzen viel beziehungsfähiger sind als bisher angenommen. Sie binden sich ähnlich an ihre Besitzer wie Kleinkinder an ihre Eltern. 27 Sept 2019";"https://www.mdr.de/wissen/katzen-katzenpsychologie-katzenbesitzer-100.html#:~:text=Katzen%20k%C3%B6nnen%20verschmust%20und%20verspielt;wie%20Kleinkinder%20an%20ihre%20Eltern.";Katzen: Auch sie lieben ihre Besitzer | MDR.DE
Kann eine Katze beleidigt sein?;Wie sieht eine traurige Katze aus?;"Auch Katzen können schmollen und beleidigt sein; wenn ihnen etwas nicht passt und sie sich unwohl fühlen. Die Gründe sowie die Art; wie sich das Schmollen äußert; sind aber sehr unterschiedlich. 24 Aug 2015";"https://herz-fuer-tiere.de/haustiere/katzen/verhalten-von-katzen/warum-katzen-schmollen#:~:text=Auch%20Katzen%20k%C3%B6nnen%20schmollen%20und;%C3%A4u%C3%9Fert%2C%20sind%20aber%20sehr%20unterschiedlich.";Warum Katzen schmollen | herz-fuer-tiere.de
Sind Katzen traurig wenn sie alleine sind?;Wie sieht eine traurige Katze aus?;"   Es stimmt; dass Katzen als Einzelgänger auftreten: Sie können gut für sich alleine sorgen. Im Gegensatz zu Hunden sind Katzen weniger abhängig von menschlicher Zuwendung und Geborgenheit. Untersuchungen haben ergeben; dass Katzen keine Anzeichen von Trennungsangst zeigen; wenn ihre Besitzer nicht anwesend sind. 9 May 2019";"https://www.pawshake.de/blog/vermisst-dich-deine-katze#:~:text=Es%20stimmt%2C%20dass%20Katzen%20als;ihre%20Besitzer%20nicht%20anwesend%20sind.";"Vermisst Dich Deine Katze; wenn Du sie alleine lässt? | Pawshake Blog"
Wie schläft eine kranke Katze?;Ist eine wohnungskatze unglücklich?;"   Kranke Katzen dösen auch häufig in der Sphinx-Stellung auf dem Bauch. Die Vorderpfoten sind dabei nach vorne gestreckt oder auch vor oder unter dem Bauch eingeschlagen; das Köpfchen nicht abgelegt; die Rückenhaare oftmals aufgeplustert. 2 Mar 2021";"https://www.tierwelt.ch/artikel/katzen/was-die-schlafposition-uber-ihre-katze-verrat-405029#:~:text=Kranke%20Katzen%20d%C3%B6sen%20auch%20h%C3%A4ufig;abgelegt%2C%20die%20R%C3%BCckenhaare%20oftmals%20aufgeplustert.";Was die Schlafposition über ihre Katze verrät - tierwelt.ch
Wie macht sich Corona bei Katzen bemerkbar?;Ist eine wohnungskatze unglücklich?;"Eine Corona-Infektion äußere sich bei Katzen ähnlich wie beim Menschen. Einige infizierte Katzen zeigten gar keine Symptome; während andere unter Appetitlosigkeit; Durchfall; Erbrechen; Husten oder flacher Atmung litten. 12 Feb 2021";"https://www.apotheken-umschau.de/krankheiten-symptome/infektionskrankheiten/coronavirus/bei-covid-19-nicht-mit-der-katze-schmusen-768321.html#:~:text=Eine%20Corona%2DInfektion%20%C3%A4u%C3%9Fere%20sich;Husten%20oder%20flacher%20Atmung%20litten.";Bei Covid-19 nicht mit der Katze schmusen | Apotheken Umschau
Wie lange kann sich eine Katze erinnern?;Ist eine wohnungskatze unglücklich?;"Überraschenderweise konnten sie sich die Position und Höhe der Barriere nicht nur einige Sekunden; sondern bis zu zehn Minuten lang merken. Dass Katzen über ein derart lang anhaltendes Arbeitsgedächtnis verfügen; war vorher nicht bekannt; wie McVea und Pearson in der Zeitschrift „Current Biology“ (Bd. 17; S. 3 Sept 2007";"https://www.faz.net/aktuell/wissen/natur/katzen-vierbeinige-gedaechtniskuenstler-1459815.html#:~:text=%C3%9Cberraschenderweise%20konnten%20sie%20sich%20die;17%2C%20S.";Katzen: Vierbeinige Gedächtniskünstler - Natur - FAZ
Können Katzen sich langweilen?;Welche Katzen sind am wenigsten krank?;"   Wie erkenne ich eine gelangweilte Katze? Wenn Deine Katze viel schläft; sich auffällig viel putzt oder aus unerklärlichen Gründen unsauber wird; dann können das schon erste Zeichen von Langeweile sein. Aber auch Zerstörungswut macht sich bei vereinsamten und unzufriedenen Samtpfoten breit.";"https://www.leonardo-catfood.de/pfotentipps/freizeit/katze-beschaeftigen#:~:text=Wie%20erkenne%20ich%20eine%20gelangweilte;vereinsamten%20und%20unzufriedenen%20Samtpfoten%20breit.";5 Tipps gegen Langeweile bei Katzen | LEONARDO®
Wann geht es einer Katze nicht gut?;Welche Katzen sind am wenigsten krank?;"Ihre Katze humpelt; hat Probleme beim Springen; weist plötzlich einen torkelnden Gang auf; will sich gar nicht mehr bewegen; hält den Kopf dauerhaft gesenkt oder schlägt vermehrt mit ihrem Schwanz? Das können Anzeichen dafür sein; dass es Ihrer Katze nicht gut geht. 28 Dec 2020";"https://www.peta.de/themen/katze-krank/#:~:text=Ihre%20Katze%20humpelt%2C%20hat%20Probleme;Ihrer%20Katze%20nicht%20gut%20geht.";"Katze krank? 7 Anzeichen; dass es Ihrer Katze schlecht geht - PETA"
Wie sitzen Katzen wenn sie Schmerzen haben?;Welche Katzen sind am wenigsten krank?;"   Veränderte Körperhaltung: Leidet eine Katze unter Schmerzen; zeigt sie eine angespannte Körperhaltung; hat einen eingezogenen Bauch; lahmt oder lässt den Kopf hängen. Appetitlosigkeit: Schmerzen können Katzen auf den Magen schlagen. Daher fressen und trinken Katzen mit Schmerzen oft nur wenig bis gar nichts.";"https://www.royalcanin.com/de/cats/health-and-wellbeing/woran-erkenne-ich-dass-meine-katze-schmerzen-hat#:~:text=Ver%C3%A4nderte%20K%C3%B6rperhaltung%3A%20Leidet%20eine%20Katze;nur%20wenig%20bis%20gar%20nichts.";"Woran erkenne ich; dass meine Katze Schmerzen hat? - Royal Canin"
Sind Katzen hygienisch?;Was heißt auf Katzensprache nein?;"Katzen sind sehr reinliche Tiere und lieben Sauberkeit. Sie betreiben viel Aufwand; um sich zu pflegen. An einige Stellen kommen die Stubentiger allerdings nicht gut selbst ran; hier kannst du sie bei ihrer täglichen Hygiene unterstützen.";"https://www.fressnapf.de/magazin/katze/pflege-hygiene/#:~:text=Katzen%20sind%20sehr%20reinliche%20Tiere%20und%20lieben%20Sauberkeit.;bei%20ihrer%20t%C3%A4glichen%20Hygiene%20unterst%C3%BCtzen.";Wissenswertes über Katzenpflege | FRESSNAPF
Ist es eine Quälerei Katzen in der Wohnung zu halten?;Was heißt auf Katzensprache nein?;"Um es gleich vorweg zu nehmen: Die Wohnungshaltung von Katzen ist entgegen aller anderslautenden Internet-Latrinenparolen sicherlich keine Tierquälerei; sondern nach allgemeiner Expertenmeinung durchaus artgerecht möglich. 25 Jan 2015";"https://www.tierarzt-rueckert.de/blog/details_1489_3_19056.html#:~:text=Um%20es%20gleich%20vorweg%20zu;allgemeiner%20Expertenmeinung%20durchaus%20artgerecht%20m%C3%B6glich.";Der Stubentiger: Die Katze in Wohnungshaltung - Ralph Rückert
Welche Krankheiten kann man von Katzen bekommen?;Was heißt auf Katzensprache nein?;   Die häufigsten Zoonosen durch Katzen Toxoplasmose. Magen-Darm-Infektionen. Wundinfektionen. Katzenkratzkrankheit. Tollwut. Hautpilzerkrankungen. 23 Jun 2021;https://herz-fuer-tiere.de/haustiere/katzen/gesundheit-und-vorsorge-bei-katzen/diese-krankheiten-koennen-katzen-auf-menschen-uebertragen;Diese Krankheiten können Katzen auf Menschen übertragen
Kann man Katzen den ganzen Tag alleine lassen?;Wie sagt eine Katze nein?;"Grundsätzlich wird empfohlen; eine Katze niemals mehr als 2 Tage völlig alleine zu lassen. Wenn du länger als 2 Tage unterwegs bist; dann solltest du nach Alternativen suchen oder eine Betreuung finden; die 2x täglich nach deiner Katze sieht. 22 Jun 2019";"https://tractive.com/blog/de/sicherheit/wie-lange-katze-alleine-lassen#:~:text=Grunds%C3%A4tzlich%20wird%20empfohlen%2C%20eine%20Katze;t%C3%A4glich%20nach%20deiner%20Katze%20sieht.";Wie lange kannst du eine Katze alleine lassen? - Tractive
