Wie erkenne ich ob meine Katze gesund ist?;Gesundheit von Katzen;"   Kontrolliere die Haut und das Fell    An der Haut und am Fell deiner Katze kannst du gut ablesen; ob deine Katze gesund ist: Ein gesundes Fell ist sauber und nicht verklebt. Auch die Haut muss sauber und unbeschädigt sein. Eine schuppige Haut; kahle Flecken oder Wunden sind ein Hinweis auf Beschwerden.";"https://www.yarrah.com/de/blog/wie-weis-man-dass-eine-katze-gesund-ist/#:~:text=Kontrolliere%20die%20Haut%20und%20das;sind%20ein%20Hinweis%20auf%20Beschwerden.";"Wie weiß man; dass eine Katze gesund ist? - Yarrah"
Was braucht eine Katze um gesund zu bleiben?;Gesundheit von Katzen;"Katzen mit wenig oder ohne Fell neigen zu Hautproblemen wie der Entwicklung von Hautausschlägen und Pilzinfektionen. Katzenbesitzer sollten deshalb besonders drauf achten die Haut sauber und geschmeidig zu halten. Sie sollte jede Woche gebadet werden; um die öligen Rückstände zu entfernen.";"https://katzenmedizin.info/so-halte-ich-meine-katze-fit-und-gesund-tipps-fuer-die-regelmaessige-pflege/#:~:text=Katzen%20mit%20wenig%20oder%20ohne;die%20%C3%B6ligen%20R%C3%BCckst%C3%A4nde%20zu%20entfernen.";So halte ich meine Katze fit und gesund - Tipps für die regelmässige ...
Haben Katzen heilende Kräfte?;Gesundheit von Katzen;   Durch ihre positive Wirkung auf uns Menschen werden Katzen mittlerweile auch in der tiergestützten Therapie eingesetzt. Therapiekatzen können zum Beispiel älteren Menschen mit Demenz helfen oder Kindern mit ADS. Sie geben den Patienten ein gutes Gefühl und wirken dem Gefühl der Einsamkeit entgegen.;"https://www.zooplus.de/magazin/katze/katzenhaltung/warum-katzen-gut-fuer-unsere-gesundheit-sind#:~:text=Durch%20ihre%20positive%20Wirkung%20auf;dem%20Gef%C3%BChl%20der%20Einsamkeit%20entgegen.";Warum Katzen gut für unsere Gesundheit sind - Zooplus
Was sind die häufigsten Krankheiten bei Katzen?;Gesundheit von Katzen;"Definition: Katzenschnupfen ist eine der häufigsten Katzenkrankheiten. Es handelt sich um eine Infektionskrankheit; die Entzündungen hauptsächlich im Bereich der Augen und Atemwege hervorruft. Behandlung: In der Regel wird Katzenschnupfen mit Antibiotika behandelt. 3 Jun 2019";"https://tractive.com/blog/de/gesundheit/die-10-haeufigsten-katzenkrankheiten#:~:text=Definition%3A%20Katzenschnupfen%20ist%20eine%20der;der%20Augen%20und%20Atemwege%20hervorruft.&text=Behandlung%3A%20In%20der%20Regel%20wird%20Katzenschnupfen%20mit%20Antibiotika%20behandelt.";Die 10 häufigsten Katzenkrankheiten - Symptome & Behandlung - Tractive
Was ist der größte Liebesbeweis einer Katze?;Wie erkenne ich ob meine Katze gesund ist?;"Schlafen auf dem Schoß     Manche Katzen haben eine Vorliebe dafür sich auf Schoß; Brust oder Bauch ihres Menschen zu legen; sobald sich die Möglichkeit dazu ergibt. Dieses Verhalten ist ein tiefer Vertrauensbeweis und ein klares Zeichen von Liebe.";"https://happycat.de/magazin/katzenwissen/was-ist-der-groesste-liebesbeweis-einer-katze/#:~:text=Schlafen%20auf%20dem%20Scho%C3%9F;ein%20klares%20Zeichen%20von%20Liebe.";Was ist der größte Liebesbeweis einer Katze? - Happy Cat
Was braucht eine Katze um glücklich zu sein?;Wie erkenne ich ob meine Katze gesund ist?;"   Außerdem braucht Ihre Katze zu ihrem Glück einen Kratzbaum; um ihre Krallen zu wetzen und ihr ganz individuelles Duftsignal setzen zu können; sowie einen oder mehrere zugluftgeschütze Rückzugsorte wie beispielsweise ein Katzenhäuschen. Je nach Rasse oder Wesen braucht die Katze mehr oder weniger Freigang.";"https://www.zooplus.de/magazin/katze/katzenhaltung/10-zeichen-dass-ihre-katze-gluecklich-ist#:~:text=Au%C3%9Ferdem%20braucht%20Ihre%20Katze%20zu;Katze%20mehr%20oder%20weniger%20Freigang.";Ist meine Katze glücklich? - Zooplus
Was ist das Wichtigste für eine Katze?;Was braucht eine Katze um gesund zu bleiben?;"   Die Erstausstattung einer Katze sollte alles umfassen; was für die Nahrungsaufnahme; das stille Örtchen; Schlafen und Ausruhen; ausgiebiges Spielen und Klettern; die Fellpflege sowie für Fahrten mit dem Auto oder öffentlichen Verkehrsmitteln benötigt wird.";"https://www.purina.de/artikel/katzen/kaetzchen/aufnahme/erstausstattung-katze#:~:text=Die%20Erstausstattung%20einer%20Katze%20sollte;oder%20%C3%B6ffentlichen%20Verkehrsmitteln%20ben%C3%B6tigt%20wird.";Erstausstattung für deine Katze: Infos & Checkliste - PURINA
Was ist das beste Essen für Katzen?;Was braucht eine Katze um gesund zu bleiben?;"Huhn; Pute; Rind oder Fisch fressen Katzen besonders gerne. Hochwertiges Katzenfutter sollte natürlich nicht nur gesund sein; sondern auch gut schmecken! Manche Katze isst lieber Fisch; die andere lieber Huhn: Am besten lässt sich ihre Vorliebe einfach durch Ausprobieren herausfinden.";"https://www.purina.de/artikel/katzen/fuettern/was-katzen-fressen/was-essen-katzen#:~:text=Huhn%2C%20Pute%2C%20Rind%20oder%20Fisch;Vorliebe%20einfach%20durch%20Ausprobieren%20herausfinden.";Was essen Katzen? Katzen richtig füttern - PURINA
Sind Katzen traurig wenn man sie abgibt?;Was braucht eine Katze um gesund zu bleiben?;"   Trauern Katzen bei Besitzerwechsel? Nicht selten kommt es vor; dass eine Katze ihren Bezugsmenschen verliert. Vielleicht stirbt er oder kommt in ein Altenheim; in dem Tiere nicht erlaubt sind. Vielleicht wird die Mieze aber auch nur abgegeben und landet im Tierheim.";"https://www.josera.de/ratgeber/ratgeber-katzen/trauer-katze.html#:~:text=Auseinandersetzungen%20mit%20sich.-;Trauern%20Katzen%20bei%20Besitzerwechsel%3F;abgegeben%20und%20landet%20im%20Tierheim.";"Katzen haben Gefühle ; dazu zählt auch die Trauer - Josera"
Was bedeutet es wenn die Katze bei einem im Bett schläft?;Haben Katzen heilende Kräfte?;"   Was dafür spricht: Nicht nur die Katze findet diese gemeinsamen Stunden kuschelig und entspannend; sondern auch der Mensch. Die Körperwärme und das Schnurren lassen uns zur Ruhe kommen; helfen uns; das Gedankenkarussell abzustellen und so leichter in den Schlaf zu finden.";"https://www.aquatop-aachen.de/katzen-schlafen-im-bett#:~:text=Was%20daf%C3%BCr%20spricht%3A%20Nicht%20nur;in%20den%20Schlaf%20zu%20finden.";Katzen schlafen im Bett - Aquatop Aachen
Was bedeutet es wenn meine Katze auf mir schläft?;Haben Katzen heilende Kräfte?;"   Katzen lieben Wärme! Sie können ganze Tage im Freien verdösen und die wärmenden Sonnenstrahlen genießen. Wenn es Abend wird; braucht sie eine andere Wärmequelle – und da kommst du gerade richtig. Wenn sie auf dir liegt; ist das super bequem (zumindest für deine Katze) und du hilfst ihr; ihre Körpertemperatur zu halten.";"https://blog.feliway.com/de/darum-liegt-deine-katze-so-gerne-auf-dir#:~:text=Katzen%20lieben%20W%C3%A4rme!;ihr%2C%20ihre%20K%C3%B6rpertemperatur%20zu%20halten.";Darum liegt deine Katze so gerne auf dir... - FELIWAY Blog
Können Katzen Liebe spüren?;Haben Katzen heilende Kräfte?;"   Studien zeigen: Katzen können Menschen lieben     Wissenschaftler haben herausgefunden; dass Katzen uns sehr wohl auf gewisse Weise lieben. Denn Katzen können zu ihren Besitzern eine ähnliche Bindung aufbauen; wie Kinder zu ihren Eltern. Das zeigte eine Studie der Oregon State University. Katzen sind also anhänglich. 6 Feb 2023";"https://herz-fuer-tiere.de/haustiere/katzen/verhalten-von-katzen/so-zeigen-uns-katzen-ihre-liebe#:~:text=Studien%20zeigen%3A%20Katzen%20k%C3%B6nnen%20Menschen%20lieben;-Viele%20Katzenhalter%20fragen&text=Wissenschaftler%20haben%20herausgefunden%2C%20dass%20Katzen;Katzen%20sind%20also%20anh%C3%A4nglich.";So zeigen uns Katzen ihre Liebe | herz-fuer-tiere.de
Was ist die schlimmste Krankheit bei Katzen?;Was sind die häufigsten Krankheiten bei Katzen?;"Die chronische Niereninsuffizienz     Vor allem ältere Katzen sind von der Niereninsuffizienz; kurz CNI; betroffen. Hierbei handelt es sich um eine sehr gefährliche Krankheit für die Tiere; welche leider in den meisten Fällen nach und nach zum Tod der Katzen führt.";"https://www.zoobio.de/blog/die-10-haufigsten-krankheiten-bei-katzen-mit-ihren-symptomen-1047#:~:text=von%20W%C3%BCrmern%20m%C3%B6glich.-;Die%20chronische%20Niereninsuffizienz;zum%20Tod%20der%20Katzen%20f%C3%BChrt.";Die 10 häufigsten Krankheiten bei Katzen mit ihren Symptomen
Kann eine Katze weinen?;Was sind die häufigsten Krankheiten bei Katzen?;"   Ebenso wie Menschen können Katzen durchaus weinen und auch Emotionen empfinden. Allerdings besteht zwischen der Träne und dem Gefühl kein Zusammenhang; denn Katzen drücken ihre Emotionen anders aus. 23 Feb 2022";"https://www.agila.de/agila-magazin/3113-koennen-katzen-weinen#:~:text=Ebenso%20wie%20Menschen%20k%C3%B6nnen%20Katzen;dr%C3%BCcken%20ihre%20Emotionen%20anders%20aus.";Können Katzen weinen? - AGILA
Was ist die häufigste Todesursache bei Katzen?;Was sind die häufigsten Krankheiten bei Katzen?;"   Was ist die häufigste Todesursache bei Katzen? Häufigste Todesursachen bei Katzen über 5 Jahren sind Nierenerkrankungen; dicht gefolgt von Verkehrsunfällen.";"https://www.helvetia.com/de/web/de/ratgeber/tiere/katzen/katzenversicherung/wie-alt-werden-katzen.html#:~:text=zu%2020%20Jahren-;Was%20ist%20die%20h%C3%A4ufigste%20Todesursache%20bei%20Katzen%3F;Nierenerkrankungen%2C%20dicht%20gefolgt%20von%20Verkehrsunf%C3%A4llen.";Wie alt werden Katzen? Lebenserwartung ermitteln | Helvetia
Wie sagen Katzen danke?;Was ist der größte Liebesbeweis einer Katze?;"3. Gurren. Es ist ein kurzer; weicher Laut; der sich fast wie ein stimmhaftes Zungenspitzen-R anhört; also ""mrrrh"" oder ""brrrh"". Es ist die freundliche Art der Katze; einmal Danke zu sagen.";"https://www.bildderfrau.de/familie-leben/haustiere/article206411083/Katzensprache-verstehen.html#:~:text=3.;Katze%2C%20einmal%20Danke%20zu%20sagen.";Katzensprache verstehen: Die Bedeutung von Lauten und Verhalten
Wie sagt man Katze ich Liebe dich?;Was ist der größte Liebesbeweis einer Katze?;"   Ihre geliebte Mitbewohner—Mieze blinzelt Sie mit beiden Augen an. Das entspricht Küssen mit den Augen und heißt so viel wie: „Ich liebe Dich. “ Wenn Sie Ihrer Katze ein Lächeln in Katzensprache schenken möchten; blinzeln auch Sie ihr einfach mit beiden Augen zu. Ihre Katze wird das verstehen.";"https://www.zooplus.de/magazin/katze/katzenhaltung/liebt-meine-katze-mich-10-zeichen-die-es-beweisen#:~:text=Ihre%20geliebte%20Mitbewohner%E2%80%94Mieze%20blinzelt;Ihre%20Katze%20wird%20das%20verstehen.";"Liebt meine Katze mich? 10 Zeichen; die es beweisen | zooplus Magazin"
Wie reagieren Katzen wenn man weint?;Was ist der größte Liebesbeweis einer Katze?;"Feingespür: Katzen sind sehr sensible Tiere und haben ein gutes Einfühlungsvermögen für ihren Menschen. So spüren sie zum Beispiel Traurigkeit; Kummer oder Krankheit und schenken ihren Menschen in solchen Situationen mehr Aufmerksamkeit und Zuneigung. Katzenschnurren soll auch noch eine weitere heilende Wirkung haben. 24 Jan 2020";"https://blog.shelta.tasso.net/katzen-und-ihre-therapeutische-wirkung-auf-den-menschen/#:~:text=Feingesp%C3%BCr%3A%20Katzen%20sind%20sehr%20sensible;Situationen%20mehr%20Aufmerksamkeit%20und%20Zuneigung.&text=Katzenschnurren%20soll%20auch%20noch%20eine%20weitere%20heilende%20Wirkung%20haben.";Katzen und ihre therapeutische Wirkung auf den Menschen
Warum guckt meine Katze mich immer an?;Was braucht eine Katze um glücklich zu sein?;"Katzen; die Sie mit ihrem Blick fixieren und anstarren; sind aufmerksam. Starrt die Katze etwas mit einem fixierten Blick an; bedeutet dies zunächst vor allem; dass sie sich vollkommen auf das Objekt konzentriert. Für sie als Jäger zahlt sich dieses Verhalten in der Natur aus. 28 Oct 2019";"https://www.miamor.de/magazin/katze-starrt-mich-an#:~:text=beim%20Anstarren%20g%C3%A4hnen-;Katzen%2C%20die%20Sie%20mit%20ihrem%20Blick%20fixieren%20und%20anstarren%2C%20sind;Verhalten%20in%20der%20Natur%20aus.";Meine Katze starrt mich an – was bedeutet das?
Was machen Katzen wenn ihnen langweilig ist?;Was braucht eine Katze um glücklich zu sein?;"   Tipps gegen Langeweile bei Katzen Stelle Regale; Leitern und Klettermöglichkeiten zur Verfügung. ...  Gib ihnen einen Umzugskarton zum Spielen. ...  Wenn Deine Katzen reine Wohnungskatzen sind; solltest Du ihnen die Möglichkeit geben; auf den Balkon zu gehen. ...  Fülle Papprollen mit Leckerlis und verschließe diese mit einem Deckel. More items...";https://www.leonardo-catfood.de/pfotentipps/freizeit/katze-beschaeftigen;5 Tipps gegen Langeweile bei Katzen | LEONARDO®
Wie schläft eine Katze wenn sie sich wohl fühlt?;Was braucht eine Katze um glücklich zu sein?;"   Sie liegt beim Schlafen wie ""Pik-Sieben""     Sie liegt auf dem Rücken; hat vielleicht noch die Pfoten in alle Himmelsrichtungen von sich gestreckt? Diese Schlafposition ist schon ein eindeutiger Hinweis; dass es der Katze gut geht; dass sie sich wohlfühlt und trotz Ihrer Anwesenheit keine unsicheren Gefühle hegt. 11 Jun 2021";"https://herz-fuer-tiere.de/haustiere/katzen/verhalten-von-katzen/7-zeichen-dass-sich-ihre-katze-wohlfuehlt#:~:text=Sie%20liegt%20beim%20Schlafen%20wie%20%22Pik%2DSieben%22&text=Sie%20liegt%20auf%20dem%20R%C3%BCcken;Anwesenheit%20keine%20unsicheren%20Gef%C3%BChle%20hegt.";"7 Zeichen; dass sich Ihre Katze wohlfühlt | herz-fuer-tiere.de"
Wo schläft eine Katze am liebsten?;Was ist das Wichtigste für eine Katze?;"Manche Katzen lieben erhöhte Schlafplätze; andere verkriechen sich lieber in einer Höhle am Boden. Manche Katzen mögen es warm und kuschelig; wie in einem Bett oder dem Sofa; andere bevorzugen kühlende Fliesen.";"https://portapet.de/meine-katze-und-ich/der-richtige-schlafplatz-fuer-deine-katze/#:~:text=Manche%20Katzen%20lieben%20erh%C3%B6hte%20Schlafpl%C3%A4tze;Sofa%2C%20andere%20bevorzugen%20k%C3%BChlende%20Fliesen.";Der richtige Schlafplatz für Deine Katze - PortaPet
Kann man eine Katze 1 Woche alleine lassen?;Was ist das Wichtigste für eine Katze?;"Grundsätzlich wird empfohlen; eine Katze niemals mehr als 2 Tage völlig alleine zu lassen. Wenn du länger als 2 Tage unterwegs bist; dann solltest du nach Alternativen suchen oder eine Betreuung finden; die 2x täglich nach deiner Katze sieht. 22 Jun 2019";"https://tractive.com/blog/de/sicherheit/wie-lange-katze-alleine-lassen#:~:text=Grunds%C3%A4tzlich%20wird%20empfohlen%2C%20eine%20Katze;t%C3%A4glich%20nach%20deiner%20Katze%20sieht.";Wie lange kannst du eine Katze alleine lassen? - Tractive
Was die Katzen nicht mögen?;Was ist das Wichtigste für eine Katze?;"   Welche Gerüche mögen Katzen nicht? Katzen mögen den Geruch von Zitrusfrüchten; Weinraute; Lavendel; Essig und Zwiebeln nicht. Auch Naphthalin; Paprika; Zimt und der Geruch einer schmutzigen Katzentoilette sind ihnen zuwider. 31 May 2022";"https://zooland.com.de/WELCHE-DUFTE-MOGEN-KATZEN-NICHT-5-DUFTE-DIE-DIE-KATZEN-ERSCHRECKEN-blog-ger-1653979873.html#:~:text=Welche%20Ger%C3%BCche%20m%C3%B6gen%20Katzen%20nicht;schmutzigen%20Katzentoilette%20sind%20ihnen%20zuwider.";"WELCHE DÜFTE MÖGEN KATZEN NICHT? 5 DÜFTE; DIE ... - Zooland"
Was dürfen Katzen auf jeden Fall nicht essen?;Was ist das beste Essen für Katzen?;"Von A- Z: Lebensmittel; die für Katzen giftig und tödlich sind: Alkohol. ...  Avocado. ...  Brotteig und hefehaltige Teige. ...  Energydrinks; Cola; Kaffee; Tee. ...  Fettränder. ...  Hundefutter. ...  Kakao und kakaohaltige Lebensmittel wie Schokolade. ...  Knoblauch; Porree; Schnittlauch; Zwiebeln (roh; gekocht; als Pulver) More items... • 19 Jan 2021";https://www.stallbedarf24.de/ratgeber/20-toedliche-und-giftige-lebensmittel-fuer-katzen/;20 tödliche und giftige Lebensmittel für Katzen | Stallbedarf24 Ratgeber
Was trinken die Katzen?;Was ist das beste Essen für Katzen?;"   Viele Katzen bevorzugen laufendes Wasser. Samtpfotigen Trinkmuffeln kann die Flüssigkeitsaufnahme mithilfe eines Trinkbrunnes schmackhaft gemacht werden. Dieser sorgt für fließendes; kühles Wasser zu jeder Zeit und macht Lust auf einen frischen Schluck.";"https://www.futterhaus.de/r/trinkverhalten-bei-katzen/#:~:text=Viele%20Katzen%20bevorzugen%20laufendes%20Wasser;Lust%20auf%20einen%20frischen%20Schluck.";Das Trinkverhalten der Katzen | DAS FUTTERHAUS
Kann ich meiner Katze Joghurt geben?;Was ist das beste Essen für Katzen?;"Eigelb; Quark oder Joghurt schmecken Katzen richtig gut und stellen zusätzliche Quellen für Proteine und Vitamine; aber auch für Kalzium dar. Die Zugabe von etwas Fleischsud erhöht den Wassergehalt des Futters.";"https://www.gu.de/gesunde-katzenernaehrung/#:~:text=Eigelb%2C%20Quark%20oder%20Joghurt%20schmecken;erh%C3%B6ht%20den%20Wassergehalt%20des%20Futters.";Gesunde Katzenernährung - GU Verlag
Können sich Katzen an ihre früheren Besitzer erinnern?;Sind Katzen traurig wenn man sie abgibt?;"Das Ergebnis: Die Katzen konnten die Stimmen auseinanderhalten und reagierten deutlich auf die Stimmen ihrer Halter. Genau wie andere Säugetiere haben Katzen ein Gedächtnis und erinnern sich an Dinge; die sie in der Vergangenheit gelernt haben.";"https://www.miamor.de/magazin/erkennen-katzen-ihre-besitzer#:~:text=Das%20Ergebnis%3A%20Die%20Katzen%20konnten;auf%20die%20Stimmen%20ihrer%20Halter.&text=Genau%20wie%20andere%20S%C3%A4ugetiere%20haben;in%20der%20Vergangenheit%20gelernt%20haben.";Erkennen Katzen ihre Besitzer? | Miamor
Kann eine Katze beleidigt sein?;Sind Katzen traurig wenn man sie abgibt?;"Auch Katzen können schmollen und beleidigt sein; wenn ihnen etwas nicht passt und sie sich unwohl fühlen. Die Gründe sowie die Art; wie sich das Schmollen äußert; sind aber sehr unterschiedlich. 24 Aug 2015";"https://herz-fuer-tiere.de/haustiere/katzen/verhalten-von-katzen/warum-katzen-schmollen#:~:text=Auch%20Katzen%20k%C3%B6nnen%20schmollen%20und;%C3%A4u%C3%9Fert%2C%20sind%20aber%20sehr%20unterschiedlich.";Warum Katzen schmollen | herz-fuer-tiere.de
Können sich Katzen Gesichter merken?;Sind Katzen traurig wenn man sie abgibt?;"Das Ergebnis war erstaunlich: Die Stubentiger haben ein feines Gespür für die menschlichen Emotionen und handeln sogar danach – ähnlich wie Hunde. Dabei orientieren sie sich an Stimme; Mimik und Bewegung. Dies in Kombination mit dem Aussehen und dem Geruch und die Katze erkennt ihre Lieblingsmenschen zweifelsfrei.";"https://www.tierwelt.ch/artikel/katzen/woran-das-busi-seinen-menschen-erkennt-407651#:~:text=Das%20Ergebnis%20war%20erstaunlich%3A%20Die;Katze%20erkennt%20ihre%20Lieblingsmenschen%20zweifelsfrei.";Woran das Büsi seinen Menschen erkennt - tierwelt.ch
Was denkt meine Katze Wenn ich sie küsse?;Was bedeutet es wenn die Katze bei einem im Bett schläft?;"Katzen mögen es nicht mit feuchten Lippen abgeküsst zu werden. Wenn sie dabei noch festgehalten werden; heißt das nicht; es gefällt der Katze. Sie duldet es nur; weil sie nicht wegkann. Ständig geküsste Katzen rechnen immer mit einer neuen Kussattacke.";"https://www.schlappohr.de/tiere/aus-diesem-grund-moechten-katzen-nicht-gekuesst-werden#:~:text=Katzen%20m%C3%B6gen%20es%20nicht%20mit;immer%20mit%20einer%20neuen%20Kussattacke.";Aus diesem Grund möchten Katzen nicht geküsst werden! - Schlappohr
Kann eine Katze Fernsehen?;Was bedeutet es wenn die Katze bei einem im Bett schläft?;"   Generell ist es so; dass Haustiere wie Hunde und Katzen die Fähigkeit zum Fernsehen haben. Allerdings dürfen Sie nur mit einer Reaktion rechnen; wenn die Fernsehbilder aus einer ihnen vertrauten Perspektive aufgenommen wurden. Auch ist es wichtig; dass für Vierbeiner relevante Dinge; wie Artgenossen; abgebildet sind.";"https://www.experience.panasonic.de/tv-audio/koennen-tiere-fernsehen-gemeinsame-fernsehzeit-mit-dem-vierbeiner#:~:text=Generell%20ist%20es%20so%2C%20dass;%2C%20wie%20Artgenossen%2C%20abgebildet%20sind.";Können Tiere fernsehen? Gemeinsame Fernsehzeit mit dem ...
Kann sich eine Katze im Spiegel sehen?;Was bedeutet es wenn die Katze bei einem im Bett schläft?;"   Schimpansen und Elstern wird nachgesagt; dass sie sich selbst in ihrem Spiegelbild erkennen; doch Katzen scheinen diese Fähigkeit nicht zu besitzen. Zumindest fallen die Samtpfoten beim sogenannten Spiegeltest regelmäßig durch.";"https://einfachtierisch.de/katzen/katzenhaltung/selbstbild-koennen-katzen-sich-im-spiegel-erkennen-91991#:~:text=Schimpansen%20und%20Elstern%20wird%20nachgesagt;beim%20sogenannten%20Spiegeltest%20regelm%C3%A4%C3%9Fig%20durch.";Selbstbild: Können Katzen sich im Spiegel erkennen?
Wie kann ich meiner Katze zeigen dass ich sie lieb habe?;Was bedeutet es wenn meine Katze auf mir schläft?;"   8 Möglichkeiten um “Ich liebe dich” in Katzensprache zu sagen Streichel deine Katze da; wo sie es am liebsten mag. ...  Spiele mit deiner Katze; bis sie müde ist. ...  Biete deiner Katze ein Versteck. ...  Setze auf das langsame Blinzeln. ...  Mach mit beim Kopfstupser. ...  Erlaube deiner Katze; dich zu beschnuppern und abzulecken. More items...";https://www.rover.com/de/blog/8-moeglichkeiten-um-ich-liebe-dich-in-katzensprache-zu-sagen/;8 Möglichkeiten um “Ich liebe dich” in Katzensprache zu sagen - Rover
Warum beißen Katzen nach dem Streicheln?;Was bedeutet es wenn meine Katze auf mir schläft?;"Dieses Beißverhalten deiner Katze ist vollkommen instinktiv; Katzen nutzen diese Art der Kommunikation etwa beim Paarungsverhalten. Wenn dich deine Katze beim Schmusen oder Streicheln mal ganz leicht beißt; brauchst du dir also keine Sorgen zu machen. 17 Jun 2022";"https://www.petsdeli.de/magazin/katzen/katze-erziehung/warum-beisst-meine-katze-liebe-oder-aggression#:~:text=Dieses%20Bei%C3%9Fverhalten%20deiner%20Katze%20ist;also%20keine%20Sorgen%20zu%20machen.";Warum beißt meine Katze - Liebe oder Aggression? - Pets Deli
Wie schnell vergessen Katzen ihre Besitzer?;Was bedeutet es wenn meine Katze auf mir schläft?;"   Es kann durchaus sein; dass deine Katze dich vermisst; wenn du nicht zuhause bist. Besonders; wenn ihr beide eine sehr enge Bindung hat oder du längere Zeit außer Haus bist. Natürlich ist die Beziehung zwischen Mensch und Katze immer sehr individuell. Manche Tiere vermissen ihre Besitzer deutlich mehr als andere. 1 Jul 2022";"https://catinaflat.de/blog/vermisst-mich-meine-katze-wenn-ich-nicht-zuhause-bin#:~:text=Es%20kann%20durchaus%20sein%2C%20dass;Besitzer%20deutlich%20mehr%20als%20andere.";"Vermisst mich meine Katze; wenn ich nicht Zuhause bin? - Cat in a flat"
Wie zeigt eine Katze das sie traurig ist?;Können Katzen Liebe spüren?;"   Folgende Anzeichen deuten darauf hin; dass die Katze traurig ist: Klagendes; lautes; ununterbrochenes Miauen bzw. Schreien. Schnelle; unkontrollierte Bewegungen mit dem Schwanz. 14 Apr 2022";"https://www.weekend.at/lifestyle/haustiere/katze-ist-traurig-gruende#:~:text=Folgende%20Anzeichen%20deuten%20darauf%20hin;unkontrollierte%20Bewegungen%20mit%20dem%20Schwanz";"Wie erkenne ich; dass meine Katze traurig ist? - Weekend Magazin"
Können Katzen gute Menschen erkennen?;Können Katzen Liebe spüren?;"FAQ zu Katzen spüren gute Menschen    Nein; Katzen sind nicht in der Lage; Böses von Gutem zu unterscheiden. Sie reagieren jedoch auf die Energie einer Person und entscheiden sich entsprechend für oder gegen Kontakt.";"https://www.haustierratgeber.de/katzen/katzen-gespuer-menschen/#:~:text=FAQ%20zu%20Katzen%20sp%C3%BCren%20gute%20Menschen;-K%C3%B6nnen%20Katzen%20wirklich&text=Nein%2C%20Katzen%20sind%20nicht%20in;entsprechend%20f%C3%BCr%20oder%20gegen%20Kontakt.";Katzen spüren gute Menschen: was ist an der Behauptung dran?
Kann eine Katze frieren?;Können Katzen Liebe spüren?;"   Frieren Katzen im Winter? Trotz Pelzmantel – auch Katzen können frieren. Wie viel Kälte eine Katze aushält; hängt auch von Verfassung; Alter; Gesundheit und Gewicht ab. Freigänger mit dichtem Winterfell trotzen Eis und Schnee eher; als Stubentiger mit gelegentlicher Frischluftzufuhr.";"https://www.green-petfood.de/articles/katze-winter#:~:text=Hause%20bleiben%20sollte.-;Frieren%20Katzen%20im%20Winter%3F;als%20Stubentiger%20mit%20gelegentlicher%20Frischluftzufuhr.";Katze im Winter: Heiße Tipps für kalte Tage - Green Petfood
Wie verhält sich eine Katze die krank ist?;Was ist die schlimmste Krankheit bei Katzen?;"   Wie erkennt man; dass die Katze krank ist? Wenn Katzen krank sind; ziehen sie sich oft zurück; manche verhalten sich aber auch plötzlich gereizt und aggressiv; um ihre Schwäche zu kaschieren. Besonders häufige Anzeichen dafür; dass deine Katze krank ist; sind häufiges Trinken und weniger Appetit.";"https://www.purina.de/artikel/katzen/gesundheit/symptome/katzenkrankheiten#:~:text=Wie%20erkennt%20man%2C%20dass%20die;h%C3%A4ufiges%20Trinken%20und%20weniger%20Appetit.";Katzenkrankheiten – Welche gibt es? - Symptome - PURINA
Wie wirkt sich Corona bei Katzen aus?;Was ist die schlimmste Krankheit bei Katzen?;"Eine Corona-Infektion äußere sich bei Katzen ähnlich wie beim Menschen. Einige infizierte Katzen zeigten gar keine Symptome; während andere unter Appetitlosigkeit; Durchfall; Erbrechen; Husten oder flacher Atmung litten. 12 Feb 2021";"https://www.apotheken-umschau.de/krankheiten-symptome/infektionskrankheiten/coronavirus/bei-covid-19-nicht-mit-der-katze-schmusen-768321.html#:~:text=Eine%20Corona%2DInfektion%20%C3%A4u%C3%9Fere%20sich;Husten%20oder%20flacher%20Atmung%20litten.";Bei Covid-19 nicht mit der Katze schmusen | Apotheken Umschau
Wie erkennt man eine kranke Katze?;Was ist die schlimmste Krankheit bei Katzen?;"Sobald man bei seiner Katze Anzeichen für eine Erkrankung feststellt; sollte man unbedingt zum Tierarzt. Symptome für eine mögliche Krankheit können zum Beispiel übermäßiges Trinken; häufiges Urinieren oder Durchfall und Erbrechen sein. Aber auch auffällige Verhaltensänderungen lassen auf eine Krankheit schließen. 17 Aug 2022";"https://www.deutsche-familienversicherung.de/tierkrankenversicherung/katzenkrankenversicherung/ratgeber/artikel/katzenkrankheiten-wissenswertes-und-tipps-fuer-katzenhalter/#:~:text=Sobald%20man%20bei%20seiner%20Katze;lassen%20auf%20eine%20Krankheit%20schlie%C3%9Fen.";Katzenkrankheiten: Woran erkennt man sie?
