Was ist die häufigste Todesursache bei Katzen?;Was ist die schlimmste Krankheit bei Katzen?;"   Was ist die häufigste Todesursache bei Katzen? Häufigste Todesursachen bei Katzen über 5 Jahren sind Nierenerkrankungen; dicht gefolgt von Verkehrsunfällen.";"https://www.helvetia.com/de/web/de/ratgeber/tiere/katzen/katzenversicherung/wie-alt-werden-katzen.html#:~:text=zu%2020%20Jahren-;Was%20ist%20die%20h%C3%A4ufigste%20Todesursache%20bei%20Katzen%3F;Nierenerkrankungen%2C%20dicht%20gefolgt%20von%20Verkehrsunf%C3%A4llen.";Wie alt werden Katzen? Lebenserwartung ermitteln | Helvetia
Was mögen Katzen ganz besonders?;Was Katzen gar nicht mögen?;"   Huhn; Pute; Rind oder Fisch fressen Katzen besonders gerne. Hochwertiges Katzenfutter sollte natürlich nicht nur gesund sein; sondern auch gut schmecken! Manche Katze isst lieber Fisch; die andere lieber Huhn: Am besten lässt sich ihre Vorliebe einfach durch Ausprobieren herausfinden.";"https://www.purina.de/artikel/katzen/fuettern/was-katzen-fressen/was-essen-katzen#:~:text=Huhn%2C%20Pute%2C%20Rind%20oder%20Fisch;Vorliebe%20einfach%20durch%20Ausprobieren%20herausfinden.";Was essen Katzen? Katzen richtig füttern - PURINA
Kann eine Katze einen Menschen lieben?;Was Katzen gar nicht mögen?;"   Katzen können verschmust und verspielt sein. Vor allem aber gelten sie als unabhängig und eigenständig – ganz im Gegensatz zu Hunden! Eine neue Studie zeigt nun; dass Katzen viel beziehungsfähiger sind als bisher angenommen. Sie binden sich ähnlich an ihre Besitzer wie Kleinkinder an ihre Eltern. 27 Sept 2019";"https://www.mdr.de/wissen/katzen-katzenpsychologie-katzenbesitzer-100.html#:~:text=Katzen%20k%C3%B6nnen%20verschmust%20und%20verspielt;wie%20Kleinkinder%20an%20ihre%20Eltern.";Katzen: Auch sie lieben ihre Besitzer | MDR.DE
Was riechen Katzen am liebsten?;Was Katzen gar nicht mögen?;"Katzenminze; Baldrian und was Katzen noch gerne riechen    Doch es gibt einige Dauerbrenner unter den Katzen-Lieblingsdüften: allen voran die beiden bekannten Duftspender Katzenminze und Baldrian; die in vielen Katzenprodukten zum Einsatz kommen. Beide Pflanzen haben eine euphorisierende Wirkung auf Katzen. 1 Dec 2022";"https://www.fressnapf.at/magazin/katze/spielen-trainieren/katzenminze/#:~:text=Katzenminze%2C%20Baldrian%20und%20was%20Katzen%20noch%20gerne%20riechen;-Katzen%20sind%20Individualisten&text=Doch%20es%20gibt%20einige%20Dauerbrenner;eine%20euphorisierende%20Wirkung%20auf%20Katzen.";Von Lavendel bis Katzenminze – Was Katzen gerne riechen und was nicht
Kann eine Katze Fernsehen?;Sollte man Katzen beim schlafen zudecken?;"   Generell ist es so; dass Haustiere wie Hunde und Katzen die Fähigkeit zum Fernsehen haben. Allerdings dürfen Sie nur mit einer Reaktion rechnen; wenn die Fernsehbilder aus einer ihnen vertrauten Perspektive aufgenommen wurden. Auch ist es wichtig; dass für Vierbeiner relevante Dinge; wie Artgenossen; abgebildet sind.";"https://www.experience.panasonic.de/tv-audio/koennen-tiere-fernsehen-gemeinsame-fernsehzeit-mit-dem-vierbeiner#:~:text=Generell%20ist%20es%20so%2C%20dass;%2C%20wie%20Artgenossen%2C%20abgebildet%20sind.";Können Tiere fernsehen? Gemeinsame Fernsehzeit mit dem ...
Was denkt meine Katze Wenn ich sie küsse?;Sollte man Katzen beim schlafen zudecken?;"Katzen mögen es nicht mit feuchten Lippen abgeküsst zu werden. Wenn sie dabei noch festgehalten werden; heißt das nicht; es gefällt der Katze. Sie duldet es nur; weil sie nicht wegkann. Ständig geküsste Katzen rechnen immer mit einer neuen Kussattacke.";"https://www.schlappohr.de/tiere/aus-diesem-grund-moechten-katzen-nicht-gekuesst-werden#:~:text=Katzen%20m%C3%B6gen%20es%20nicht%20mit;immer%20mit%20einer%20neuen%20Kussattacke.";Aus diesem Grund möchten Katzen nicht geküsst werden! - Schlappohr
Warum wollen Katzen mit ins Bad?;Sollte man Katzen beim schlafen zudecken?;"Katzen sind neugierig was du im Badezimmer tust     Katzen sind von Natur aus sehr neugierige Wesen. Sie erkunden ihr Zuhause gern und wollen wissen; was um sie herum geschieht. Verschlossene Türen sind für viele Katzen gerade erst der Grund; warum sie in das geschlossene Zimmer gelangen wollen. 22 Sept 2021";"https://catinaflat.de/blog/warum-kommt-meine-katze-mit-ins-badezimmer#:~:text=Katzen%20sind%20neugierig%20was%20du;das%20geschlossene%20Zimmer%20gelangen%20wollen.";Warum kommt meine Katze immer mit ins Badezimmer? - Cat in a flat
Wie zeigt eine Katze das sie traurig ist?;Was spüren Katzen bei Menschen?;"   Folgende Anzeichen deuten darauf hin; dass die Katze traurig ist: Klagendes; lautes; ununterbrochenes Miauen bzw. Schreien. Schnelle; unkontrollierte Bewegungen mit dem Schwanz. 14 Apr 2022";"https://www.weekend.at/lifestyle/haustiere/katze-ist-traurig-gruende#:~:text=Folgende%20Anzeichen%20deuten%20darauf%20hin;unkontrollierte%20Bewegungen%20mit%20dem%20Schwanz";"Wie erkenne ich; dass meine Katze traurig ist? - Weekend Magazin"
Können Katzen riechen ob man krank ist?;Was spüren Katzen bei Menschen?;"Katzen sind ausgesprochen sensible und feinfühlige Tiere. Wenn ein Mensch krank ist; spüren sie es und legen sich zu ihm. Oft erstaunlicherweise genau dorthin; wo das geliebte Frauchen oder Herrchen Schmerzen hat.";"https://www.sos-samtpfoten-nordwest.de/was_katze_geben_kann.html#:~:text=Katzen%20sind%20ausgesprochen%20sensible%20und;Frauchen%20oder%20Herrchen%20Schmerzen%20hat.";Was eine Katze dem Menschen geben kann S.O.S.
Kann eine Katze nachtragend sein?;Sind Katzen traurig wenn sie alleine sind?;"Katzen sind sensibel und nachtragend. Sie reagieren auf die Veränderung ihrer Lebensumstände mit Verärgerung und Rückzug. Katzen sind sehr sensible Gewohnheitstiere; die auf die geringsten Veränderungen bei ihren Lebensumständen mit Verhaltensänderungen reagieren können.";"https://www.petdoctors.at/katze/verhalten-ausbildung/wenn-katzen-schmollen#:~:text=Katzen%20sind%20sensibel%20und%20nachtragend;Lebensumst%C3%A4nden%20mit%20Verhaltens%C3%A4nderungen%20reagieren%20k%C3%B6nnen.";Wenn Katzen schmollen - petdoctors.at
Kann eine Katze ihren Besitzer vergessen?;Sind Katzen traurig wenn sie alleine sind?;"   Es kann durchaus sein; dass deine Katze dich vermisst; wenn du nicht zuhause bist. Besonders; wenn ihr beide eine sehr enge Bindung hat oder du längere Zeit außer Haus bist. Natürlich ist die Beziehung zwischen Mensch und Katze immer sehr individuell. Manche Tiere vermissen ihre Besitzer deutlich mehr als andere. 1 Jul 2022";"https://catinaflat.de/blog/vermisst-mich-meine-katze-wenn-ich-nicht-zuhause-bin#:~:text=Es%20kann%20durchaus%20sein%2C%20dass;Besitzer%20deutlich%20mehr%20als%20andere.";"Vermisst mich meine Katze; wenn ich nicht Zuhause bin? - Cat in a Flat"
Was ist der Feind der Hauskatze?;Was ist Tierquälerei bei Katzen?;"Katzen sind sehr eigenwillige Geschöpfe. ... Steckbrief. Name Hauskatze (Felis silvestris catus) Nahrung Mäuse; Vögel; Eidechsen Feinde Fuchs; Luchs; Wolf bei wildlebenden Katzen Gefährdung Autos 8 more rows";https://kiwithek.kidsweb.at/index.php/Katze;Katze - KiwiThek
Was ist der natürliche Feind von Katzen?;Was ist Tierquälerei bei Katzen?;"   Natürliche Feinde sind Luchs und Wolf; für junge Wildkatzen auch Uhu; Steinadler; Habicht; Fuchs und Marder.";"https://www.jagdverband.de/zahlen-fakten/tiersteckbriefe/wildkatze-felis-silvestris#:~:text=Nat%C3%BCrliche%20Feinde%20sind%20Luchs%20und;%2C%20Habicht%2C%20Fuchs%20und%20Marder.";Wildkatze (Felis silvestris) - Deutscher Jagdverband
Was bedeutet es wenn die Katze bei einem im Bett schläft?;Was für ein Duft mögen Katzen?;"Was dafür spricht: Nicht nur die Katze findet diese gemeinsamen Stunden kuschelig und entspannend; sondern auch der Mensch. Die Körperwärme und das Schnurren lassen uns zur Ruhe kommen; helfen uns; das Gedankenkarussell abzustellen und so leichter in den Schlaf zu finden.";"https://www.aquatop-aachen.de/katzen-schlafen-im-bett#:~:text=Was%20daf%C3%BCr%20spricht%3A%20Nicht%20nur;in%20den%20Schlaf%20zu%20finden.";Katzen schlafen im Bett - Aquatop Aachen
Was für Geräusche mögen Katzen nicht?;Was für ein Duft mögen Katzen?;"Welche Art von Musik mögen Katzen nicht? Laute Musik und harte Gitarren-; Bass- und Schlagzeugklänge hören Katzen nicht so gern. Sie haben ein noch feineres Gehör als Hunde. Laute; harte Klänge sind für die geräuschsensiblen Tiere zu hektisch und unangenehm.";"https://www.purina.de/artikel/katzen/verhalten/haeufige-fragen/musik-fuer-katzen#:~:text=Welche%20Art%20von%20Musik%20m%C3%B6gen%20Katzen%20nicht%3F&text=Laute%20Musik%20und%20harte%20Gitarren;Tiere%20zu%20hektisch%20und%20unangenehm.";Musik für Katzen: So beruhigend ist Musik | PURINA
Was ist tödlich für die Katze?;Wo sterben Katzen am liebsten?;"Rohe Kartoffeln; Auberginen und unreife Tomaten: Sind giftig für Katzen. Rohe Kartoffeln und Auberginen enthalten Solanin. Dieser Giftstoff schädigt die Schleimhäute von Katzen und kann zu Durchfall; Krämpfen und Atemlähmung bei Vierbeinern führen. 30 Nov 2022";"https://www.petsdeli.de/magazin/katzen/katze-gesundheit/giftig-fur-katzen#:~:text=Toxoplasmose%20belastet%20sein.-;Rohe%20Kartoffeln%2C%20Auberginen%20und%20unreife%20Tomaten%3A%20Sind%20giftig%20f%C3%BCr%20Katzen;und%20Ateml%C3%A4hmung%20bei%20Vierbeinern%20f%C3%BChren.";Giftig für Katzen: Was dürfen Katzen fressen und was nicht? - Pets Deli
Kann eine Katze weinen?;Wo sterben Katzen am liebsten?;"   Ebenso wie Menschen können Katzen durchaus weinen und auch Emotionen empfinden. Allerdings besteht zwischen der Träne und dem Gefühl kein Zusammenhang; denn Katzen drücken ihre Emotionen anders aus. 23 Feb 2022";"https://www.agila.de/agila-magazin/3113-koennen-katzen-weinen#:~:text=Ebenso%20wie%20Menschen%20k%C3%B6nnen%20Katzen;dr%C3%BCcken%20ihre%20Emotionen%20anders%20aus.";Können Katzen weinen? - AGILA
Was dürfen Katzen auf jeden Fall nicht essen?;Was ist das gesündeste Essen für Katzen?;"Von A- Z: Lebensmittel; die für Katzen giftig und tödlich sind: Alkohol. ...  Avocado. ...  Brotteig und hefehaltige Teige. ...  Energydrinks; Cola; Kaffee; Tee. ...  Fettränder. ...  Hundefutter. ...  Kakao und kakaohaltige Lebensmittel wie Schokolade. ...  Knoblauch; Porree; Schnittlauch; Zwiebeln (roh; gekocht; als Pulver) More items... • 19 Jan 2021";https://www.stallbedarf24.de/ratgeber/20-toedliche-und-giftige-lebensmittel-fuer-katzen/;20 tödliche und giftige Lebensmittel für Katzen | Stallbedarf24 Ratgeber
Sollten Katzen nachts raus?;Was ist das gesündeste Essen für Katzen?;   Gerade nachts sinken die Temperaturen im Winter nochmals deutlich herab. Deswegen solltest du deine Katze nachts nicht draußen lassen. Eine gesunde Freigänger-Katze kann ohne Bedenken bei kalten Temperaturen für kurze Zeit draußen streunen.;"https://www.purina.de/artikel/katzen/gesundheit/symptome/katze-winter#:~:text=Gerade%20nachts%20sinken%20die%20Temperaturen;f%C3%BCr%20kurze%20Zeit%20drau%C3%9Fen%20streunen.";Katzen im Winter: Pflege & Tipps - PURINA
Ist Quark für die Katzen gut?;Kann ich meiner Katze Joghurt geben?;"Prinzipiell ist Quark für Katzen nicht giftig und kann in kleinen Mengen als Ausnahme gegeben werden - selbstverständlich nur ungesüßt und ohne Aromastoffe oder sonstigen Zusätze. Viele Samtpfoten haben allerdings eine empfindliche Verdauung und so kann es sein; das dein Liebling Quark nicht so gut verträgt. 11 Oct 2022";"https://www.petsdeli.de/magazin/katzen/katze-ernaehrung/quark-an-deine-katze-fuettern-erlaubt-oder-ungesund#:~:text=Prinzipiell%20ist%20Quark%20f%C3%BCr%20Katzen;Quark%20nicht%20so%20gut%20vertr%C3%A4gt.";Quark an deine Katze füttern - erlaubt oder ungesund? - Pets Deli
Was kann man einer Katze zum Trinken geben?;Kann ich meiner Katze Joghurt geben?;"   Einen Katzentrinkbrunnen aufstellen – fließendes Wasser animiert Katzen ganz automatisch mehr zu trinken – weshalb das so ist; haben wir hier erklärt. Das Trinkwasser mit etwas Hühnerbrühe (salzfrei); Thunfischwasser oder einem Teelöffel fettarmer Milch ""aromatisieren"". Einen Eiswürfel zum Futter oder Wasser geben.";"https://www.lucky-kitty.com/lucky-kitty/9-tipps-wie-ihre-katze-mehr-trinkt#:~:text=Einen%20Katzentrinkbrunnen%20aufstellen%20%E2%80%93%20flie%C3%9Fendes%20Wasser;zum%20Futter%20oder%20Wasser%20geben.";"10 Tipps; wie Ihre Katze mehr trinkt. - Lucky-Kitty"
Was ist besser für Katzen Milch oder Wasser?;Ist Leitungswasser gut für Katzen?;"Fazit. Weder normale noch lactosefreie Milch oder Katzenmilch ist das optimale Getränk für eine Katze. Was wirklich gesund ist und zu einer ausgewogenen Ernährung beiträgt; ist Wasser. Katzenmilch enthält keine beziehungsweise nur geringfügig Laktose und ist demnach mit Sicherheit besser als laktosehaltige Milch.";"https://www.mein-haustier.de/magazin/katzenmilch/#:~:text=Kalorien%20und%20Zusatzstoffe.-;Fazit;Sicherheit%20besser%20als%20laktosehaltige%20Milch.";Dürfen Katzen Milch trinken & ist Katzenmilch wirklich gesund?
Ist abgestandenes Wasser schädlich für Katzen?;Ist Leitungswasser gut für Katzen?;"Selbst wenn die Katze am liebsten drei Tage altes Wasser mag; sollte sie immer frisches Wasser zur Verfügung haben. Denn abgestandenes Wasser kann schnell zum Bakterienfänger werden. Trinkt die Katze dagegen plötzlich sehr viel und hastig; ist das möglicherweise ein Warnsignal.";"https://ch.virbac.com/home/conseils/pagecontent/alle-ratschlage/das-trinkverhalten-der-katze.html#:~:text=Selbst%20wenn%20die%20Katze%20am;ist%20das%20m%C3%B6glicherweise%20ein%20Warnsignal.";Das Trinkverhalten der Katze - Virbac Schweiz
Kann ich meiner Katze Joghurt geben?;Kann man Katzen gekochtes Ei geben?;"Eigelb; Quark oder Joghurt schmecken Katzen richtig gut und stellen zusätzliche Quellen für Proteine und Vitamine; aber auch für Kalzium dar. Die Zugabe von etwas Fleischsud erhöht den Wassergehalt des Futters.";"https://www.gu.de/gesunde-katzenernaehrung/#:~:text=Eigelb%2C%20Quark%20oder%20Joghurt%20schmecken;erh%C3%B6ht%20den%20Wassergehalt%20des%20Futters.";Gesunde Katzenernährung - GU Verlag
Welchen Joghurt dürfen Katzen essen?;Kann man Katzen gekochtes Ei geben?;"   Auf den Joghurt kommt es an    Ihre Fellnase darf jedoch nur Naturjoghurt ohne Zusätze genießen. Wenn Sie auf Nummer sicher gehen wollen; stellen Sie den Naturjoghurt aus H-Milch und speziellen Milchsäurebakterienkulturen im Joghurtbereiter selbst her. Dann ist er auf jeden Fall katzentauglich.";"https://einfachtierisch.de/katzen/katzenernaehrung/duerfen-katzen-joghurt-essen-81816#:~:text=Auf%20den%20Joghurt%20kommt%20es;er%20auf%20jeden%20Fall%20katzentauglich.";Dürfen Katzen Joghurt essen? - Einfachtierisch.de
Sind Karotten gut für Katzen?;Kann ich meiner Katze Banane geben?;"Wenn Ihr Hund oder Ihre Katze Karotten auch gerne pur mag; können Sie ihm oder ihr auch eine Karotte zwischendurch zum Knabbern geben. Manche Hunde fressen Karotten auch gerne roh. Bei Katzen wird es eher die gedämpfte Möhre sein; die beachtet wird. Karotten sind bekanntlich reich an Beta-Carotin.";"https://www.zentrum-der-gesundheit.de/bibliothek/umwelt/tiere/gemuese-fuer-hunde-katzen-ia#:~:text=Wenn%20Ihr%20Hund%20oder%20Ihre;bekanntlich%20reich%20an%20Beta%2DCarotin.";Gesunde Ernährung für Hund und Katze: Obst und Gemüse
Kann ich meiner Katze Rührei geben?;Kann ich meiner Katze Banane geben?;"Auch bei Rührei gilt: Nur ganz durchgegart Ihrer Katze zum Fressen geben und ohne die Zugabe von Öl; Butter oder anderen Fetten. Verzichten Sie zudem auf Gewürze bei der Zubereitung der gebratenen Eier. Salz & Co. können schädlich für Ihr Haustier sein.";"https://www.fellige-freunde.de/katzen/ernaehrung-und-gesundheit/duerfen-katzen-ei-essen/#:~:text=Auch%20bei%20R%C3%BChrei%20gilt%3A%20Nur;sch%C3%A4dlich%20f%C3%BCr%20Ihr%20Haustier%20sein.";Dürfen Katzen Ei essen? - fellige-freunde.de
Warum duckt sich meine Katze Wenn ich sie Streicheln will?;Wie nachtragend sind Katzen?;"   Meine Katze duckt sich immer beim Streicheln    Das Ducken gilt als Warnung und soll eine Grenzüberschreitung signalisieren. Falls du nicht darauf reagierst; könnte die Katze ihre Abwehrtechniken intensivieren; sie könnte also fauchen; beißen oder mit ausgefahrenen Krallen nach dir hauen.";"https://www.tierheim.de/katze-streicheln/#:~:text=Meine%20Katze%20duckt%20sich%20immer%20beim%20Streicheln&text=Das%20Ducken%20gilt%20als%20Warnung;ausgefahrenen%20Krallen%20nach%20dir%20hauen.";"Die Katze streicheln; ohne dass sie sich unwohl fühlt - Tierheim.de"
Wie entschuldigen bei Katze?;Wie nachtragend sind Katzen?;"So entschuldigst du dich richtig bei deiner Katze Schritt 1: Verbeuge dich vor der Katze und bitte sie um eine Audienz. Schritt 2: Gib ihr ein Leckerli. Schritt 3: Erkläre ihr; dass du dir deines Verbrechens vollkommen bewusst bist und es dir unendlich leid tut. Schritt 4: Gib ihr ein Leckerli. More items...";https://www.watson.ch/katze/tier/888953397-wie-entschuldigt-man-sich-richtig-bei-einer-katze-hier-ist-eine-einfache-anleitung;So entschuldigst du dich richtig bei deiner Katze - Watson
Wie kann ich meiner Katze zeigen dass ich sie lieb habe?;Was denkt meine Katze Wenn ich sie küsse?;"   8 Möglichkeiten um “Ich liebe dich” in Katzensprache zu sagen Streichel deine Katze da; wo sie es am liebsten mag. ...  Spiele mit deiner Katze; bis sie müde ist. ...  Biete deiner Katze ein Versteck. ...  Setze auf das langsame Blinzeln. ...  Mach mit beim Kopfstupser. ...  Erlaube deiner Katze; dich zu beschnuppern und abzulecken. More items...";https://www.rover.com/de/blog/8-moeglichkeiten-um-ich-liebe-dich-in-katzensprache-zu-sagen/;8 Möglichkeiten um “Ich liebe dich” in Katzensprache zu sagen - Rover
Wie zeigt man eine Katze Liebe?;Was denkt meine Katze Wenn ich sie küsse?;"   Aber es gibt noch weitere Signale; an denen Katzenfreund:innen ganz einfach erkennen; ob sie auf der Liste der Lieblingsmenschen ganz oben stehen. Die Katze verteilt liebevoll Kopfnüsse. ...  Kleine Geschenke bereichern die Freundschaft. ...  Die Katze lässt sich am Bauch streicheln. ...  Zublinzeln als freundliche Geste. More items... • 23 Feb 2022";https://uelzener.de/magazin/katze/haeufige-fragen/10-anzeichen-dass-deine-katze-dich-liebt/;"10 Anzeichen; dass deine Katze dich liebt - Uelzener"
Kann eine Katze lachen?;Kann sich eine Katze im Spiegel sehen?;"   Können Katzen lachen? Das täuscht. Wenn eine Katze ihr Schnäuzchen zu einem Lächeln verzieht; kann es sein; dass sie krank ist und Fieber hat. Ihr ist heiß und darum atmet sie stärker durch den Mund.";"https://www.servus.com/a/t/7-fakten-die-sie-noch-nicht-ueber-katzen-kennen#:~:text=K%C3%B6nnen%20Katzen%20lachen%3F;-Foto%3A%20iStock&text=Das%20t%C3%A4uscht.;sie%20st%C3%A4rker%20durch%20den%20Mund.";"7 Fakten; die Sie noch nicht über Katzen kennen - Servus"
Kann eine Katze frieren?;Kann sich eine Katze im Spiegel sehen?;"   Trotz Pelzmantel – auch Katzen können frieren. Wie viel Kälte eine Katze aushält; hängt auch von Verfassung; Alter; Gesundheit und Gewicht ab. Freigänger mit dichtem Winterfell trotzen Eis und Schnee eher; als Stubentiger mit gelegentlicher Frischluftzufuhr.";"https://www.green-petfood.de/articles/katze-winter#:~:text=Trotz%20Pelzmantel%20%E2%80%93%20auch%20Katzen%20k%C3%B6nnen;als%20Stubentiger%20mit%20gelegentlicher%20Frischluftzufuhr.";Katze im Winter: Heiße Tipps für kalte Tage - Green Petfood
Wie sehen die Katzen uns Menschen?;Kann sich eine Katze im Spiegel sehen?;"   Katzen haben ein größeres Gesichtsfeld als Menschen. Während wir es auf ungefähr 180 Grad bringen; stehen ihnen rund 200 Grad zur Verfügung. Das liegt daran; dass die Tiere an der Peripherie des Gesichtsfeldes mehr wahrnehmen können als wir. Bei Dämmerlicht machen Katzen eine besonders gute Figur. 18 Oct 2013";"https://www.spiegel.de/wissenschaft/natur/foto-experiment-so-sehen-katzen-die-welt-a-928383.html#:~:text=Katzen%20haben%20ein%20gr%C3%B6%C3%9Feres%20Gesichtsfeld;Katzen%20eine%20besonders%20gute%20Figur.";Foto-Experiment: So sehen Katzen die Welt - DER SPIEGEL
Warum machen Katzen beim Streicheln den Po hoch?;Kann eine Katze fernsehen?;"   Besonders der hintere Rücken der Samtpfoten ist eine sehr sensible Region; da hier viele Nervenenden verlaufen. Streichelt ihr über den Rücken eurer Fellnase und sie reckt daraufhin den Po in die Höhe; bedeutet das; dass ihr alles richtig macht. Eure Mieze fordert gewissermaßen ein; dass ihr genau dort weitermacht.";"https://einfachtierisch.de/katzen/katzenhaltung/katze-reckt-po-in-die-hoehe-warum-100382#:~:text=Besonders%20der%20hintere%20R%C3%BCcken%20der;dass%20ihr%20genau%20dort%20weitermacht.";Katze reckt Po in die Höhe: Warum tut sie das? - Einfachtierisch.de
Was mögen Katzen beim Kuscheln?;Kann eine Katze fernsehen?;"   Viele Katzen lieben es; mit ihren Menschen zu kuscheln und zu schmusen. Sie drücken sich fest an den Menschen; fordern Streicheleinheiten und manche legen sich sogar gerne auf Bauch oder Brust ihres Menschen; schnurren und schlafen dort ein. Manche Katzen fordern sogar von völlig fremden Menschen Streicheleinheiten. 16 Sept 2022";"https://herz-fuer-tiere.de/haustiere/katzen/verhalten-von-katzen/deshalb-kuscheln-manche-katzen-gerne-und-andere-gar-nicht#:~:text=Viele%20Katzen%20lieben%20es%2C%20mit;von%20v%C3%B6llig%20fremden%20Menschen%20Streicheleinheiten.";Deshalb kuscheln manche Katzen gerne und andere gar nicht
Was passiert wenn man mit der Katze nicht spielt?;Kann eine Katze fernsehen?;"Spielen ist für eine Katze genauso wichtig wie fressen und schlafen: es hält sie gesund und munter. Spielen bekämpft Langeweile; stimuliert den natürlichen Jagdtrieb und hält die Muskulatur und Gelenke gesund. Es hilft auch gegen Stress; Depressionen und verringert Problemverhalten; wie Möbelkratzen oder Beißen. 1 Mar 2019";"https://www.pawshake.de/blog/warum-will-meine-katze-nicht-spielen#:~:text=Spielen%20ist%20f%C3%BCr%20eine%20Katze;Problemverhalten%2C%20wie%20M%C3%B6belkratzen%20oder%20Bei%C3%9Fen.";Warum will meine Katze nicht spielen? | Pawshake Blog
Was ist der größte Liebesbeweis einer Katze?;Kann eine Katze dankbar sein?;"Schlafen auf dem Schoß     Manche Katzen haben eine Vorliebe dafür sich auf Schoß; Brust oder Bauch ihres Menschen zu legen; sobald sich die Möglichkeit dazu ergibt. Dieses Verhalten ist ein tiefer Vertrauensbeweis und ein klares Zeichen von Liebe.";"https://happycat.de/magazin/katzenwissen/was-ist-der-groesste-liebesbeweis-einer-katze/#:~:text=Schlafen%20auf%20dem%20Scho%C3%9F;ein%20klares%20Zeichen%20von%20Liebe.";Was ist der größte Liebesbeweis einer Katze? - Happy Cat
Warum reibt meine Katze ihre Mundwinkel an mir?;Kann eine Katze dankbar sein?;"Diese Geste ist eine Begrüßungsgeste für sie. An Gegenständen reiben sie sich; um ihren Duft freizusetzen. Auf diese Weise nehmen sie die Umwelt noch stärker wahr. Katzen haben Drüsen; die Pheromone an Kinn; Wangen; Stirn und sogar an den Pfoten absondern :). 22 Feb 2022";"https://petleo.net/2022/02/22/warum-reibt-sich-meine-katze-an-meinen-beinen/#:~:text=Diese%20Geste%20ist%20eine%20Begr%C3%BC%C3%9Fungsgeste;an%20den%20Pfoten%20absondern%20%3A).";Warum reibt sich meine Katze an meinen Beinen? - PetLEO
Was bedeutet es wenn Katzen ihre Pfote auf einen legen?;Kann eine Katze dankbar sein?;"Katzen zeigen ihre Zuneigung; indem sie ihre Pfoten sanft auf das Gesicht ihrer Halter legen. Meist schnurren sie auch und blinzeln; was ein Zeichen für Vertrauen ist. Eine leichte und zärtliche Berührung mit der Pfote zeigt; dass die Katze die Person liebt bzw. sich in ihrer Nähe wohlfühlt. 8 Feb 2022";"https://www.tag24.de/ratgeber/haustierratgeber/katzen-ratgeber/katze-beruehrt-mich-mit-pfote-2292309#:~:text=Katzen%20zeigen%20ihre%20Zuneigung%2C%20indem;sich%20in%20ihrer%20N%C3%A4he%20wohlf%C3%BChlt.";Warum berührt mich meine Katze mit ihrer Pfote? - TAG24
Was denkt meine Katze wer ich bin?;Wie lange kann sich eine Katze erinnern?;"Das Ergebnis war erstaunlich: Die Stubentiger haben ein feines Gespür für die menschlichen Emotionen und handeln sogar danach – ähnlich wie Hunde. Dabei orientieren sie sich an Stimme; Mimik und Bewegung. Dies in Kombination mit dem Aussehen und dem Geruch und die Katze erkennt ihre Lieblingsmenschen zweifelsfrei.";"https://www.tierwelt.ch/artikel/katzen/woran-das-busi-seinen-menschen-erkennt-407651#:~:text=Das%20Ergebnis%20war%20erstaunlich%3A%20Die;Katze%20erkennt%20ihre%20Lieblingsmenschen%20zweifelsfrei.";Woran das Büsi seinen Menschen erkennt - tierwelt.ch
Warum folgt mir meine Katze auf Schritt und Tritt?;Wie lange kann sich eine Katze erinnern?;"Katzen; die ihrem Menschen überall hin folgen; betteln häufig um dessen Aufmerksamkeit. Sie laufen vor die Beine; streichen um ihren Menschen herum und bezirzen ihn durch Gurren und leises Miauen. Häufig zeigt die Katze dieses Verhalten auch; um zu signalisieren; dass sie Hunger hat. 7 Sept 2020";"https://herz-fuer-tiere.de/haustiere/katzen/verhalten-von-katzen/warum-laeuft-mir-die-katze-staendig-hinterher#:~:text=Katzen%2C%20die%20ihrem%20Menschen%20%C3%BCberall;signalisieren%2C%20dass%20sie%20Hunger%20hat.";Warum läuft mir die Katze ständig hinterher? | herz-fuer-tiere.de
Können sich Katzen Gesichter merken?;Wie lange kann sich eine Katze erinnern?;"Wie auch immer diese Vorlieben entstehen – sie zeigen deutlich; dass Katzen sehr genau zwischen unterschiedlichen Personen unterscheiden können. Dabei spielen wahrscheinlich die Stimme und der Geruch eine große Rolle; während das Aussehen weniger entscheidend ist.";"https://www.miamor.de/magazin/erkennen-katzen-ihre-besitzer#:~:text=Wie%20auch%20immer%20diese%20Vorlieben;das%20Aussehen%20weniger%20entscheidend%20ist.";Erkennen Katzen ihre Besitzer? | Miamor
