Chirurgische Optionen bei chronischen Rückenschmerzen: Ein Überblick;
Injektionstherapie zur Schmerzlinderung bei Bandscheibenvorfällen: Was Sie wissen sollten;
Wann ist eine Rückenoperation notwendig? Ein Ratgeber für Patienten;
Die Rolle der Akupunktur in der modernen Schmerztherapie;
Pro und Kontra von Schmerzmitteln: Eine ausgewogene Diskussion;
Physikalische Therapie: Wie sie Rückenschmerzen lindert und die Mobilität verbessert;
Die Bedeutung der richtigen Diagnose bei Rückenschmerzen;
Wie wirksam sind Muskelrelaxantien bei Rückenschmerzen?;
Neue Entwicklungen in der minimalinvasiven Wirbelsäulenchirurgie;
Die Wirkung von Steroidinjektionen auf Rückenschmerzen: Eine Studienübersicht;
Schmerzmanagement: Strategien für eine wirksame Linderung;
Wie funktioniert Wirbelsäulenfusion bei chronischen Rückenbeschwerden?;
Könnte Physiotherapie die Antwort auf Ihre Rückenprobleme sein?;
Die neuesten Durchbrüche in der Rückenschmerztherapie;
Chiropraktik bei Rückenbeschwerden: Eine alternative Behandlung?;
Sollten Sie eine Wirbelsäulendekompression in Betracht ziehen?;
Was Sie über die Epiduralanästhesie wissen sollten;
So funktioniert die Mikrodiskektomie bei Bandscheibenvorfällen;
Cortison-Injektionen: Ein möglicher Weg zur Schmerzlinderung?;
Warum eine genaue Diagnose für die Behandlung von Rückenbeschwerden entscheidend ist;
Innovative medizinische Therapien für Ischiasbeschwerden;
Wie Stammzelltherapie helfen kann, Rückenschmerzen zu behandeln;
Was ist eine Laminotomie und wie kann sie helfen?;
Schmerztherapie: Eine umfassende Betrachtung der Möglichkeiten;
Die Wirksamkeit von Osteopathie bei Rückenbeschwerden;
Intrathekale Pumpen: Eine Lösung für schwer zu behandelnde Schmerzen?;
Wie funktioniert die Foraminotomie zur Linderung von Rückenbeschwerden?;
Pro und Kontra: Überlegungen zur Rückenoperation;
Neue Therapien in der Behandlung von Rückenproblemen;
Medikamentöse Behandlung: Ein Leitfaden zur Schmerzlinderung;
Neueste Entwicklungen in der Physiotherapie für Rückenprobleme;
Sollten Sie eine Kyphoplastie in Betracht ziehen?;
Kann eine Radiofrequenzablation Rückenschmerzen lindern?;
Innovative chirurgische Lösungen für Wirbelsäulenprobleme;
Wie Neurostimulatoren chronische Schmerzen bekämpfen können;
Akupunktur: Eine wirksame Methode zur Linderung von Rückenbeschwerden?;
Verstehen Sie die Vorteile der Schmerzblockade;
Myofasziale Freisetzung: Eine innovative Technik zur Behandlung von Rückenschmerzen;
Die Vorteile der Hydrotherapie für schmerzende Muskeln;
Die Wissenschaft hinter Muskelrelaxantien: Können sie bei Rückenbeschwerden helfen?;
Alternative Heilmittel: Die Rolle der Homöopathie bei Rückenschmerzen;
Wie TENS-Geräte zur Linderung von Schmerzen eingesetzt werden;
Faszien: Das vergessene Geheimnis zur Linderung von Rückenschmerzen?;
Die Vorteile der Prolotherapie bei chronischen Schmerzen;
Wie die medizinische Bildgebung bei der Diagnose von Rückenschmerzen hilft;
Medizinische Massagen: Eine wirksame Behandlungsmethode für Rückenbeschwerden?;
Die Rolle der Neuromodulation bei chronischen Rückenschmerzen;
Verstehen der Rolle von Schmerzmitteln bei der Behandlung von Rückenbeschwerden;
Die neuesten Durchbrüche in der Wirbelsäulenchirurgie;
Verstehen der Rolle der Injektionstherapie bei der Behandlung von Rückenbeschwerden;
Orthopädische Hilfsmittel: Können sie bei Rückenschmerzen helfen?;
Rückenschmerzen und Nervenblockade: Wie hilft es?;
Die Vorteile der Biofeedback-Therapie bei der Behandlung von Rückenbeschwerden;
Die Rolle der Ergotherapie bei Rückenschmerzen;
Neueste Behandlungsmethoden bei Skoliose;
Alternative Therapieoptionen zur Behandlung von Bandscheibenvorfällen;
Anästhetika und Rückenschmerzen: Wann sind sie angebracht?;
Die Auswirkungen der Kältetherapie auf Rückenschmerzen;
Wie die CBT-Therapie bei der Bewältigung von Rückenschmerzen hilft;
Die Rolle der spinalen Dekompression bei der Behandlung von Rückenbeschwerden;
Vorteile der Wirbelsäulenmanipulation für Rückenschmerzen: Wahrheit oder Mythos?;
Medikamentöse Therapie: Wann ist sie notwendig und wie sicher ist sie?;
Wirbelsäulengymnastik: Wie es Ihnen helfen kann, Rückenschmerzen zu lindern;
Die neuesten Fortschritte in der Schmerztherapie: Wie sie helfen können;
Die Rolle von Epiduralanästhesie bei der Behandlung von Rückenschmerzen;
Lasertherapie für Rückenschmerzen: Was Sie wissen müssen;
Die Rolle von Muskelrelaxantien bei der Behandlung von Rückenschmerzen;
Chiropraktik und Osteopathie: Ein Vergleich der Behandlungsmethoden;
Rückenorthesen: Ihre Rolle bei der Behandlung und Prävention von Rückenschmerzen;
Nicht-chirurgische Therapieoptionen für Bandscheibenvorfälle;
Nervenblockaden zur Schmerzlinderung: Was Sie wissen sollten;
Der Einfluss der Diät auf Rückenschmerzen: Was die Forschung sagt;
Die Rolle von Steroiden bei der Behandlung von Rückenschmerzen;
Rückenschmerzen und Yoga: Wie Yoga bei der Schmerzbehandlung helfen kann;
Die Bedeutung der physikalischen Therapie bei der Rehabilitation von Rückenschmerzen;
Akupressur und Rückenschmerzen: Eine wirksame Kombination?;
Wie kognitive Verhaltenstherapie bei der Bewältigung von Rückenschmerzen helfen kann;
Die Vorteile von Wärmebehandlungen bei Rückenschmerzen;
Rücken- und Wirbelsäulenoperationen: Wann sie notwendig sind und was sie beinhalten;
Verstehen der Rolle von Injektionstherapien bei Rückenschmerzen;
Die Verwendung von Muskelrelaxantien bei der Behandlung von Rückenschmerzen;
Der Einfluss von Entspannungstechniken auf Rückenschmerzen;
Die Wissenschaft hinter der Kryotherapie und ihre Vorteile bei Rückenschmerzen;
Wie hilft die Elektrotherapie bei der Linderung von Rückenschmerzen?;
Die Auswirkungen von Akupunktur auf Rückenschmerzen: Ein tieferer Einblick